,inning,batting_team,bowling_team,batsman,bowler,batsman_name,non_striker,bowler_name,bat_right_handed,ovr,runs_batter,runs_w_extras,extras,x,y,z,landing_x,landing_y,ended_x,ended_y,ball_speed,cumul_runs,wicket,wicket_method,who_out,control,extras_type,comm
201,1,Pakistan,South Africa,317273,44936,Umar Akmal,Misbah-ul-Haq,AB de Villiers,y,32.4,1.0,1.0,0.0,312.0,181.0,3.0,0.02,6.27,0.20,0.63,75.048,162.0,False,,,1,,straying on the pads as this is worked away now behind of square
202,1,Pakistan,South Africa,41378,44936,Misbah-ul-Haq,Umar Akmal,AB de Villiers,y,32.5,1.0,1.0,0.0,119.0,182.0,6.0,-0.23,6.18,-0.26,0.72,75.390,163.0,False,,,1,,gets in a good stride before executing the tap-and-run outside his off stump to perfection
203,1,Pakistan,South Africa,317273,44936,Umar Akmal,Misbah-ul-Haq,AB de Villiers,y,32.6,1.0,1.0,0.0,306.0,232.0,3.0,-0.37,10.08,-0.50,1.03,68.802,164.0,False,,,1,,"short enough for Umar to get under as he carts away the bowler through cow corner, but this time is unable to get it all the way"
204,1,Pakistan,South Africa,317273,40618,Umar Akmal,Misbah-ul-Haq,Imran Tahir,y,33.1,0.0,0.0,0.0,215.0,129.0,1.0,0.21,4.17,0.22,0.70,52.631,164.0,False,,,1,,flighted delivery on the pads which he tries to paddle away through fine leg
205,1,Pakistan,South Africa,317273,40618,Umar Akmal,Misbah-ul-Haq,Imran Tahir,y,33.2,0.0,0.0,0.0,199.0,179.0,3.0,-0.06,7.73,0.16,0.58,-2.237,164.0,False,,,0,,"drops it a bit short now as Umar is deceived by the quicker one, with this rapping the back thigh pad as he looked to belt him through cow corner. Goes for the appeal, but was definitely going down leg, and there appeared to be an inside-edge too"
206,1,Pakistan,South Africa,317273,40618,Umar Akmal,Misbah-ul-Haq,Imran Tahir,y,33.3,0.0,0.0,0.0,206.0,197.0,4.0,0.08,1.88,0.18,0.50,52.356,164.0,False,,,1,,"tossed up and on off, driven towards mid-on by the batsman"
207,1,Pakistan,South Africa,317273,40618,Umar Akmal,Misbah-ul-Haq,Imran Tahir,y,33.4,0.0,0.0,0.0,152.0,192.0,6.0,-0.02,4.20,-0.04,0.73,54.054,164.0,False,,,1,,"slower and just outside off, Akmal lunges forward and blocks"
208,1,Pakistan,South Africa,317273,40618,Umar Akmal,Misbah-ul-Haq,Imran Tahir,y,33.5,1.0,1.0,0.0,324.0,219.0,3.0,-0.25,7.54,0.08,0.88,55.405,165.0,False,,,1,,"the wrong 'un from Tahir.  Akmal rocks back and pulls it towards deep mid-wicket. JP fumbles, but they decide to take on his arm anyways"
209,1,Pakistan,South Africa,41378,40618,Misbah-ul-Haq,Umar Akmal,Imran Tahir,y,33.6,0.0,0.0,0.0,192.0,199.0,4.0,-0.25,4.43,0.00,0.79,55.264,165.0,False,,,1,,"flighted delivery and just outside off, Misbah gets well forward and blocks it"
210,1,Pakistan,South Africa,317273,297583,Umar Akmal,Misbah-ul-Haq,Kyle Abbott,y,34.1,0.0,0.0,0.0,116.0,191.0,6.0,-0.54,5.90,-0.47,0.67,82.491,165.0,False,,,1,,full delivery outside of off which is driven to the short cover fielder
211,1,Pakistan,South Africa,317273,297583,Umar Akmal,Misbah-ul-Haq,Kyle Abbott,y,34.2,0.0,0.0,0.0,161.0,230.0,5.0,-0.18,3.75,-0.06,0.49,83.560,165.0,False,,,1,,"steered down to mid-off, but can't pinch a single"
212,1,Pakistan,South Africa,317273,297583,Umar Akmal,Misbah-ul-Haq,Kyle Abbott,y,34.3,1.0,1.0,0.0,290.0,195.0,3.0,-0.02,3.60,0.13,0.44,82.060,166.0,False,,,1,,full delivery on the pads which is flicked away through square-leg
213,1,Pakistan,South Africa,41378,297583,Misbah-ul-Haq,Umar Akmal,Kyle Abbott,y,34.4,0.0,0.0,0.0,161.0,239.0,5.0,-0.40,4.66,-0.30,0.53,83.575,166.0,False,,,1,,"driven firmly through long off, but hit a bit too well then he would have liked in the end"
214,1,Pakistan,South Africa,41378,297583,Misbah-ul-Haq,Umar Akmal,Kyle Abbott,y,34.5,0.0,0.0,0.0,135.0,194.0,6.0,-0.39,7.17,-0.23,0.79,82.248,166.0,False,,,1,,defends away this back of a length to the off side
215,1,Pakistan,South Africa,41378,297583,Misbah-ul-Haq,Umar Akmal,Kyle Abbott,y,34.6,1.0,1.0,0.0,271.0,203.0,3.0,-0.36,7.97,-0.17,0.93,79.764,167.0,False,,,1,,tucks away a run square off the wicket on the leg side to end the over
216,1,Pakistan,South Africa,41378,47492,Misbah-ul-Haq,Umar Akmal,Dale Steyn,y,35.1,1.0,1.0,0.0,297.0,115.0,2.0,-0.19,7.69,-0.17,0.77,88.244,168.0,False,,,1,,on target right away as this fuller one is defended back towards the bowler
217,1,Pakistan,South Africa,317273,47492,Umar Akmal,Misbah-ul-Haq,Dale Steyn,y,35.2,0.0,0.0,0.0,118.0,154.0,7.0,-0.39,8.69,-0.48,0.99,89.060,168.0,False,,,1,,punches away this length delivery towards the off side
218,1,Pakistan,South Africa,317273,47492,Umar Akmal,Misbah-ul-Haq,Dale Steyn,y,35.3,4.0,4.0,0.0,336.0,266.0,3.0,-0.43,10.19,-0.59,1.39,85.239,172.0,False,,,1,,marginally short outside of off and Umar dispatches Steyn over midwicket for a well-timed pull. Greeted by loud cheers from the crowd as this traveled to the boundary
219,1,Pakistan,South Africa,317273,47492,Umar Akmal,Misbah-ul-Haq,Dale Steyn,y,35.4,0.0,0.0,0.0,0.0,0.0,0.0,-0.31,11.50,-0.12,1.60,85.298,172.0,False,,,1,,Steyn retaliates with a fierce bouncer which Umar is not at all interested in tackling with
220,1,Pakistan,South Africa,317273,47492,Umar Akmal,Misbah-ul-Haq,Dale Steyn,y,35.5,1.0,1.0,0.0,301.0,97.0,2.0,-0.15,8.95,0.03,1.00,87.120,173.0,False,,,1,,short of a length on the pads which is tucked away through fine leg
221,1,Pakistan,South Africa,41378,47492,Misbah-ul-Haq,Umar Akmal,Dale Steyn,y,35.6,1.0,1.0,0.0,202.0,182.0,3.0,-0.29,10.62,-0.25,1.39,87.073,174.0,False,,,1,,"tries to negotiate one away on the leg side, but doesn't quite get it away."
222,1,Pakistan,South Africa,41378,46538,Misbah-ul-Haq,Umar Akmal,Morne Morkel,y,36.1,1.0,1.0,0.0,106.0,56.0,8.0,-0.61,8.41,-0.61,0.94,79.239,175.0,False,,,1,,"looking to guide one past Amla at slip, but he is able to do well to nip this in the bud"
223,1,Pakistan,South Africa,317273,46538,Umar Akmal,Misbah-ul-Haq,Morne Morkel,y,36.2,0.0,0.0,0.0,0.0,0.0,0.0,-0.80,3.55,-0.81,0.50,80.698,175.0,False,,,0,,"tests him out with a fuller one which Akmal looked to scythe through the covers as he got low, but was late on it"
224,1,Pakistan,South Africa,317273,46538,Umar Akmal,Misbah-ul-Haq,Morne Morkel,y,36.3,0.0,0.0,0.0,113.0,167.0,6.0,-0.25,10.21,-0.14,1.40,87.007,175.0,False,,,0,,"you just can't keep Rillee out of the action as this back of a length catches the outside edge to offer a chance to him at backward point. He does his best, but is unable to grasp the chance"
225,1,Pakistan,South Africa,317273,46538,Umar Akmal,Misbah-ul-Haq,Morne Morkel,y,36.4,0.0,0.0,0.0,121.0,188.0,6.0,-0.42,9.53,-0.21,1.21,86.124,175.0,False,,,1,,rides on top of the bounce of this one pitched outside of off stump
226,1,Pakistan,South Africa,317273,46538,Umar Akmal,Misbah-ul-Haq,Morne Morkel,y,36.5,0.0,0.0,0.0,248.0,256.0,4.0,-0.53,10.94,-0.38,1.64,83.567,175.0,True,caught,317273,0,,"the extra bounce undoes Akmal as he looks to target cow corner with another lusty blow, but ends up top-edging this to AB at midwicket, who is able to complete the catch despite falling onto his back. There was a moment where he looked like he might have grounded it as he had a look of astonishment on his face, but I have come to believe that not even AB can believe himself at times."
227,1,Pakistan,South Africa,42639,46538,Shahid Afridi,Misbah-ul-Haq,Morne Morkel,y,36.6,0.0,0.0,0.0,0.0,0.0,0.0,-0.65,8.99,-0.82,1.10,86.121,175.0,False,,,0,,"no need for a sighter as this is Afridi we are talking about. Straight away looks to hammer this short and wide delivery from the bowler over the covers, but is late on the ball"
228,1,Pakistan,South Africa,41378,40618,Misbah-ul-Haq,Shahid Afridi,Imran Tahir,y,37.1,1.0,1.0,0.0,287.0,89.0,2.0,-0.34,2.51,-0.32,0.60,52.416,176.0,False,,,1,,sweeps this one drifted in on middle and leg through backward square
229,1,Pakistan,South Africa,42639,40618,Shahid Afridi,Misbah-ul-Haq,Imran Tahir,y,37.2,1.0,1.0,0.0,264.0,193.0,3.0,0.13,3.00,0.27,0.52,-2.237,177.0,False,,,1,,turns away a run onto the leg side now
230,1,Pakistan,South Africa,41378,40618,Misbah-ul-Haq,Shahid Afridi,Imran Tahir,y,37.3,0.0,0.0,0.0,201.0,205.0,4.0,-0.05,2.66,-0.16,0.06,62.353,177.0,False,,,1,,flighted on middle and leg as this is defended away to the leg side with soft hands
231,1,Pakistan,South Africa,41378,40618,Misbah-ul-Haq,Shahid Afridi,Imran Tahir,y,37.4,1.0,1.0,0.0,296.0,189.0,3.0,0.02,3.56,0.13,0.51,58.340,178.0,False,,,1,,"this time is able to steer it away through midwicket for one, and despite JP's fumble, they don't look to concerned to return back for a second"
232,1,Pakistan,South Africa,42639,40618,Shahid Afridi,Misbah-ul-Haq,Imran Tahir,y,37.5,6.0,6.0,0.0,109.0,352.0,5.0,,,,,,184.0,False,,,1,,sees how short the boundaries are and backs himself with this powerful bludgeon over long off which just sailed over the rope
233,1,Pakistan,South Africa,42639,40618,Shahid Afridi,Misbah-ul-Haq,Imran Tahir,y,37.6,0.0,0.0,0.0,0.0,0.0,0.0,0.21,5.37,0.71,0.77,58.356,184.0,False,,,0,,"backs away as he winds up for another big heave, this time over midwicket, but gets far too early into the stroke as the ball ricochets of his thigh guard through to third man"
234,1,Pakistan,South Africa,41378,297583,Misbah-ul-Haq,Shahid Afridi,Kyle Abbott,y,38.1,0.0,0.0,0.0,120.0,150.0,7.0,-0.44,8.20,-0.28,0.90,82.804,184.0,False,,,1,,"looking to guide away a run through the gully region, but is not able to"
235,1,Pakistan,South Africa,41378,297583,Misbah-ul-Haq,Shahid Afridi,Kyle Abbott,y,38.2,1.0,1.0,0.0,270.0,244.0,3.0,-0.34,6.20,-0.24,0.70,82.780,185.0,False,,,1,,"directs away this fuller length outside of off past the silly mid-on, who despite getting a hand on this, is unable to prevent the run"
236,1,Pakistan,South Africa,42639,297583,Shahid Afridi,Misbah-ul-Haq,Kyle Abbott,y,38.3,2.0,2.0,0.0,304.0,226.0,3.0,-0.22,8.22,-0.02,0.82,83.361,187.0,False,,,1,,"length delivery which he looked to slam over cow corner, but doesn't quite middle it as this is pulled back around deep midwicket"
237,1,Pakistan,South Africa,42639,297583,Shahid Afridi,Misbah-ul-Haq,Kyle Abbott,y,38.4,1.0,1.0,0.0,316.0,211.0,3.0,-0.12,6.81,0.07,0.74,84.958,188.0,False,,,1,,"looking to cart it high and handsome over the leg side, but ends up miscuing the stoke as AB, fielding the ball at deep midwicket, is able to get to the ball"
238,1,Pakistan,South Africa,41378,297583,Misbah-ul-Haq,Shahid Afridi,Kyle Abbott,y,38.5,4.0,4.0,0.0,32.0,86.0,7.0,-0.58,10.23,-0.74,1.24,85.466,192.0,False,,,1,,now it is Misbah's turn to attack as he ramps this shorter one outside off past the third man fielder to the boundary
239,1,Pakistan,South Africa,41378,297583,Misbah-ul-Haq,Shahid Afridi,Kyle Abbott,y,38.6,1.0,1.0,0.0,269.0,220.0,3.0,-0.29,8.37,-0.13,0.93,83.177,193.0,False,,,1,,able to get away a run through the leg side now to keep the strike
240,1,Pakistan,South Africa,41378,47492,Misbah-ul-Haq,Shahid Afridi,Dale Steyn,y,39.1,1.0,1.0,0.0,262.0,47.0,1.0,-0.19,9.02,-0.05,0.95,85.027,194.0,False,,,1,,short of a length and tucked away through to deep fine leg
241,1,Pakistan,South Africa,42639,47492,Shahid Afridi,Misbah-ul-Haq,Dale Steyn,y,39.2,1.0,1.0,0.0,130.0,32.0,8.0,-0.10,6.99,0.01,0.89,85.234,195.0,False,,,0,,full length which is straight on the stumps as somehow Afridi is able to weasel this away through third man thanks to the leading edge of the bat as he looked to defend leg-side
242,1,Pakistan,South Africa,41378,47492,Misbah-ul-Haq,Shahid Afridi,Dale Steyn,y,39.3,0.0,0.0,0.0,174.0,199.0,5.0,-0.37,9.21,-0.39,1.16,85.228,195.0,False,,,1,,nicely on top of the bounce of this back of a length outside of off
243,1,Pakistan,South Africa,41378,47492,Misbah-ul-Haq,Shahid Afridi,Dale Steyn,y,39.4,1.0,1.0,0.0,133.0,137.0,7.0,-0.50,8.41,-0.55,1.09,86.815,196.0,False,,,1,,dabs away a run behind of square on the off side as Misbah brings up his <b>42nd ODI fifty</b>. Still looking for that elusive century though...
244,1,Pakistan,South Africa,42639,47492,Shahid Afridi,Misbah-ul-Haq,Dale Steyn,y,39.5,0.0,0.0,0.0,0.0,0.0,0.0,-0.27,11.48,-0.21,1.47,-2.237,196.0,False,,,1,,happy to duck under this shorter one on off stump from Dale
245,1,Pakistan,South Africa,42639,47492,Shahid Afridi,Misbah-ul-Haq,Dale Steyn,y,39.6,0.0,0.0,0.0,0.0,0.0,0.0,-0.44,11.38,-0.62,1.42,85.115,196.0,False,,,1,,weaves away from the path of this short delivery well wide of off
246,1,Pakistan,South Africa,41378,297583,Misbah-ul-Haq,Shahid Afridi,Kyle Abbott,y,40.1,1.0,1.0,0.0,77.0,88.0,7.0,-0.59,10.69,-0.45,1.33,85.047,197.0,False,,,1,,shortish length outside of off which is run down to a squarish third man
247,1,Pakistan,South Africa,42639,297583,Shahid Afridi,Misbah-ul-Haq,Kyle Abbott,y,40.2,1.0,1.0,0.0,223.0,218.0,4.0,0.02,6.07,0.22,0.72,84.003,198.0,False,,,1,,begins with a fuller length on the pads which is eased away through mid-on
248,1,Pakistan,South Africa,41378,297583,Misbah-ul-Haq,Shahid Afridi,Kyle Abbott,y,40.3,1.0,1.0,0.0,55.0,163.0,7.0,-0.50,7.59,-0.24,0.76,83.719,199.0,False,,,1,,fuller length which he is able to squirt away past point
249,1,Pakistan,South Africa,42639,297583,Shahid Afridi,Misbah-ul-Haq,Kyle Abbott,y,40.4,4.0,4.0,0.0,10.0,217.0,6.0,-0.51,7.17,-0.48,0.76,84.998,203.0,False,,,1,,backs away before clobbering this length delivery over the covers for four. Was in a great position to attack over the region.
250,1,Pakistan,South Africa,42639,297583,Shahid Afridi,Misbah-ul-Haq,Kyle Abbott,y,40.5,0.0,0.0,0.0,139.0,243.0,5.0,-0.13,7.44,0.22,0.94,87.425,203.0,False,,,0,,backs away again except this time he hammers it straight to the man at extra-cover
251,1,Pakistan,South Africa,42639,297583,Shahid Afridi,Misbah-ul-Haq,Kyle Abbott,y,40.6,0.0,0.0,0.0,212.0,235.0,4.0,-0.32,0.37,-0.30,0.08,83.336,203.0,False,,,1,,"looking for the yorker but dishes a low, full toss which is struck away to the fielder at long on"
252,1,Pakistan,South Africa,41378,47492,Misbah-ul-Haq,Shahid Afridi,Dale Steyn,y,41.1,2.0,2.0,0.0,245.0,52.0,1.0,-0.02,6.04,0.15,0.77,77.832,205.0,False,,,1,,full delivery on the pads which is turned away through fine leg for a brace
253,1,Pakistan,South Africa,41378,47492,Misbah-ul-Haq,Shahid Afridi,Dale Steyn,y,41.2,1.0,1.0,0.0,96.0,66.0,8.0,-0.08,10.07,0.17,1.50,85.455,206.0,False,,,1,,back of a length which he is able to ramp away to third man
254,1,Pakistan,South Africa,42639,47492,Shahid Afridi,Misbah-ul-Haq,Dale Steyn,y,41.3,6.0,6.0,0.0,321.0,329.0,4.0,-0.32,10.22,-0.47,1.33,85.211,212.0,False,,,1,,"Afridi wants some of Steyn as he pulls this length delivery way over the cow corner boundary for a huge six. Only went 73-metres, but it must have gone at least 80m straight up on its own"
255,1,Pakistan,South Africa,42639,47492,Shahid Afridi,Misbah-ul-Haq,Dale Steyn,y,41.4,0.0,0.0,0.0,328.0,182.0,3.0,-0.24,11.35,-0.09,1.55,84.888,212.0,True,caught,42639,0,,"going for one to many blows as Steyn finally has the last laugh as he delivers a short ball which Afridi  goes after. He is cramped for space as this top-edge flies over to deep square-leg, who is able to safely get under it. Big wicket for South Africa as they look to quell as many runs as possible in these latter stages of the innings"
256,1,Pakistan,South Africa,41378,47492,Misbah-ul-Haq,Wahab Riaz,Dale Steyn,y,41.5,0.0,0.0,0.0,142.0,196.0,6.0,-0.34,11.04,-0.10,1.62,90.080,212.0,False,,,1,,shortish length right up in the that awkward area as he just about fends it away
257,1,Pakistan,South Africa,41378,47492,Misbah-ul-Haq,Wahab Riaz,Dale Steyn,y,41.6,0.0,0.0,0.0,213.0,189.0,3.0,-0.21,8.62,-0.10,0.99,87.477,212.0,False,,,1,,"looking for a quick single on the leg-side, but is held by the close-in fielder"
258,1,Pakistan,South Africa,43590,40618,Wahab Riaz,Misbah-ul-Haq,Imran Tahir,y,42.1,0.0,0.0,0.0,0.0,0.0,0.0,-0.11,3.60,-0.11,0.42,57.807,212.0,True,leg before wicket,43590,0,,"looking to reach out and sweep this quicker one drifted in on and around off as this out right away as the umpire gives it. They decide to go for the <b>review</b> though. Looks like this definitely struck in line, and as it was low, there is every indication this would go on to hit the stumps. Ends up being umpire's call for both impact and wicket's hitting, but because the original decision was out, he has to go"
259,1,Pakistan,South Africa,317252,40618,Sohail Khan,Misbah-ul-Haq,Imran Tahir,y,42.2,1.0,1.0,0.0,225.0,299.0,4.0,-0.10,3.00,0.17,0.30,52.481,213.0,False,,,1,,"gets away with this chip through long on as Tahir gets this floater wrong, dishing up a low, full toss instead on middle and leg"
260,1,Pakistan,South Africa,41378,40618,Misbah-ul-Haq,Sohail Khan,Imran Tahir,y,42.3,0.0,0.0,0.0,175.0,189.0,5.0,0.13,5.54,0.19,0.75,59.087,213.0,False,,,1,,safely negotiates this one which turns in from middle
261,1,Pakistan,South Africa,41378,40618,Misbah-ul-Haq,Sohail Khan,Imran Tahir,y,42.4,1.0,1.0,0.0,57.0,235.0,6.0,-0.38,-0.06,-0.38,0.06,58.517,214.0,False,,,1,,"tries to swat away this low, full toss through the covers, but ends up finding AB at mid-off, with the pair taking him on, and successfully in the end"
262,1,Pakistan,South Africa,317252,40618,Sohail Khan,Misbah-ul-Haq,Imran Tahir,y,42.5,0.0,0.0,0.0,164.0,139.0,8.0,-0.40,5.74,-0.11,0.70,50.337,214.0,False,,,1,,"looks to dab away a run through gully, but no can do"
263,1,Pakistan,South Africa,317252,40618,Sohail Khan,Misbah-ul-Haq,Imran Tahir,y,42.6,0.0,0.0,0.0,0.0,0.0,0.0,0.17,2.94,0.24,0.44,58.873,214.0,False,,,0,,is late on this quicker one darted in on leg stump as he looked for the flick behind square
264,1,Pakistan,South Africa,41378,47492,Misbah-ul-Haq,Sohail Khan,Dale Steyn,y,43.1,0.0,4.0,4.0,236.0,13.0,1.0,0.38,7.21,0.88,0.82,-2.237,218.0,False,,,0,Lb,"backs away as he looks to clear the off side, with Steyn seeing this early enough to follow him with a leg-side delivery which is then tickled away fine with the angle to the boundary. Ends up being called leg byes though by the umpire"
265,1,Pakistan,South Africa,41378,47492,Misbah-ul-Haq,Sohail Khan,Dale Steyn,y,43.2,0.0,0.0,0.0,207.0,187.0,3.0,-0.33,9.51,-0.35,1.15,83.851,218.0,False,,,1,,"defends this length delivery outside off which is turned away to the leg side. Sohail was looking to get to the other end, but Misbah refused the run"
266,1,Pakistan,South Africa,41378,47492,Misbah-ul-Haq,Sohail Khan,Dale Steyn,y,43.3,0.0,0.0,0.0,110.0,167.0,6.0,-0.34,1.71,-0.33,0.23,86.798,218.0,False,,,1,,"backs away again before reaching low to this yorker just outside of off, with the ball ending up at backward point"
267,1,Pakistan,South Africa,41378,47492,Misbah-ul-Haq,Sohail Khan,Dale Steyn,y,43.4,0.0,0.0,0.0,120.0,163.0,7.0,,,,,,218.0,False,,,1,,short and wide as Misbah fails to connect with this cut shot through the covers
268,1,Pakistan,South Africa,41378,47492,Misbah-ul-Haq,Sohail Khan,Dale Steyn,y,43.5,0.0,0.0,0.0,128.0,22.0,8.0,-0.47,10.33,-0.66,1.29,-2.237,218.0,True,caught,41378,0,,"and the plan comes off perfectly for Steyn as Misbah goes chasing after this short delivery outside of off which he ramps straight to Morne, who barely had to move from his original position at third man. Misbah has to go as Pakistan look to blast as many as possible in these remaining overs"
269,1,Pakistan,South Africa,317252,47492,Sohail Khan,Rahat Ali,Dale Steyn,y,43.6,0.0,0.0,0.0,164.0,137.0,8.0,-0.34,7.38,-0.37,0.72,89.123,218.0,False,,,1,,length delivery which he edges away rather streakily to the first slip
270,1,Pakistan,South Africa,323244,46538,Rahat Ali,Sohail Khan,Morne Morkel,y,44.1,0.0,0.0,0.0,0.0,0.0,0.0,-0.35,11.01,-0.12,1.77,85.798,218.0,False,,,1,,ducks under this short length on off stump
271,1,Pakistan,South Africa,323244,46538,Rahat Ali,Sohail Khan,Morne Morkel,y,44.2,0.0,0.0,0.0,0.0,0.0,0.0,-0.17,9.57,0.31,1.36,86.198,218.0,False,,,0,,"another steepler, going on a leg-side slant, as Rahat ducks under once more"
272,1,Pakistan,South Africa,323244,46538,Rahat Ali,Sohail Khan,Morne Morkel,y,44.3,0.0,0.0,0.0,128.0,193.0,6.0,-0.46,10.18,-0.07,1.17,-2.237,218.0,False,,,1,,"short enough for the short-arm pull, but this is mistimed to the man at silly mid-on"
273,1,Pakistan,South Africa,323244,46538,Rahat Ali,Sohail Khan,Morne Morkel,y,44.4,0.0,0.0,0.0,125.0,193.0,6.0,-0.08,3.88,0.13,0.45,90.293,218.0,False,,,1,,"backs away to try and scythe this fuller delivery through the covers, but is stopped by the fielder in question"
274,1,Pakistan,South Africa,323244,46538,Rahat Ali,Sohail Khan,Morne Morkel,y,44.5,1.0,1.0,0.0,110.0,70.0,8.0,-0.36,9.80,-0.11,1.30,86.075,219.0,False,,,1,,short of a length which he is able to squirt away past backward point to get off the mark
275,1,Pakistan,South Africa,317252,46538,Sohail Khan,Rahat Ali,Morne Morkel,y,44.6,1.0,1.0,0.0,294.0,61.0,2.0,-0.16,9.58,0.36,1.20,82.130,220.0,False,,,1,,back of a length and shaping down the pads as this is eased behind towards long leg
276,1,Pakistan,South Africa,317252,47492,Sohail Khan,Rahat Ali,Dale Steyn,y,45.1,1.0,1.0,0.0,264.0,50.0,1.0,-0.12,8.01,0.08,0.78,87.921,221.0,False,,,1,,turned away to the leg side off the back foot as they scamper a single
277,1,Pakistan,South Africa,323244,47492,Rahat Ali,Sohail Khan,Dale Steyn,y,45.2,0.0,0.0,0.0,151.0,239.0,5.0,0.05,6.11,0.20,0.69,87.403,221.0,True,caught,323244,0,,"length delivery on middle and leg which he tried to hit through the line to get over long off, but instead miscues to the man at mid-off, who is able to run backwards and to the left to catch this safely. Tahir put in fine work at the position as Pakistan go nine down"
278,1,Pakistan,South Africa,317252,47492,Sohail Khan,Mohammad Irfan,Dale Steyn,y,45.3,0.0,0.0,0.0,0.0,0.0,0.0,-0.32,12.33,-0.12,1.97,87.198,221.0,False,,,1,,tries him out with a shorter one which Sohail is happy to get under
279,1,Pakistan,South Africa,317252,47492,Sohail Khan,Mohammad Irfan,Dale Steyn,y,45.4,0.0,0.0,0.0,235.0,162.0,2.0,-0.01,8.23,0.19,0.86,86.618,221.0,False,,,1,,"tries to find a single through square-leg, with Irfan backing up way too much as he is sent back by Sohail, with the throw at the non-striker's missing the mark. Would have been long gone had it struck"
280,1,Pakistan,South Africa,317252,47492,Sohail Khan,Mohammad Irfan,Dale Steyn,y,45.5,0.0,0.0,0.0,0.0,0.0,0.0,-0.15,11.29,0.30,1.39,84.436,221.0,False,,,1,,under short one which Sohail is content not to tackle
281,1,Pakistan,South Africa,317252,47492,Sohail Khan,Mohammad Irfan,Dale Steyn,y,45.6,0.0,0.0,0.0,238.0,183.0,3.0,-0.14,2.96,-0.05,0.38,85.552,221.0,False,,,1,,"slips in the yorker on off stump as Sohail, looking to get a single to keep the strike, decides not to take it as Irfan was guilty of ball-watching as this one ended up near midwicket"
282,1,Pakistan,South Africa,429981,46538,Mohammad Irfan,Sohail Khan,Morne Morkel,y,46.1,0.0,0.0,0.0,0.0,0.0,0.0,-0.32,12.27,0.00,1.97,89.397,221.0,False,,,1,,plenty of chin music in these latter stages as Irfan sways away from the line
283,1,Pakistan,South Africa,429981,46538,Mohammad Irfan,Sohail Khan,Morne Morkel,y,46.2,0.0,0.0,0.0,0.0,0.0,0.0,-0.38,7.74,-0.36,1.09,84.192,221.0,False,,,0,,"fuller length, outside of off, as Irfan backs away in an attempt to belt this over long off, but fails to make a connection"
284,1,Pakistan,South Africa,429981,46538,Mohammad Irfan,Sohail Khan,Morne Morkel,y,46.3,1.0,1.0,0.0,248.0,33.0,1.0,0.10,2.54,0.26,0.33,83.001,222.0,False,,,0,,yorker on leg stump which is French cut away through the legs towards the fielder at long leg
285,1,Pakistan,South Africa,317252,46538,Sohail Khan,Mohammad Irfan,Morne Morkel,y,46.4,0.0,0.0,0.0,157.0,237.0,5.0,-0.12,7.20,0.17,0.93,86.798,222.0,True,caught,317252,0,,"looking to clobber Morne over midwicket, but ends up getting a top-edge as JP is able to get under this one swirling over mid-off to finish off the Pakistan innings with just two balls left"
286,2,South Africa,Pakistan,379143,429981,Quinton de Kock,Hashim Amla,Mohammad Irfan,n,0.1,0.0,0.0,0.0,195.0,148.0,1.0,0.23,8.45,0.16,1.02,81.510,0.0,False,,,0,,gets some swing away from the left-hander just outside of off as de Kock defends it away
287,2,South Africa,Pakistan,379143,429981,Quinton de Kock,Hashim Amla,Mohammad Irfan,n,0.2,0.0,0.0,0.0,183.0,156.0,1.0,0.14,7.04,0.08,1.01,85.715,0.0,True,caught,379143,0,,"Irfan sets Eden Park on fire as he delivers a peach of a delivery outside of off which de Kock, looking to angle away through mid-on, ends up getting a thick outside edge as Sarfraz completes the take from behind. The umpire doesn't hesitate too long to give this one, as Pakistan have South Africa one down with nothing on the board"
288,2,South Africa,Pakistan,44828,429981,Faf du Plessis,Hashim Amla,Mohammad Irfan,y,0.3,0.0,0.0,0.0,0.0,0.0,0.0,-0.01,6.13,-0.33,0.88,85.898,0.0,False,,,1,,"fuller length delivery and in that channel outside off. Faf prods across, lifts his bat and lets it go"
289,2,South Africa,Pakistan,44828,429981,Faf du Plessis,Hashim Amla,Mohammad Irfan,y,0.4,0.0,0.0,0.0,0.0,0.0,0.0,-0.08,5.68,-0.44,0.76,86.157,0.0,False,,,1,,elects to leave this one shaping in upon pitching outside off
290,2,South Africa,Pakistan,44828,429981,Faf du Plessis,Hashim Amla,Mohammad Irfan,y,0.5,1.0,1.0,0.0,110.0,196.0,6.0,0.14,8.62,-0.43,1.12,84.297,1.0,False,,,1,,bunts away this slightly back of a length towards the fielder at cover
291,2,South Africa,Pakistan,43906,429981,Hashim Amla,Francois du Plessis,Mohammad Irfan,y,0.6,4.0,4.0,0.0,248.0,16.0,1.0,0.32,7.89,0.16,0.91,84.194,5.0,False,,,1,,straying on the pads as Amla is just too good to let this one go unpunished as he is able to tickle this away through fine leg
292,2,South Africa,Pakistan,44828,317252,Faf du Plessis,Hashim Amla,Sohail Khan,y,1.1,0.0,0.0,0.0,0.0,0.0,0.0,-0.08,7.55,-0.20,0.74,79.698,5.0,False,,,0,,"and he too has found a wonderful length and line as this one deviates away on a middle to off-stump line as Faf presented a dead, straight bat"
293,2,South Africa,Pakistan,44828,317252,Faf du Plessis,Hashim Amla,Sohail Khan,y,1.2,0.0,0.0,0.0,0.0,0.0,0.0,-0.37,8.04,-0.51,0.90,84.011,5.0,False,,,1,,length outside off which is left well alone by the batsman
