,inning,batting_team,bowling_team,batsman,bowler,batsman_name,non_striker,bowler_name,bat_right_handed,ovr,runs_batter,runs_w_extras,extras,x,y,z,landing_x,landing_y,ended_x,ended_y,ball_speed,cumul_runs,wicket,wicket_method,who_out,control,extras_type,comm
380,2,Zimbabwe,United Arab Emirates,293831,533862,Regis Chakabva,Sikandar Raza,Mohammad Naveed,y,10.5,0.0,0.0,0.0,118.0,152.0,7.0,-0.46,8.49,-0.19,0.96,83.136,55.0,False,,,1,,"and again, excellent angle into the batsman, who stands there and punches it firmly into the ground, bounces up towards backward point"
381,2,Zimbabwe,United Arab Emirates,293831,533862,Regis Chakabva,Sikandar Raza,Mohammad Naveed,y,10.6,0.0,0.0,0.0,198.0,188.0,4.0,-0.27,6.88,0.02,0.77,85.964,55.0,False,,,1,,"fuller now, angling in towards off and middle. Chakabva defends towards mid-on"
382,2,Zimbabwe,United Arab Emirates,299572,447290,Sikandar Raza,Regis Chakabva,Nasir Aziz,y,11.1,0.0,0.0,0.0,191.0,199.0,4.0,-0.25,3.46,-0.10,0.62,51.097,55.0,False,,,1,,"length ball on off stump, defended towards mid-on"
383,2,Zimbabwe,United Arab Emirates,299572,447290,Sikandar Raza,Regis Chakabva,Nasir Aziz,y,11.2,2.0,2.0,0.0,243.0,36.0,1.0,-0.40,4.97,-0.18,0.72,55.982,57.0,False,,,1,,"a bit of loop outside off and he leans over to lap-sweep it over his shoulder and into the gap to the right of short fine leg, who's stationed very square"
384,2,Zimbabwe,United Arab Emirates,299572,447290,Sikandar Raza,Regis Chakabva,Nasir Aziz,y,11.3,3.0,3.0,0.0,115.0,32.0,8.0,-0.51,5.06,-0.33,0.71,56.933,60.0,False,,,1,,"back of a length outside off, Raza waits on it and dabs it to the left of short third man"
385,2,Zimbabwe,United Arab Emirates,293831,447290,Regis Chakabva,Sikandar Raza,Nasir Aziz,y,11.4,0.0,0.0,0.0,237.0,153.0,2.0,-0.11,4.93,0.19,0.76,55.431,60.0,False,,,1,,"length ball on off stump, clipped to short midwicket"
386,2,Zimbabwe,United Arab Emirates,293831,447290,Regis Chakabva,Sikandar Raza,Nasir Aziz,y,11.5,1.0,1.0,0.0,308.0,212.0,3.0,-0.10,5.72,0.34,0.65,56.793,61.0,False,,,1,,"a bit of turn towards leg stump, driven with an almost straight bat to deep midwicket"
387,2,Zimbabwe,United Arab Emirates,299572,447290,Sikandar Raza,Regis Chakabva,Nasir Aziz,y,11.6,0.0,0.0,0.0,120.0,149.0,7.0,-0.50,4.83,-0.40,0.78,53.528,61.0,False,,,1,,tossed up slow outside off and Raza presses a long way forward to poke that away towards point
388,2,Zimbabwe,United Arab Emirates,293831,25601,Regis Chakabva,Sikandar Raza,Mohammad Tauqir,y,12.1,0.0,0.0,0.0,110.0,164.0,7.0,-0.26,6.42,-0.06,0.79,53.174,61.0,False,,,1,,length ball on off stump. Chakabva rocks back and cuts straight to point
389,2,Zimbabwe,United Arab Emirates,293831,25601,Regis Chakabva,Sikandar Raza,Mohammad Tauqir,y,12.2,1.0,1.0,0.0,267.0,300.0,4.0,-0.29,5.61,-0.11,0.53,51.099,62.0,False,,,1,,a little fuller now and he shows the full face to push that down to long-on
390,2,Zimbabwe,United Arab Emirates,299572,25601,Sikandar Raza,Regis Chakabva,Mohammad Tauqir,y,12.3,0.0,0.0,0.0,245.0,143.0,2.0,-0.14,5.84,0.34,0.72,50.026,62.0,False,,,1,,"back of a length, turning down leg, tucked off the hips to square leg"
391,2,Zimbabwe,United Arab Emirates,299572,25601,Sikandar Raza,Regis Chakabva,Mohammad Tauqir,y,12.4,1.0,1.0,0.0,245.0,37.0,1.0,0.17,3.66,0.62,0.75,52.497,63.0,False,,,1,,"tossed up slow, down the leg side, and he sweeps it down to fine leg"
392,2,Zimbabwe,United Arab Emirates,293831,25601,Regis Chakabva,Sikandar Raza,Mohammad Tauqir,y,12.5,1.0,1.0,0.0,84.0,297.0,5.0,-0.18,3.86,0.11,0.58,51.054,64.0,False,,,1,,"fullish on off stump, driven down to long-off"
393,2,Zimbabwe,United Arab Emirates,299572,25601,Sikandar Raza,Regis Chakabva,Mohammad Tauqir,y,12.6,0.0,0.0,0.0,120.0,136.0,7.0,-0.49,5.41,-0.25,0.84,49.242,64.0,True,caught,299572,0,,"gone! Completely against the run of play, a really soft dismissal. Goes back to cut, and it's possibly too close for that, and he ends up scooping it straight to backward point at midriff-height"
394,2,Zimbabwe,United Arab Emirates,293831,25613,Regis Chakabva,Hamilton Masakadza,Amjad Javed,y,13.1,0.0,0.0,0.0,0.0,0.0,0.0,-0.38,7.75,-0.31,0.87,74.245,64.0,False,,,0,,"Chakabva looks to run this down to third man with an open face, the ball beats his edge. Javed appeals for caught behind, twice."
395,2,Zimbabwe,United Arab Emirates,293831,25613,Regis Chakabva,Hamilton Masakadza,Amjad Javed,y,13.2,4.0,4.0,0.0,235.0,10.0,1.0,-0.06,7.24,0.29,0.94,72.987,68.0,False,,,1,,slips down the leg side again and it's easily tucked away off the hips to the fine leg boundary
396,2,Zimbabwe,United Arab Emirates,293831,25613,Regis Chakabva,Hamilton Masakadza,Amjad Javed,y,13.3,0.0,0.0,0.0,221.0,180.0,3.0,-0.30,7.12,-0.08,0.76,74.185,68.0,False,,,1,,"length ball, angling in towards off stump. Chakabva stays in his crease and tucks it into the on side"
397,2,Zimbabwe,United Arab Emirates,293831,25613,Regis Chakabva,Hamilton Masakadza,Amjad Javed,y,13.4,0.0,1.0,1.0,239.0,31.0,1.0,-0.16,8.81,0.17,0.90,77.156,69.0,False,,,0,Lb,"down the leg side again and Chakabva accentuates that by shuffling across his stumps, glances it down to fine leg"
398,2,Zimbabwe,United Arab Emirates,55608,25613,Hamilton Masakadza,Regis Chakabva,Amjad Javed,y,13.5,0.0,0.0,0.0,0.0,0.0,0.0,-0.51,6.77,-0.79,0.83,76.085,69.0,False,,,1,,"gentle, banana outswinger outside off. Masakadza leaves it alone"
399,2,Zimbabwe,United Arab Emirates,55608,25613,Hamilton Masakadza,Regis Chakabva,Amjad Javed,y,13.6,0.0,0.0,0.0,0.0,0.0,0.0,-0.52,5.67,-0.72,0.77,73.757,69.0,False,,,1,,"another away-curler wide outside off, and Masakadza raises his bat high above his head"
400,2,Zimbabwe,United Arab Emirates,293831,25601,Regis Chakabva,Hamilton Masakadza,Mohammad Tauqir,y,14.1,0.0,0.0,0.0,172.0,198.0,5.0,-0.06,5.16,0.29,0.71,53.693,69.0,False,,,0,,"round-arm, angling in towards leg stump. Chakabva closes his bat face too early and it pops up off the leading edge to the left of the bowler"
401,2,Zimbabwe,United Arab Emirates,293831,25601,Regis Chakabva,Hamilton Masakadza,Mohammad Tauqir,y,14.2,0.0,0.0,0.0,206.0,199.0,4.0,0.11,3.27,0.42,0.62,54.938,69.0,False,,,1,,"full on leg and middle, clipped to short midwicket"
402,2,Zimbabwe,United Arab Emirates,293831,25601,Regis Chakabva,Hamilton Masakadza,Mohammad Tauqir,y,14.3,0.0,0.0,0.0,221.0,216.0,4.0,0.04,3.89,0.40,0.67,53.085,69.0,False,,,1,,"tossed up on leg stump, and he can't beat short midwicket with that drive"
403,2,Zimbabwe,United Arab Emirates,293831,25601,Regis Chakabva,Hamilton Masakadza,Mohammad Tauqir,y,14.4,0.0,1.0,1.0,0.0,0.0,0.0,0.07,3.49,0.54,0.82,49.569,70.0,False,,,0,Wd,now he tries to walk across his stumps and play the paddle sweep. Too far down leg to be able to connect
404,2,Zimbabwe,United Arab Emirates,293831,25601,Regis Chakabva,Hamilton Masakadza,Mohammad Tauqir,y,14.4,0.0,0.0,0.0,216.0,216.0,4.0,-0.26,5.70,0.15,0.78,54.863,70.0,False,,,1,,"rocks back to a ball that is nowhere near short or wide enough to cut, ends up punching it back down the ground"
405,2,Zimbabwe,United Arab Emirates,293831,25601,Regis Chakabva,Hamilton Masakadza,Mohammad Tauqir,y,14.5,1.0,1.0,0.0,273.0,301.0,4.0,-0.20,6.59,0.17,0.73,56.803,71.0,False,,,1,,"uh, oh. That short, straight midwicket fielder is in play again as Chakabva goes back and punches towards him. He fails to get down quickly enough and it rolls between his legs to long-on"
406,2,Zimbabwe,United Arab Emirates,55608,25601,Hamilton Masakadza,Regis Chakabva,Mohammad Tauqir,y,14.6,1.0,1.0,0.0,241.0,40.0,1.0,-0.11,5.06,0.32,0.85,54.392,72.0,False,,,1,,"on the pads, tucked away towards deep backward square leg"
407,2,Zimbabwe,United Arab Emirates,55608,25613,Hamilton Masakadza,Regis Chakabva,Amjad Javed,y,15.1,0.0,0.0,0.0,0.0,0.0,0.0,-0.10,3.83,-0.01,0.51,71.762,72.0,True,leg before wicket,55608,0,,"got him! He's struggled through his last two overs but Javed has produced an excellent delivery to dismiss Zimbabwe's best batsman. It was threatening to curl away in the air and then it came in off the pitch and beat Masakadza's inside edge to hit him on the back pad, plumb in front. He was looking to drive that on the up through mid-off"
408,2,Zimbabwe,United Arab Emirates,55814,25613,Brendan Taylor,Regis Chakabva,Amjad Javed,y,15.2,0.0,1.0,1.0,0.0,0.0,0.0,-0.00,8.59,0.34,1.08,78.298,73.0,False,,,1,Wd,and he's greeted with another wide down the leg side from Javed
409,2,Zimbabwe,United Arab Emirates,55814,25613,Brendan Taylor,Regis Chakabva,Amjad Javed,y,15.2,2.0,2.0,0.0,236.0,28.0,1.0,-0.16,8.62,0.17,1.05,74.420,75.0,False,,,1,,"on the pads again and Taylor clips it away towards fine leg, where Nasir puts in a diving stop at the rope"
410,2,Zimbabwe,United Arab Emirates,55814,25613,Brendan Taylor,Regis Chakabva,Amjad Javed,y,15.3,1.0,1.0,0.0,263.0,170.0,3.0,-0.12,6.08,0.10,0.64,76.308,76.0,False,,,1,,"fullish on middle stump, clipped away towards deep square leg"
411,2,Zimbabwe,United Arab Emirates,293831,25613,Regis Chakabva,Brendan Taylor,Amjad Javed,y,15.4,4.0,4.0,0.0,306.0,316.0,4.0,-0.16,4.57,-0.01,0.55,75.326,80.0,False,,,1,,full on off stump and he punches this with a straight bat to send it racing away into the gap between midwicket and mid-on. Lovely shot
412,2,Zimbabwe,United Arab Emirates,293831,25613,Regis Chakabva,Brendan Taylor,Amjad Javed,y,15.5,0.0,0.0,0.0,0.0,0.0,0.0,-0.47,7.83,-0.52,0.82,74.936,80.0,False,,,1,,length ball outside off. Chakabva waves it through to the keeper
413,2,Zimbabwe,United Arab Emirates,293831,25613,Regis Chakabva,Brendan Taylor,Amjad Javed,y,15.6,0.0,1.0,1.0,0.0,0.0,0.0,-0.22,12.55,0.36,2.12,75.139,81.0,False,,,1,Wd,"looks for the bouncer, and that's another wide, for height this time. The batsman didn't even bother ducking, that's how high it was"
414,2,Zimbabwe,United Arab Emirates,293831,25613,Regis Chakabva,Brendan Taylor,Amjad Javed,y,15.6,0.0,0.0,0.0,156.0,169.0,6.0,-0.30,7.96,-0.12,0.88,78.439,81.0,False,,,0,,"back of a length on off stump, defended off the back foot"
415,2,Zimbabwe,United Arab Emirates,55814,25601,Brendan Taylor,Regis Chakabva,Mohammad Tauqir,y,16.1,1.0,1.0,0.0,324.0,214.0,3.0,-0.15,4.79,0.19,0.71,53.573,82.0,False,,,1,,on the pads and he comes forward to flick it away towards deep midwicket
416,2,Zimbabwe,United Arab Emirates,293831,25601,Regis Chakabva,Brendan Taylor,Mohammad Tauqir,y,16.2,1.0,1.0,0.0,242.0,202.0,3.0,-0.26,5.06,0.19,0.88,47.219,83.0,False,,,1,,pushed through a bit quicker and he goes back to work it square on the leg side
417,2,Zimbabwe,United Arab Emirates,55814,25601,Brendan Taylor,Regis Chakabva,Mohammad Tauqir,y,16.3,0.0,0.0,0.0,172.0,186.0,5.0,-0.36,5.19,-0.20,0.71,58.436,83.0,False,,,1,,"a bit of air, shifts his line towards off stump, and Taylor presses forward to block it back to the bowler"
418,2,Zimbabwe,United Arab Emirates,55814,25601,Brendan Taylor,Regis Chakabva,Mohammad Tauqir,y,16.4,0.0,0.0,0.0,246.0,176.0,3.0,-0.47,6.20,-0.18,0.90,55.739,83.0,False,,,1,,"length ball on off and middle, played with the turn towards square leg"
419,2,Zimbabwe,United Arab Emirates,55814,25601,Brendan Taylor,Regis Chakabva,Mohammad Tauqir,y,16.5,1.0,1.0,0.0,266.0,301.0,4.0,-0.32,4.13,-0.15,0.73,54.994,84.0,False,,,1,,a bit more air and he gets forward to drive that down to long-on
420,2,Zimbabwe,United Arab Emirates,293831,25601,Regis Chakabva,Brendan Taylor,Mohammad Tauqir,y,16.6,0.0,0.0,0.0,233.0,203.0,3.0,-0.11,5.79,0.37,0.89,55.322,84.0,False,,,1,,"pushed through now, angling in towards the batsman, and he punches it straight to short midwicket"
421,2,Zimbabwe,United Arab Emirates,55814,290645,Brendan Taylor,Regis Chakabva,Krishna Chandran,y,17.1,0.0,0.0,0.0,206.0,182.0,3.0,-0.29,7.81,-0.19,0.79,69.511,84.0,False,,,1,,"length ball on a fourth-stump line, Taylor defends watchfully back to the bowler"
422,2,Zimbabwe,United Arab Emirates,55814,290645,Brendan Taylor,Regis Chakabva,Krishna Chandran,y,17.2,1.0,1.0,0.0,294.0,212.0,3.0,-0.04,5.98,0.10,0.72,71.889,85.0,False,,,1,,"a bit of swing in towards the pads, clipped away through midwicket"
423,2,Zimbabwe,United Arab Emirates,293831,290645,Regis Chakabva,Brendan Taylor,Krishna Chandran,y,17.3,0.0,0.0,0.0,134.0,120.0,7.0,-0.24,6.10,-0.18,0.80,68.094,85.0,False,,,0,,"fullish outside off and Chakabva looks to drive through extra cover, plays down the wrong line and gets a thick outside edge to short third man"
424,2,Zimbabwe,United Arab Emirates,293831,290645,Regis Chakabva,Brendan Taylor,Krishna Chandran,y,17.4,1.0,1.0,0.0,167.0,335.0,5.0,-0.21,4.59,-0.15,0.48,73.249,86.0,False,,,0,,"ooh. That's a bit straighter and he goes for the drive down the ground, hits it uppishly. Karate reaches out with his right hand, gets a fingertip to it, and it narrowly misses the stumps at the other end, with Taylor out of his ground"
425,2,Zimbabwe,United Arab Emirates,55814,290645,Brendan Taylor,Regis Chakabva,Krishna Chandran,y,17.5,0.0,0.0,0.0,151.0,149.0,7.0,-0.23,6.08,-0.25,0.76,72.341,86.0,False,,,0,,"now Taylor goes for the big slog-sweep from outside off, can't connect"
426,2,Zimbabwe,United Arab Emirates,55814,290645,Brendan Taylor,Regis Chakabva,Krishna Chandran,y,17.6,1.0,1.0,0.0,231.0,317.0,4.0,-0.25,6.41,-0.24,0.76,71.665,87.0,False,,,1,,"length ball outside off, clipped down to long-on"
427,2,Zimbabwe,United Arab Emirates,55814,25601,Brendan Taylor,Regis Chakabva,Mohammad Tauqir,y,18.1,0.0,0.0,0.0,128.0,190.0,6.0,-0.52,5.09,-0.39,0.76,58.563,87.0,False,,,1,,Hits a nice length outside off and Taylor presses forward to defend
428,2,Zimbabwe,United Arab Emirates,55814,25601,Brendan Taylor,Regis Chakabva,Mohammad Tauqir,y,18.2,4.0,4.0,0.0,122.0,3.0,8.0,-0.33,4.63,-0.06,0.79,-2.237,91.0,False,,,1,,that's a lovely orthodox line but it's always problematic when third man is in the circle. Modern batsmen can reverse-sweep those all day and Taylor is as good as anyone else at playing that shot
429,2,Zimbabwe,United Arab Emirates,55814,25601,Brendan Taylor,Regis Chakabva,Mohammad Tauqir,y,18.3,1.0,1.0,0.0,284.0,297.0,4.0,-0.38,3.54,-0.16,0.63,-2.237,92.0,False,,,1,,"tossed up outside off, a bit of drift in the air. Taylor clips it down to long-on"
430,2,Zimbabwe,United Arab Emirates,293831,25601,Regis Chakabva,Brendan Taylor,Mohammad Tauqir,y,18.4,1.0,1.0,0.0,231.0,41.0,1.0,-0.20,5.38,0.17,0.81,55.510,93.0,False,,,1,,now Chakabva shuffles across outside off and lap-sweeps it over his shoulder towards fine leg
431,2,Zimbabwe,United Arab Emirates,55814,25601,Brendan Taylor,Regis Chakabva,Mohammad Tauqir,y,18.5,0.0,0.0,0.0,256.0,123.0,2.0,-0.26,4.51,0.13,0.85,50.443,93.0,False,,,1,,"tossed up towards off stump, clipped to square leg"
432,2,Zimbabwe,United Arab Emirates,55814,25601,Brendan Taylor,Regis Chakabva,Mohammad Tauqir,y,18.6,1.0,1.0,0.0,330.0,230.0,3.0,-0.30,5.27,-0.01,0.74,56.695,94.0,False,,,1,,"down the track now, flicks it away to deep midwicket"
433,2,Zimbabwe,United Arab Emirates,55814,290645,Brendan Taylor,Regis Chakabva,Krishna Chandran,y,19.1,1.0,1.0,0.0,330.0,237.0,3.0,-0.29,9.56,-0.13,0.94,74.180,95.0,False,,,1,,"shortish on off stump, pulled to deep midwicket"
434,2,Zimbabwe,United Arab Emirates,293831,290645,Regis Chakabva,Brendan Taylor,Krishna Chandran,y,19.2,1.0,1.0,0.0,248.0,314.0,4.0,-0.37,7.78,-0.40,0.64,73.916,96.0,False,,,1,,"shortish outside off, stops on the pitch and forces Chakabva to abandon the idea of cutting. Ends up flat-batting it down the ground to long-on"
435,2,Zimbabwe,United Arab Emirates,55814,290645,Brendan Taylor,Regis Chakabva,Krishna Chandran,y,19.3,1.0,1.0,0.0,171.0,66.0,8.0,-0.10,5.63,-0.04,0.74,61.878,97.0,False,,,0,,"looks for the sweep, picks the wrong length, perhaps, and gets a top edge that loops over the keeper"
436,2,Zimbabwe,United Arab Emirates,293831,290645,Regis Chakabva,Brendan Taylor,Krishna Chandran,y,19.4,0.0,0.0,0.0,0.0,0.0,0.0,-0.45,6.11,-0.71,0.78,61.493,97.0,False,,,0,,wide outswinger and Chakabva is beaten. overbalancing a little trying to reach it to drive
437,2,Zimbabwe,United Arab Emirates,293831,290645,Regis Chakabva,Brendan Taylor,Krishna Chandran,y,19.5,0.0,0.0,0.0,206.0,198.0,4.0,-0.16,7.97,-0.11,0.92,67.639,97.0,False,,,1,,"back of a length on off stump, punched to short midwicket"
438,2,Zimbabwe,United Arab Emirates,293831,290645,Regis Chakabva,Brendan Taylor,Krishna Chandran,y,19.6,1.0,1.0,0.0,220.0,159.0,2.0,-0.26,5.85,-0.14,0.67,63.710,98.0,False,,,0,,"shuffles across to try and sweep, is hit on the front pad. Only the keeper appeals, that clearly struck him outside the line of off stump"
439,2,Zimbabwe,United Arab Emirates,293831,25601,Regis Chakabva,Brendan Taylor,Mohammad Tauqir,y,20.1,4.0,4.0,0.0,360.0,187.0,3.0,-0.65,4.67,-0.37,0.75,51.349,102.0,False,,,1,,"tossed up wide outside off and he goes for the sweep, hits it in the air but finds the gap between deep midwicket and deep backward square leg"
440,2,Zimbabwe,United Arab Emirates,293831,25601,Regis Chakabva,Brendan Taylor,Mohammad Tauqir,y,20.2,1.0,1.0,0.0,65.0,280.0,5.0,-0.22,5.29,0.18,0.71,55.028,103.0,False,,,1,,"length ball, turns towards leg stump. Chakabva skips away to make room and punches it to long-off"
441,2,Zimbabwe,United Arab Emirates,55814,25601,Brendan Taylor,Regis Chakabva,Mohammad Tauqir,y,20.3,0.0,0.0,0.0,0.0,0.0,0.0,-0.08,6.35,0.48,0.70,54.198,103.0,False,,,0,,"length ball, turns from middle and leg and slips down the leg side"
442,2,Zimbabwe,United Arab Emirates,55814,25601,Brendan Taylor,Regis Chakabva,Mohammad Tauqir,y,20.4,0.0,0.0,0.0,251.0,223.0,3.0,-0.54,4.21,-0.22,0.74,50.019,103.0,False,,,1,,"loopy delivery outside off, comes forward to clip it to short midwicket"
443,2,Zimbabwe,United Arab Emirates,55814,25601,Brendan Taylor,Regis Chakabva,Mohammad Tauqir,y,20.5,0.0,0.0,0.0,217.0,250.0,4.0,-0.50,7.44,-0.03,0.90,55.791,103.0,False,,,1,,"back of a length, turns in and cramps Taylor for room. Punches it straight to short midwicket"
444,2,Zimbabwe,United Arab Emirates,55814,25601,Brendan Taylor,Regis Chakabva,Mohammad Tauqir,y,20.6,1.0,1.0,0.0,330.0,177.0,3.0,-0.20,5.11,0.15,0.82,56.978,104.0,False,,,1,,on the pads now and he can clip it away to the man at deep midwicket
445,2,Zimbabwe,United Arab Emirates,55814,290645,Brendan Taylor,Regis Chakabva,Krishna Chandran,y,21.1,4.0,4.0,0.0,124.0,19.0,8.0,-0.32,7.84,-0.35,0.71,62.643,108.0,False,,,1,,length ball outside off and Taylor opens his bat face at the last moment to dab it into the gap to the left of short third man
446,2,Zimbabwe,United Arab Emirates,55814,290645,Brendan Taylor,Regis Chakabva,Krishna Chandran,y,21.2,1.0,1.0,0.0,44.0,221.0,6.0,-0.40,8.98,-0.46,0.89,74.204,109.0,False,,,1,,"back of a length on off stump, punched down to long-off"
447,2,Zimbabwe,United Arab Emirates,293831,290645,Regis Chakabva,Brendan Taylor,Krishna Chandran,y,21.3,0.0,0.0,0.0,239.0,197.0,3.0,-0.28,7.65,-0.34,0.71,78.998,109.0,False,,,1,,"back of a length outside off, barely comes on, punched to mid-on"
448,2,Zimbabwe,United Arab Emirates,293831,290645,Regis Chakabva,Brendan Taylor,Krishna Chandran,y,21.4,2.0,2.0,0.0,288.0,88.0,2.0,-0.01,7.90,0.29,0.68,63.976,111.0,False,,,1,,too straight now and he tucks it away off the pads towards deep backward square leg
449,2,Zimbabwe,United Arab Emirates,293831,290645,Regis Chakabva,Brendan Taylor,Krishna Chandran,y,21.5,0.0,0.0,0.0,254.0,211.0,3.0,-0.07,6.85,0.06,0.69,71.540,111.0,False,,,1,,"fullish on middle stump, punched to short midwicket"
450,2,Zimbabwe,United Arab Emirates,293831,290645,Regis Chakabva,Brendan Taylor,Krishna Chandran,y,21.6,1.0,1.0,0.0,306.0,217.0,3.0,-0.04,6.51,0.03,0.77,64.077,112.0,False,,,1,,"slower ball on middle stump. Chakabva lets it come on, dabs it towards short fine leg"
451,2,Zimbabwe,United Arab Emirates,293831,25601,Regis Chakabva,Brendan Taylor,Mohammad Tauqir,y,22.1,0.0,0.0,0.0,267.0,173.0,3.0,-0.38,4.32,0.05,0.88,47.764,112.0,True,hit wicket,293831,0,,"the captain has another wicket! Chakabva went on the back foot to work it into the leg side and slipped as he did so, and his feet slid straight into the stumps. Unfortunate dismissal."
452,2,Zimbabwe,United Arab Emirates,55870,25601,Sean Williams,Brendan Taylor,Mohammad Tauqir,n,22.2,1.0,1.0,0.0,299.0,185.0,3.0,0.32,4.36,0.49,0.85,51.198,113.0,False,,,1,,tossed up outside off and he comes forward to drive that towards cover point
453,2,Zimbabwe,United Arab Emirates,55814,25601,Brendan Taylor,Sean Williams,Mohammad Tauqir,y,22.3,0.0,0.0,0.0,255.0,232.0,3.0,-0.23,4.46,0.19,0.65,50.069,113.0,False,,,1,,"down the track now, clips it to that busy man at straight midwicket"
454,2,Zimbabwe,United Arab Emirates,55814,25601,Brendan Taylor,Sean Williams,Mohammad Tauqir,y,22.4,1.0,1.0,0.0,279.0,294.0,4.0,-0.31,3.74,0.10,0.83,48.798,114.0,False,,,1,,"out of his crease once more, this time he beats the close-in fielder to pick up the single to long-on"
455,2,Zimbabwe,United Arab Emirates,55870,25601,Sean Williams,Brendan Taylor,Mohammad Tauqir,n,22.5,0.0,0.0,0.0,257.0,219.0,3.0,0.30,3.30,0.51,0.72,52.052,114.0,False,,,1,,"nice flight outside off, driven to short extra cover"
456,2,Zimbabwe,United Arab Emirates,55870,25601,Sean Williams,Brendan Taylor,Mohammad Tauqir,n,22.6,3.0,3.0,0.0,345.0,173.0,3.0,0.28,5.48,0.33,0.71,53.540,117.0,False,,,1,,a touch short and Williams skips back and punches it into the gap between cover and extra cover
457,2,Zimbabwe,United Arab Emirates,55870,447290,Sean Williams,Brendan Taylor,Nasir Aziz,n,23.1,1.0,1.0,0.0,125.0,300.0,5.0,0.18,6.36,0.04,0.76,52.603,118.0,False,,,1,,"length ball, angled in towards off stump, punched back past the bowler to long-off"
458,2,Zimbabwe,United Arab Emirates,55814,447290,Brendan Taylor,Sean Williams,Nasir Aziz,y,23.2,2.0,2.0,0.0,268.0,50.0,1.0,-0.45,4.61,-0.34,0.51,46.023,120.0,False,,,1,,flighted outside off and he leans across to lap it away towards fine leg
459,2,Zimbabwe,United Arab Emirates,55814,447290,Brendan Taylor,Sean Williams,Nasir Aziz,y,23.3,0.0,0.0,0.0,254.0,198.0,3.0,-0.12,4.30,0.07,0.57,53.612,120.0,False,,,1,,"full on middle stump, clipped to midwicket"
460,2,Zimbabwe,United Arab Emirates,55814,447290,Brendan Taylor,Sean Williams,Nasir Aziz,y,23.4,1.0,1.0,0.0,266.0,113.0,2.0,-0.34,3.75,0.13,0.44,52.041,121.0,False,,,1,,"goes for the full-blooded sweep this time, it's a touch too full to middle, but he manages to drag it towards fine leg"
461,2,Zimbabwe,United Arab Emirates,55870,447290,Sean Williams,Brendan Taylor,Nasir Aziz,n,23.5,0.0,0.0,0.0,247.0,220.0,3.0,0.21,4.49,0.19,0.75,50.402,121.0,False,,,1,,"full outside off, driven to extra cover"
462,2,Zimbabwe,United Arab Emirates,55870,447290,Sean Williams,Brendan Taylor,Nasir Aziz,n,23.6,0.0,0.0,0.0,185.0,204.0,4.0,0.19,2.90,0.10,0.35,49.270,121.0,False,,,1,,"full on off, looks for the drive to long-off but the bowler falls across to get in the way"
463,2,Zimbabwe,United Arab Emirates,55814,25601,Brendan Taylor,Sean Williams,Mohammad Tauqir,y,24.1,0.0,0.0,0.0,253.0,135.0,2.0,-0.23,6.43,0.29,0.70,55.731,121.0,False,,,1,,angles this in towards middle and leg and turns towards leg. Tucks it off the pads but he can't beat backward square leg
464,2,Zimbabwe,United Arab Emirates,55814,25601,Brendan Taylor,Sean Williams,Mohammad Tauqir,y,24.2,0.0,0.0,0.0,225.0,191.0,3.0,-0.46,5.87,-0.17,0.71,48.364,121.0,False,,,1,,length ball on middle stump and he comes forward to defend
465,2,Zimbabwe,United Arab Emirates,55814,25601,Brendan Taylor,Sean Williams,Mohammad Tauqir,y,24.3,4.0,4.0,0.0,69.0,36.0,8.0,-0.54,6.27,-0.14,0.85,50.259,125.0,False,,,1,,"and again, the reverse-sweep to release the pressure. This one was more difficult than the previous one, took it from middle stump and hit it squarer"
466,2,Zimbabwe,United Arab Emirates,55814,25601,Brendan Taylor,Sean Williams,Mohammad Tauqir,y,24.4,1.0,1.0,0.0,233.0,313.0,4.0,-0.18,4.61,0.19,0.89,54.915,126.0,False,,,1,,down the track now and he shows the full face to play the checked drive to long-on
467,2,Zimbabwe,United Arab Emirates,55870,25601,Sean Williams,Brendan Taylor,Mohammad Tauqir,n,24.5,0.0,0.0,0.0,235.0,211.0,3.0,0.35,4.70,0.38,0.62,51.951,126.0,False,,,1,,tossed up outside off and he comes forward to defend to extra cover
468,2,Zimbabwe,United Arab Emirates,55870,25601,Sean Williams,Brendan Taylor,Mohammad Tauqir,n,24.6,0.0,0.0,0.0,281.0,215.0,3.0,0.19,3.62,0.34,0.70,49.285,126.0,False,,,1,,"floated up full on off stump, and he drives to that man at extra cover"
469,2,Zimbabwe,United Arab Emirates,55814,447290,Brendan Taylor,Sean Williams,Nasir Aziz,y,25.1,0.0,0.0,0.0,194.0,204.0,4.0,-0.23,5.65,0.11,0.58,52.566,126.0,False,,,1,,"flat and full on middle and off, defended back towards the bowler"
470,2,Zimbabwe,United Arab Emirates,55814,447290,Brendan Taylor,Sean Williams,Nasir Aziz,y,25.2,0.0,0.0,0.0,115.0,217.0,6.0,0.05,3.02,0.10,0.23,49.415,126.0,False,,,1,,"full on middle and leg, Taylor makes room to drive inside-out, can't beat short cover"
471,2,Zimbabwe,United Arab Emirates,55814,447290,Brendan Taylor,Sean Williams,Nasir Aziz,y,25.3,6.0,6.0,0.0,250.0,353.0,4.0,-0.54,4.16,-0.42,0.41,52.644,132.0,False,,,1,,now he gives it some air outside off and Taylor welcomes the room to free his arms and swings them through a full arc to launch that for a straight six
472,2,Zimbabwe,United Arab Emirates,55814,447290,Brendan Taylor,Sean Williams,Nasir Aziz,y,25.4,0.0,0.0,0.0,125.0,197.0,6.0,-0.40,3.89,-0.32,0.54,51.287,132.0,False,,,1,,"slightly lower trajectory this time, outside off, and he drives it towards mid-off"
473,2,Zimbabwe,United Arab Emirates,55814,447290,Brendan Taylor,Sean Williams,Nasir Aziz,y,25.5,0.0,0.0,0.0,133.0,175.0,6.0,-0.58,5.86,-0.27,0.59,53.147,132.0,False,,,1,,down the track now and he shortens his length somewhat. Taylor defends into the off side
474,2,Zimbabwe,United Arab Emirates,55814,447290,Brendan Taylor,Sean Williams,Nasir Aziz,y,25.6,0.0,0.0,0.0,228.0,232.0,4.0,-0.29,4.27,-0.00,0.83,52.724,132.0,False,,,1,,"full on off stump, Taylor clips but can't beat the man at straight midwicket"
