,inning,batting_team,bowling_team,batsman,bowler,batsman_name,non_striker,bowler_name,bat_right_handed,ovr,runs_batter,runs_w_extras,extras,x,y,z,landing_x,landing_y,ended_x,ended_y,ball_speed,cumul_runs,wicket,wicket_method,who_out,control,extras_type,comm
296,1,Scotland,Bangladesh,417268,538506,Matthew Cross,Josh Davey,Taskin Ahmed,y,48.4,0.0,0.0,0.0,0.0,0.0,0.0,-1.02,4.31,-1.14,0.44,87.774,308.0,False,,,0,,"reaches out to this widish, full delivery, but because his stance was so off-side, he is not penalised by the umpire"
297,1,Scotland,Bangladesh,417268,538506,Matthew Cross,Josh Davey,Taskin Ahmed,y,48.5,4.0,4.0,0.0,160.0,0.0,8.0,-0.61,5.49,-0.64,0.61,84.783,312.0,False,,,0,,"goes for the big tonk through long off, but ends up giving up a thick outside edge which flies dangerously close to the outstretched glove of Mushfiqur, who is unable to get to it. His father, would not be so proud"
298,1,Scotland,Bangladesh,417268,538506,Matthew Cross,Josh Davey,Taskin Ahmed,y,48.6,0.0,0.0,0.0,106.0,154.0,7.0,-0.38,9.77,-0.13,1.18,66.189,312.0,True,caught,417268,0,,"slower ball outside off which is slapped straight to cover point, who takes it at head height quite comfortably. Taskin has come back really well for Bangladesh here in this over"
299,1,Scotland,Bangladesh,407265,56143,Josh Davey,Majid Haq,Shakib Al Hasan,y,49.1,1.0,1.0,0.0,93.0,297.0,5.0,-0.51,5.84,-0.25,0.62,58.819,313.0,False,,,1,,driven with ease down to long off
300,1,Scotland,Bangladesh,25451,56143,Majid Haq,Josh Davey,Shakib Al Hasan,n,49.2,1.0,1.0,0.0,54.0,215.0,6.0,-0.19,5.61,0.14,0.64,53.438,314.0,False,,,1,,able to tuck away this one on middle and leg to the leg side
301,1,Scotland,Bangladesh,407265,56143,Josh Davey,Majid Haq,Shakib Al Hasan,y,49.3,1.0,1.0,0.0,113.0,211.0,6.0,-1.02,2.49,-1.02,0.37,62.498,315.0,False,,,1,,carves out a single to this one floated in outside off
302,1,Scotland,Bangladesh,25451,56143,Majid Haq,Josh Davey,Shakib Al Hasan,n,49.4,0.0,0.0,0.0,253.0,206.0,3.0,-0.62,5.45,-0.48,0.66,49.421,315.0,False,,,1,,backs away a whole lot before driving this to the close-in fielder on the off side
303,1,Scotland,Bangladesh,25451,56143,Majid Haq,Josh Davey,Shakib Al Hasan,n,49.5,0.0,0.0,0.0,63.0,245.0,6.0,-0.63,5.34,-0.43,0.53,50.010,315.0,True,caught,25451,0,,"unbelievable catch in the deep at square-leg as Haq looks for quick runs over midwicket, but Soumya, who has already taken a couple today, comes forward before putting in a fine, forward dive to pluck this just inches from the ground. Fantastic catch, but far too late in the grand scheme of things"
304,1,Scotland,Bangladesh,407265,56143,Josh Davey,Alasdair Evans,Shakib Al Hasan,y,49.6,0.0,1.0,1.0,0.0,0.0,0.0,,,,,,316.0,False,,,0,Wd,"looks for the reverse sweep to this one flighted in outside off, but is late on it. Doesn't really matter though as it is called wide in the end"
305,1,Scotland,Bangladesh,407265,56143,Josh Davey,Alasdair Evans,Shakib Al Hasan,y,49.6,2.0,2.0,0.0,103.0,307.0,5.0,-0.78,2.28,-0.71,0.35,56.588,318.0,False,,,1,,"some great hustle from both these batsmen are able to take Scotland to a rather imposing 318 for 8. Works this one away through long off, running the first one hard in order to come back in time of the throw for the second"
306,2,Bangladesh,Scotland,56194,509107,Tamim Iqbal,Soumya Sarkar,Iain Wardlaw,n,0.1,0.0,0.0,0.0,0.0,0.0,0.0,-0.24,11.71,0.02,1.84,84.137,0.0,False,,,1,,begins with some short stuff on middle which Tamim is content to duck under
307,2,Bangladesh,Scotland,56194,509107,Tamim Iqbal,Soumya Sarkar,Iain Wardlaw,n,0.2,0.0,1.0,1.0,0.0,0.0,0.0,-0.55,8.38,-0.86,1.07,81.436,1.0,False,,,1,Wd,gets the line horribly wrong as he splashes down leg
308,2,Bangladesh,Scotland,56194,509107,Tamim Iqbal,Soumya Sarkar,Iain Wardlaw,n,0.2,0.0,0.0,0.0,199.0,186.0,4.0,-0.01,5.38,0.26,0.67,81.034,1.0,False,,,1,,full delivery which is driven towards the general direction of mid-off
309,2,Bangladesh,Scotland,56194,509107,Tamim Iqbal,Soumya Sarkar,Iain Wardlaw,n,0.3,0.0,0.0,0.0,232.0,192.0,3.0,0.12,6.11,0.30,0.70,81.328,1.0,False,,,0,,"gets in a nice stride to defend this fuller one going across, with a hint of swing into him as he presented the bat"
310,2,Bangladesh,Scotland,56194,509107,Tamim Iqbal,Soumya Sarkar,Iain Wardlaw,n,0.4,2.0,2.0,0.0,196.0,322.0,4.0,0.04,4.57,0.21,0.61,82.487,3.0,False,,,1,,overpitched from Wardlaw as this is driven competently through long off for a couple
311,2,Bangladesh,Scotland,56194,509107,Tamim Iqbal,Soumya Sarkar,Iain Wardlaw,n,0.5,0.0,0.0,0.0,0.0,0.0,0.0,0.18,6.93,0.57,0.94,82.469,3.0,False,,,0,,elects to leave this slightly back of a length outside of off
312,2,Bangladesh,Scotland,56194,509107,Tamim Iqbal,Soumya Sarkar,Iain Wardlaw,n,0.6,0.0,0.0,0.0,0.0,0.0,0.0,0.10,7.62,0.45,0.95,84.355,3.0,False,,,1,,shoulders arms to this slightly back of a length delivery going across him
313,2,Bangladesh,Scotland,436677,407265,Soumya Sarkar,Tamim Iqbal,Josh Davey,n,1.1,2.0,2.0,0.0,321.0,227.0,3.0,0.10,8.18,0.47,0.87,76.933,5.0,False,,,0,,punches this back of a length towards deep extra-cover as they are able to complete a coupl e
314,2,Bangladesh,Scotland,436677,407265,Soumya Sarkar,Tamim Iqbal,Josh Davey,n,1.2,0.0,0.0,0.0,250.0,194.0,3.0,0.09,8.93,0.75,1.05,75.202,5.0,False,,,1,,"looks to caress this shortish length through the covers, but is stopped by the fielder in question"
315,2,Bangladesh,Scotland,436677,407265,Soumya Sarkar,Tamim Iqbal,Josh Davey,n,1.3,0.0,0.0,0.0,0.0,0.0,0.0,-0.21,6.85,-0.14,0.67,77.645,5.0,False,,,0,,"looking for the appeal as this one strikes the pads on a leg-stump line. Umpire remains nonplussed though, with the angle suggesting this was missing the leg stump"
316,2,Bangladesh,Scotland,436677,407265,Soumya Sarkar,Tamim Iqbal,Josh Davey,n,1.4,0.0,0.0,0.0,145.0,240.0,5.0,0.02,6.21,0.18,0.67,77.511,5.0,False,,,1,,driven down to mid-on now as they look to be watchful in these early exchanges
317,2,Bangladesh,Scotland,436677,407265,Soumya Sarkar,Tamim Iqbal,Josh Davey,n,1.5,0.0,0.0,0.0,168.0,128.0,8.0,-0.47,8.95,-0.38,0.99,77.087,5.0,True,caught,436677,0,,"definite sound off the bat as he offers up a faint tickle to this shorter one he tried to help down fine leg, with the keeper going straight up for it as soon as he completed the take. The bowler knows as well, and the umpire raises the dreaded finger as Bangaldesh are 5 for 1 early in the piece."
318,2,Bangladesh,Scotland,56025,407265,Mahmudullah,Tamim Iqbal,Josh Davey,y,1.6,0.0,1.0,1.0,0.0,0.0,0.0,0.46,4.82,0.88,0.63,75.971,6.0,False,,,1,Wd,gets this one completely wrong as he fires down the leg side
319,2,Bangladesh,Scotland,56025,407265,Mahmudullah,Tamim Iqbal,Josh Davey,y,1.6,0.0,0.0,0.0,134.0,180.0,6.0,-0.31,6.93,-0.32,0.86,76.377,6.0,False,,,1,,defends this length delivery to the off side to end the over
320,2,Bangladesh,Scotland,56194,509107,Tamim Iqbal,Mohammad Mahmudullah,Iain Wardlaw,n,2.1,0.0,0.0,0.0,120.0,193.0,6.0,0.08,5.05,0.15,0.60,83.101,6.0,False,,,0,,"gets in a stride to try and blitz this through long off, but ends up mishitting more to midwicket, with the ball stopped soon after inside of the ring"
321,2,Bangladesh,Scotland,56194,509107,Tamim Iqbal,Mohammad Mahmudullah,Iain Wardlaw,n,2.2,0.0,0.0,0.0,207.0,148.0,2.0,0.08,8.04,0.35,1.20,84.033,6.0,False,,,0,,"just about gets his bat out of the way to this shorter one going across, despite getting hit on the glove as this bounces down towards the keeper behind"
322,2,Bangladesh,Scotland,56194,509107,Tamim Iqbal,Mohammad Mahmudullah,Iain Wardlaw,n,2.3,4.0,4.0,0.0,4.0,178.0,6.0,-0.21,9.64,0.07,1.19,79.098,10.0,False,,,1,,pulls away this shorter one which sits up at a comfortable height as this goes all the way to the square-leg boundary
323,2,Bangladesh,Scotland,56194,509107,Tamim Iqbal,Mohammad Mahmudullah,Iain Wardlaw,n,2.4,4.0,4.0,0.0,7.0,168.0,6.0,-0.26,11.03,0.02,1.54,81.121,14.0,False,,,1,,another short delivery which is punished by the batsman as this time he is able to manipulate the ball through long leg
324,2,Bangladesh,Scotland,56194,509107,Tamim Iqbal,Mohammad Mahmudullah,Iain Wardlaw,n,2.5,0.0,0.0,0.0,141.0,198.0,6.0,-0.13,6.79,0.02,0.80,84.407,14.0,False,,,1,,"this time searching for the gap at midwicket, but picks out the fielder"
325,2,Bangladesh,Scotland,56194,509107,Tamim Iqbal,Mohammad Mahmudullah,Iain Wardlaw,n,2.6,0.0,0.0,0.0,0.0,0.0,0.0,-0.20,6.42,-0.20,0.69,82.771,14.0,False,,,0,,"strikes him on the pads, but the inward angle suggests this was missing leg stump quite comfortably, despite the interested shout"
326,2,Bangladesh,Scotland,56025,407265,Mahmudullah,Tamim Iqbal,Josh Davey,y,3.1,0.0,0.0,0.0,182.0,184.0,4.0,-0.16,6.09,-0.03,0.65,77.741,14.0,False,,,0,,fuller length which he ends up inside-edging onto the pads
327,2,Bangladesh,Scotland,56025,407265,Mahmudullah,Tamim Iqbal,Josh Davey,y,3.2,0.0,1.0,1.0,0.0,0.0,0.0,-0.81,6.35,-1.21,0.81,76.805,15.0,False,,,1,Wd,"length delivery, shaping away greatly outside off, as the umpire gets an excuse to stretch"
328,2,Bangladesh,Scotland,56025,407265,Mahmudullah,Tamim Iqbal,Josh Davey,y,3.2,2.0,2.0,0.0,43.0,184.0,6.0,-0.59,7.97,-0.61,0.94,75.743,17.0,False,,,1,,cut away through the gap at cover point to pickup a brace as this is tracked back before the boundary
329,2,Bangladesh,Scotland,56025,407265,Mahmudullah,Tamim Iqbal,Josh Davey,y,3.3,1.0,1.0,0.0,91.0,56.0,8.0,-0.38,7.03,-0.38,0.70,78.208,18.0,False,,,0,,dabs this one outside off to the fielder at third man
330,2,Bangladesh,Scotland,56194,407265,Tamim Iqbal,Mohammad Mahmudullah,Josh Davey,n,3.4,4.0,4.0,0.0,121.0,11.0,8.0,-0.26,3.69,-0.33,0.48,76.517,22.0,False,,,1,,"full delivery drifting on the pads as this is flicked behind through fine leg to pickup an easy boundary. Really loose from Davey, who is currently <b>second</b> on the <b>2015 World Cup wicket-takers' list</b> with eleven scalps"
331,2,Bangladesh,Scotland,56194,407265,Tamim Iqbal,Mohammad Mahmudullah,Josh Davey,n,3.5,1.0,1.0,0.0,235.0,43.0,1.0,0.27,6.62,0.80,0.82,78.748,23.0,False,,,0,,"this time goes aerially with a slice through third man, but this one ends up falling short of the fielder in the deep"
332,2,Bangladesh,Scotland,56025,407265,Mahmudullah,Tamim Iqbal,Josh Davey,y,3.6,1.0,1.0,0.0,121.0,172.0,6.0,-0.47,7.32,-0.54,0.90,73.460,24.0,False,,,1,,runs this one outside off just past backward point to steal a single
333,2,Bangladesh,Scotland,56025,509107,Mahmudullah,Tamim Iqbal,Iain Wardlaw,y,4.1,0.0,0.0,0.0,155.0,174.0,6.0,-0.33,1.73,-0.42,0.21,82.539,24.0,False,,,1,,brings the bat down to dig out this full delivery just outside off
334,2,Bangladesh,Scotland,56025,509107,Mahmudullah,Tamim Iqbal,Iain Wardlaw,y,4.2,4.0,4.0,0.0,5.0,178.0,6.0,-0.38,5.92,-0.44,0.70,81.827,28.0,False,,,1,,"simply opens the face to glide this length delivery down to third man, with the fielder putting in a useful dive to try and cut off some extra runs on the boundary edge, but fails to do so"
335,2,Bangladesh,Scotland,56025,509107,Mahmudullah,Tamim Iqbal,Iain Wardlaw,y,4.3,0.0,0.0,0.0,218.0,192.0,3.0,-0.25,8.98,-0.22,1.03,83.666,28.0,False,,,0,,"this time tucked away to the leg side, but times it a bit too well to the close-in fielder"
336,2,Bangladesh,Scotland,56025,509107,Mahmudullah,Tamim Iqbal,Iain Wardlaw,y,4.4,1.0,1.0,0.0,280.0,148.0,2.0,-0.11,6.21,0.12,0.81,83.645,29.0,False,,,1,,"straying on the pads, on a fuller length, as this is glanced behind of square on the leg side"
337,2,Bangladesh,Scotland,56194,509107,Tamim Iqbal,Mohammad Mahmudullah,Iain Wardlaw,n,4.5,0.0,0.0,0.0,175.0,187.0,5.0,0.02,5.26,0.19,0.67,84.334,29.0,False,,,1,,full delivery on middle and leg which is steered down to mid-on
338,2,Bangladesh,Scotland,56194,509107,Tamim Iqbal,Mohammad Mahmudullah,Iain Wardlaw,n,4.6,0.0,0.0,0.0,219.0,180.0,3.0,0.04,8.34,0.44,0.95,83.986,29.0,False,,,1,,"punched away at the top of the bounce towards the covers, with the fielder in question doing well to get his body behind the ball"
339,2,Bangladesh,Scotland,56025,399259,Mahmudullah,Tamim Iqbal,Alasdair Evans,y,5.1,4.0,4.0,0.0,4.0,210.0,6.0,-0.66,9.30,-0.67,0.91,78.823,33.0,False,,,1,,and he is greeted with a hard slap through cover to find a boundary
340,2,Bangladesh,Scotland,56025,399259,Mahmudullah,Tamim Iqbal,Alasdair Evans,y,5.2,0.0,0.0,0.0,243.0,155.0,2.0,-0.24,6.80,-0.04,0.54,79.849,33.0,False,,,1,,"this time looks to get past the square-leg, but locates him with a neat flick off the pads"
341,2,Bangladesh,Scotland,56025,399259,Mahmudullah,Tamim Iqbal,Alasdair Evans,y,5.3,2.0,2.0,0.0,32.0,120.0,7.0,-0.73,7.68,-0.60,1.04,78.909,35.0,False,,,1,,"width on offer as Mahmudullah goes hard once more, this time over backward point with a shot into the ground before bouncing over the fielder, but is reined in by the boundary rider at a squarish third man"
342,2,Bangladesh,Scotland,56025,399259,Mahmudullah,Tamim Iqbal,Alasdair Evans,y,5.4,4.0,4.0,0.0,343.0,246.0,3.0,-0.10,3.09,0.03,0.37,81.732,39.0,False,,,1,,picks his spot at deep midwicket to get away a clip which just about manages to have enough legs on it to reach the rope
343,2,Bangladesh,Scotland,56025,399259,Mahmudullah,Tamim Iqbal,Alasdair Evans,y,5.5,0.0,0.0,0.0,181.0,184.0,4.0,-0.39,7.34,-0.18,0.74,78.560,39.0,False,,,1,,solid in defense as this one nipped in upon pitching outside of off
344,2,Bangladesh,Scotland,56025,399259,Mahmudullah,Tamim Iqbal,Alasdair Evans,y,5.6,1.0,1.0,0.0,218.0,126.0,1.0,-0.61,6.79,-0.45,0.66,76.495,40.0,False,,,0,,gets away with a French cut through fine leg as he retains the strike
345,2,Bangladesh,Scotland,56025,509107,Mahmudullah,Tamim Iqbal,Iain Wardlaw,y,6.1,2.0,2.0,0.0,304.0,208.0,3.0,-0.36,10.71,-0.33,1.36,83.050,42.0,False,,,1,,bangs in a shorter one which is pulled rather haphazardly through midwicket
346,2,Bangladesh,Scotland,56025,509107,Mahmudullah,Tamim Iqbal,Iain Wardlaw,y,6.2,1.0,1.0,0.0,127.0,196.0,6.0,-0.42,5.50,-0.43,0.60,83.760,43.0,False,,,1,,"full, outside of off, as he leans into a drive towards extra-cover before setting off for the tight single"
347,2,Bangladesh,Scotland,56194,509107,Tamim Iqbal,Mohammad Mahmudullah,Iain Wardlaw,n,6.3,0.0,0.0,0.0,147.0,189.0,6.0,-0.13,7.57,0.03,0.94,83.878,43.0,False,,,1,,defends this back of a length softly to the leg side
348,2,Bangladesh,Scotland,56194,509107,Tamim Iqbal,Mohammad Mahmudullah,Iain Wardlaw,n,6.4,0.0,0.0,0.0,151.0,189.0,6.0,0.05,6.43,0.33,0.72,81.686,43.0,False,,,0,,mishits this attempt drive through long off as the ball ends up somewhere near midwicket
349,2,Bangladesh,Scotland,56194,509107,Tamim Iqbal,Mohammad Mahmudullah,Iain Wardlaw,n,6.5,0.0,0.0,0.0,136.0,194.0,6.0,-0.24,7.11,-0.08,0.82,83.737,43.0,False,,,1,,"turns away this slightly back of a length, but finds the man at square-leg, who is quite inside the circle"
350,2,Bangladesh,Scotland,56194,509107,Tamim Iqbal,Mohammad Mahmudullah,Iain Wardlaw,n,6.6,6.0,6.0,0.0,7.0,106.0,7.0,-0.31,12.49,-0.06,1.97,80.669,49.0,False,,,1,,"Tamim continues to ride his luck as he gets away this rather rash hook over long leg, with this just having enough to sail over the fielder waiting in the deep. Just flew over his finger tips as he strained to reach for it. He did have a couple of feet to work with behind him, so perhaps he could have got a bit deeper to compensate for the dip"
351,2,Bangladesh,Scotland,56025,399259,Mahmudullah,Tamim Iqbal,Alasdair Evans,y,7.1,0.0,0.0,0.0,121.0,184.0,6.0,-0.42,6.90,-0.29,0.82,81.519,49.0,False,,,1,,punches this length delivery outside of off straight to silly mid-on
352,2,Bangladesh,Scotland,56025,399259,Mahmudullah,Tamim Iqbal,Alasdair Evans,y,7.2,0.0,0.0,0.0,177.0,214.0,5.0,-0.35,6.07,-0.15,0.66,79.817,49.0,False,,,1,,slips in a fuller delivery which is struck back to him as he just gets his foot out to stop this one from going past
353,2,Bangladesh,Scotland,56025,399259,Mahmudullah,Tamim Iqbal,Alasdair Evans,y,7.3,0.0,0.0,0.0,207.0,234.0,4.0,-0.44,8.84,-0.19,0.99,81.219,49.0,False,,,1,,defended off the back foot to this short of a length outside off
354,2,Bangladesh,Scotland,56025,399259,Mahmudullah,Tamim Iqbal,Alasdair Evans,y,7.4,0.0,0.0,0.0,211.0,172.0,3.0,-0.39,6.23,-0.18,0.60,77.924,49.0,False,,,1,,"tries to angle one away through midwicket, but picks out the close-in fielder on the leg side"
355,2,Bangladesh,Scotland,56025,399259,Mahmudullah,Tamim Iqbal,Alasdair Evans,y,7.5,0.0,0.0,0.0,124.0,158.0,7.0,-0.56,7.64,-0.49,0.83,79.454,49.0,False,,,1,,"gets in a good stride before looking to work the bowler past backward point, but ends up finding the fielder"
356,2,Bangladesh,Scotland,56025,399259,Mahmudullah,Tamim Iqbal,Alasdair Evans,y,7.6,0.0,0.0,0.0,132.0,200.0,6.0,-0.49,7.75,-0.45,0.91,79.554,49.0,False,,,1,,"tries to pick the gap through the cover region, but fails to do so"
357,2,Bangladesh,Scotland,56194,407265,Tamim Iqbal,Mohammad Mahmudullah,Josh Davey,n,8.1,2.0,2.0,0.0,312.0,210.0,3.0,0.27,7.59,0.86,0.92,77.173,51.0,False,,,0,,"and he almost added to his tally as Tamim attacked this back of a length outside off, chipping this just past the man at extra-cover. <b>Fifty</b> up for Bangladesh"
358,2,Bangladesh,Scotland,56194,407265,Tamim Iqbal,Mohammad Mahmudullah,Josh Davey,n,8.2,4.0,4.0,0.0,347.0,242.0,3.0,0.33,5.57,0.70,0.61,78.451,55.0,False,,,1,,fires one in the slot and Tamim obliges as he lasers this cover drive to find the boundary in no time
359,2,Bangladesh,Scotland,56194,407265,Tamim Iqbal,Mohammad Mahmudullah,Josh Davey,n,8.3,0.0,0.0,0.0,0.0,0.0,0.0,0.15,7.09,0.45,0.79,75.642,55.0,False,,,1,,shoulders arms to this fuller length going across him
360,2,Bangladesh,Scotland,56194,407265,Tamim Iqbal,Mohammad Mahmudullah,Josh Davey,n,8.4,0.0,0.0,0.0,175.0,198.0,5.0,-0.06,6.39,0.17,0.73,77.535,55.0,False,,,1,,slips in a fuller delivery on middle and leg. This one is defended away towards mid-on
361,2,Bangladesh,Scotland,56194,407265,Tamim Iqbal,Mohammad Mahmudullah,Josh Davey,n,8.5,0.0,0.0,0.0,223.0,184.0,3.0,-0.01,7.81,0.32,0.84,78.406,55.0,False,,,1,,this time defended away on the off side by the batsman
362,2,Bangladesh,Scotland,56194,407265,Tamim Iqbal,Mohammad Mahmudullah,Josh Davey,n,8.6,2.0,2.0,0.0,224.0,306.0,4.0,-0.05,8.49,0.33,1.16,77.516,57.0,False,,,0,,"backs away a touch as the bowler, who saw the initial movement, drags the length, but this doesn't deter Tamim from clubbing this back over through long off in an attempt to pickup a boundary"
363,2,Bangladesh,Scotland,56025,399259,Mahmudullah,Tamim Iqbal,Alasdair Evans,y,9.1,0.0,0.0,0.0,120.0,172.0,6.0,-0.59,6.81,-0.64,0.67,81.480,57.0,False,,,1,,"looks to go hard square off the wicket on the off side, but picks out point"
364,2,Bangladesh,Scotland,56025,399259,Mahmudullah,Tamim Iqbal,Alasdair Evans,y,9.2,0.0,0.0,0.0,119.0,145.0,7.0,-0.50,8.99,-0.30,1.03,81.039,57.0,False,,,1,,short of a length outside of off which is run down towards the third man region
365,2,Bangladesh,Scotland,56025,399259,Mahmudullah,Tamim Iqbal,Alasdair Evans,y,9.3,1.0,1.0,0.0,111.0,199.0,6.0,-0.64,8.36,-0.57,0.90,77.151,58.0,False,,,1,,"Bangladesh playing some risky cricket as this slap from Mahmudullah is stopped by the man on the ring at cover, before some hesitation by the two batsmen affords him precious seconds to pickup and fire in a throw at the non-striker's, which has Mahmudullah haring to that end as he dives forward to just make his ground before the throw"
366,2,Bangladesh,Scotland,56194,399259,Tamim Iqbal,Mohammad Mahmudullah,Alasdair Evans,n,9.4,0.0,0.0,0.0,239.0,238.0,4.0,0.11,6.05,0.52,0.58,78.465,58.0,False,,,1,,"driven firmly towards mid-off, but no one where he could run the single"
367,2,Bangladesh,Scotland,56194,399259,Tamim Iqbal,Mohammad Mahmudullah,Alasdair Evans,n,9.5,0.0,0.0,0.0,136.0,205.0,6.0,0.43,5.18,0.24,0.62,76.746,58.0,False,,,0,,"mishits this attempted drive through long off, with this stopped by the silly mid-on fielder"
368,2,Bangladesh,Scotland,56194,399259,Tamim Iqbal,Mohammad Mahmudullah,Alasdair Evans,n,9.6,4.0,4.0,0.0,334.0,270.0,3.0,0.48,5.50,0.38,0.60,78.352,62.0,False,,,1,,"fires in a full, wide delivery which Tamim places expertly through extra-cover to bring up his fifth boundary"
369,2,Bangladesh,Scotland,56025,407265,Mahmudullah,Tamim Iqbal,Josh Davey,y,10.1,0.0,0.0,0.0,131.0,189.0,6.0,-0.27,7.64,-0.14,0.75,78.971,62.0,False,,,1,,gets forward to this length delivery just outside off stump
370,2,Bangladesh,Scotland,56025,407265,Mahmudullah,Tamim Iqbal,Josh Davey,y,10.2,1.0,1.0,0.0,273.0,113.0,2.0,-0.37,6.59,-0.21,0.78,78.566,63.0,False,,,1,,"gets away a rather streaky clip through backward square, with the pair scampering a single"
371,2,Bangladesh,Scotland,56194,407265,Tamim Iqbal,Mohammad Mahmudullah,Josh Davey,n,10.3,0.0,0.0,0.0,179.0,182.0,5.0,0.03,7.02,0.32,0.75,78.161,63.0,False,,,1,,just about digs out this fuller one on middle and off
372,2,Bangladesh,Scotland,56194,407265,Tamim Iqbal,Mohammad Mahmudullah,Josh Davey,n,10.4,0.0,0.0,0.0,0.0,0.0,0.0,-0.06,8.17,0.33,1.06,-2.237,63.0,False,,,0,,"delivers a jaffa, on a middle to off-stump line, as Tamim plays just inside of the line as this nipped away upon pitching"
373,2,Bangladesh,Scotland,56194,407265,Tamim Iqbal,Mohammad Mahmudullah,Josh Davey,n,10.5,1.0,1.0,0.0,214.0,190.0,3.0,-0.22,10.07,-0.17,1.44,75.367,64.0,False,,,1,,able to hook the fast bowler through fine leg to get to the other end
374,2,Bangladesh,Scotland,56025,407265,Mahmudullah,Tamim Iqbal,Josh Davey,y,10.6,0.0,1.0,1.0,0.0,0.0,0.0,-0.01,7.04,0.31,0.80,78.205,65.0,False,,,1,Wd,strays down the leg side as Mahmudullah fails to get away the clip behind square
375,2,Bangladesh,Scotland,56025,407265,Mahmudullah,Tamim Iqbal,Josh Davey,y,10.6,0.0,0.0,0.0,130.0,190.0,6.0,-0.48,7.98,-0.53,0.83,76.082,65.0,False,,,1,,safely negotiates this length delivery outside of off to end the over
376,2,Bangladesh,Scotland,56194,399259,Tamim Iqbal,Mohammad Mahmudullah,Alasdair Evans,n,11.1,1.0,1.0,0.0,246.0,149.0,2.0,0.42,7.96,0.18,0.81,79.576,66.0,False,,,1,,pushes at this length delivery through the cover point region as they are able to steal a single
377,2,Bangladesh,Scotland,56025,399259,Mahmudullah,Tamim Iqbal,Alasdair Evans,y,11.2,6.0,6.0,0.0,359.0,189.0,3.0,-0.41,11.73,0.19,1.56,76.355,72.0,False,,,1,,Mahmudullah gives Evans the charge as he hammers this shorter one high over backward square to pickup a 70m six
378,2,Bangladesh,Scotland,56025,399259,Mahmudullah,Tamim Iqbal,Alasdair Evans,y,11.3,0.0,0.0,0.0,144.0,179.0,6.0,-0.36,5.40,-0.35,0.65,80.794,72.0,False,,,1,,"sensibly looks to guide one past a packed cover region, but is unavailable to get this past the fielder"
379,2,Bangladesh,Scotland,56025,399259,Mahmudullah,Tamim Iqbal,Alasdair Evans,y,11.4,1.0,1.0,0.0,96.0,182.0,6.0,-0.33,8.43,-0.02,0.96,73.277,73.0,False,,,1,,back of a length and tucked away by Mahmudullah to the leg side
380,2,Bangladesh,Scotland,56194,399259,Tamim Iqbal,Mohammad Mahmudullah,Alasdair Evans,n,11.5,1.0,1.0,0.0,343.0,184.0,3.0,0.56,3.16,0.54,0.33,78.234,74.0,False,,,1,,"goes round the wicket to Tamim as he fires in a full, delivery, with some width on offer, as Tamim drills this towards deep cover"
381,2,Bangladesh,Scotland,56025,399259,Mahmudullah,Tamim Iqbal,Alasdair Evans,y,11.6,4.0,4.0,0.0,332.0,297.0,3.0,-0.47,9.50,-0.36,1.01,78.357,78.0,False,,,1,,length delivery which just sits up for Mahmudullah as he is able to pull this away handsomely through cow corner for four
382,2,Bangladesh,Scotland,56194,407265,Tamim Iqbal,Mohammad Mahmudullah,Josh Davey,n,12.1,1.0,1.0,0.0,246.0,181.0,3.0,0.22,6.66,0.58,0.75,68.412,79.0,False,,,1,,needles a single through cover to get off strike
383,2,Bangladesh,Scotland,56025,407265,Mahmudullah,Tamim Iqbal,Josh Davey,y,12.2,0.0,0.0,0.0,0.0,0.0,0.0,-0.54,6.75,-0.73,0.77,75.149,79.0,False,,,0,,is late on this attempted flash through point as the ball swings away upon pitching
384,2,Bangladesh,Scotland,56025,407265,Mahmudullah,Tamim Iqbal,Josh Davey,y,12.3,1.0,1.0,0.0,245.0,104.0,2.0,-0.23,8.40,0.12,0.95,78.920,80.0,False,,,1,,delivery slanting on the pads as this is glanced behind to deep square-leg
385,2,Bangladesh,Scotland,56194,407265,Tamim Iqbal,Mohammad Mahmudullah,Josh Davey,n,12.4,4.0,4.0,0.0,351.0,236.0,3.0,0.41,5.71,0.80,0.63,76.920,84.0,False,,,1,,"full and going across as Tamim uncorks a classic cover drive. Trademark shot from Tamim, who looked quite stylish as he pulled off the shot"
386,2,Bangladesh,Scotland,56194,407265,Tamim Iqbal,Mohammad Mahmudullah,Josh Davey,n,12.5,0.0,0.0,0.0,216.0,176.0,3.0,-0.08,8.27,0.13,0.80,79.247,84.0,False,,,1,,"slower, short of a length, which is handled with aplomb by Tamim"
387,2,Bangladesh,Scotland,56194,407265,Tamim Iqbal,Mohammad Mahmudullah,Josh Davey,n,12.6,1.0,1.0,0.0,338.0,203.0,3.0,0.42,6.23,0.86,0.66,78.963,85.0,False,,,1,,"far too wide, and full, as this time Tamim goes a bit squarer to find the boundary rider near deep extra-cover"
388,2,Bangladesh,Scotland,56194,297488,Tamim Iqbal,Mohammad Mahmudullah,Matt Machan,n,13.1,0.0,0.0,0.0,200.0,183.0,3.0,0.31,5.09,0.10,0.86,53.205,85.0,False,,,1,,gets a good stride to smother the spin of this one floated outside of off from round the wicket
389,2,Bangladesh,Scotland,56194,297488,Tamim Iqbal,Mohammad Mahmudullah,Matt Machan,n,13.2,1.0,1.0,0.0,336.0,232.0,3.0,0.63,4.18,0.53,0.74,53.102,86.0,False,,,1,,attacks the ball this time as he picks out the man at deep cover
390,2,Bangladesh,Scotland,56025,297488,Mahmudullah,Tamim Iqbal,Matt Machan,y,13.3,0.0,0.0,0.0,222.0,180.0,3.0,-0.14,4.94,0.07,0.70,54.540,86.0,False,,,1,,spins one back into him as this is flicked away to midwicket
391,2,Bangladesh,Scotland,56025,297488,Mahmudullah,Tamim Iqbal,Matt Machan,y,13.4,1.0,1.0,0.0,296.0,73.0,2.0,-0.14,7.24,0.15,0.75,58.620,87.0,False,,,1,,"too straight and a little shorter as well, flicked to deep backward square leg"
392,2,Bangladesh,Scotland,56194,297488,Tamim Iqbal,Mohammad Mahmudullah,Matt Machan,n,13.5,0.0,0.0,0.0,122.0,169.0,6.0,0.20,7.21,-0.30,0.96,60.103,87.0,False,,,0,,"looks to tuck away the bowler on the leg side, but picks out the man at square-leg"
