,inning,batting_team,bowling_team,batsman,bowler,batsman_name,non_striker,bowler_name,bat_right_handed,ovr,runs_batter,runs_w_extras,extras,x,y,z,landing_x,landing_y,ended_x,ended_y,ball_speed,cumul_runs,wicket,wicket_method,who_out,control,extras_type,comm
286,1,United Arab Emirates,Zimbabwe,533862,425639,Mohammad Naveed,Amjad Javed,Tendai Chatara,y,45.6,0.0,0.0,0.0,0.0,0.0,0.0,-0.61,7.34,-0.14,1.00,69.232,246.0,False,,,0,,"slower ball outside off and Naveed, making room to slice through the off side, can't make contact"
287,1,United Arab Emirates,Zimbabwe,25613,55870,Amjad Javed,Mohammad Naveed,Sean Williams,y,46.1,0.0,0.0,0.0,152.0,183.0,6.0,-0.09,4.99,0.07,0.84,55.298,246.0,False,,,1,,"fullish on off stump, blocked to short extra cover"
288,1,United Arab Emirates,Zimbabwe,25613,55870,Amjad Javed,Mohammad Naveed,Sean Williams,y,46.2,1.0,1.0,0.0,51.0,217.0,6.0,-0.38,5.35,-0.20,0.76,57.328,247.0,False,,,0,,tossed up slower and he clears his front leg to slice that over cover
289,1,United Arab Emirates,Zimbabwe,533862,55870,Mohammad Naveed,Amjad Javed,Sean Williams,y,46.3,1.0,1.0,0.0,28.0,180.0,6.0,-0.32,4.83,-0.12,0.54,59.487,248.0,False,,,1,,"makes a lot of room, exposes all his stumps, and carves this out to sweeper cover"
290,1,United Arab Emirates,Zimbabwe,25613,55870,Amjad Javed,Mohammad Naveed,Sean Williams,y,46.4,0.0,0.0,0.0,0.0,0.0,0.0,-0.58,4.20,-0.56,0.59,60.012,248.0,False,,,0,,sees him make room again and fires it quicker and wider to beat the attempted flat-bat slap
291,1,United Arab Emirates,Zimbabwe,25613,55870,Amjad Javed,Mohammad Naveed,Sean Williams,y,46.5,1.0,1.0,0.0,294.0,197.0,3.0,0.19,4.75,0.35,0.69,52.335,249.0,False,,,1,,"full on middle and leg, clipped towards midwicket"
292,1,United Arab Emirates,Zimbabwe,533862,55870,Mohammad Naveed,Amjad Javed,Sean Williams,y,46.6,1.0,1.0,0.0,309.0,226.0,3.0,0.20,3.20,0.30,0.66,52.677,250.0,False,,,1,,"on the pads, tucked away towards deep square leg"
293,1,United Arab Emirates,Zimbabwe,533862,425639,Mohammad Naveed,Amjad Javed,Tendai Chatara,y,47.1,1.0,1.0,0.0,108.0,307.0,5.0,0.15,0.32,0.18,0.08,83.798,251.0,False,,,1,,low full-toss on middle and leg and he gives himself room to poke that away to sweeper cover
294,1,United Arab Emirates,Zimbabwe,25613,425639,Amjad Javed,Mohammad Naveed,Tendai Chatara,y,47.2,0.0,0.0,0.0,0.0,0.0,0.0,-0.02,5.22,0.53,0.67,67.170,251.0,False,,,0,,"slower ball, follows the batsman as he backs away outside leg, and he slogs and misses"
295,1,United Arab Emirates,Zimbabwe,25613,425639,Amjad Javed,Mohammad Naveed,Tendai Chatara,y,47.3,1.0,1.0,0.0,321.0,99.0,2.0,-0.18,8.46,0.85,1.16,66.911,252.0,False,,,1,,"slower ball, again he follows the batsman. This time he manages to heave it away towards deep square leg"
296,1,United Arab Emirates,Zimbabwe,533862,425639,Mohammad Naveed,Amjad Javed,Tendai Chatara,y,47.4,0.0,0.0,0.0,182.0,197.0,4.0,0.00,1.27,0.10,0.19,82.442,252.0,False,,,0,,"excellent yorker now, and he can only dig it back towards the bowler"
297,1,United Arab Emirates,Zimbabwe,533862,425639,Mohammad Naveed,Amjad Javed,Tendai Chatara,y,47.5,1.0,1.0,0.0,61.0,280.0,6.0,0.12,2.68,0.29,0.33,80.131,253.0,False,,,1,,"gives himself room again, drives the leg-stump yorker down to long-off"
298,1,United Arab Emirates,Zimbabwe,25613,425639,Amjad Javed,Mohammad Naveed,Tendai Chatara,y,47.6,1.0,1.0,0.0,289.0,104.0,2.0,0.41,0.41,0.46,0.08,84.400,254.0,False,,,1,,"low full-toss on leg stump, swiped away towards deep square leg"
299,1,United Arab Emirates,Zimbabwe,25613,55705,Amjad Javed,Mohammad Naveed,Tinashe Panyangara,y,48.1,4.0,4.0,0.0,31.0,271.0,6.0,-0.22,3.53,-0.14,0.47,77.488,258.0,False,,,1,,full on off stump and Javed makes room and scoops it over cover and finds the boundary
300,1,United Arab Emirates,Zimbabwe,25613,55705,Amjad Javed,Mohammad Naveed,Tinashe Panyangara,y,48.2,4.0,4.0,0.0,40.0,300.0,6.0,-0.27,3.76,-0.22,0.48,76.039,262.0,False,,,1,,"and again, this time it's hit much more cleanly, flatter, and it goes straighter. Long-off didn't have too far to move to his left but he had no chance of cutting it off"
301,1,United Arab Emirates,Zimbabwe,25613,55705,Amjad Javed,Mohammad Naveed,Tinashe Panyangara,y,48.3,0.0,0.0,0.0,105.0,211.0,6.0,-0.03,1.55,0.01,0.24,79.404,262.0,False,,,1,,in the blockhole on off stump and he pokes it to the man at extra cover
302,1,United Arab Emirates,Zimbabwe,25613,55705,Amjad Javed,Mohammad Naveed,Tinashe Panyangara,y,48.4,6.0,6.0,0.0,105.0,348.0,5.0,-0.03,3.92,0.12,0.50,77.793,268.0,False,,,1,,"looks for the blockhole, can't find it, and Javed gets inside the line and lifts it casually over the wide long-off boundary. Made that look so easy"
303,1,United Arab Emirates,Zimbabwe,25613,55705,Amjad Javed,Mohammad Naveed,Tinashe Panyangara,y,48.5,1.0,1.0,0.0,293.0,219.0,3.0,-0.24,8.09,0.25,1.03,67.817,269.0,False,,,0,,"slower ball now, angling in and cramping the batsman, who slogged it high in the air over the leg side, falls well out of reach of the fielder running back from midwicket"
304,1,United Arab Emirates,Zimbabwe,533862,55705,Mohammad Naveed,Amjad Javed,Tinashe Panyangara,y,48.6,0.0,1.0,1.0,0.0,0.0,0.0,-0.38,13.10,0.25,1.91,76.103,270.0,False,,,0,Wd,"comes down the track and Panyangara bangs it in short. Swings and misses and the umpire calls it wide. Was it really that high? It probably was, as replays from square-on suggest"
305,1,United Arab Emirates,Zimbabwe,533862,55705,Mohammad Naveed,Amjad Javed,Tinashe Panyangara,y,48.6,4.0,4.0,0.0,19.0,245.0,6.0,-0.12,2.86,-0.02,0.31,79.727,274.0,False,,,1,,"full, just a bit of width outside off, and he carves it over cover point and picks up another boundary. 21 off that over."
306,1,United Arab Emirates,Zimbabwe,25613,425639,Amjad Javed,Mohammad Naveed,Tendai Chatara,y,49.1,0.0,4.0,4.0,0.0,0.0,0.0,-0.65,10.54,0.10,1.20,77.754,278.0,False,,,0,B,"slower ball and that's some more poor keeping from Taylor. It was the slower one, the batsman swung and missed, and he should have been prepared for the ball to roll through to him. He didn't stay low, and it beat Taylor and ran away for four byes"
307,1,United Arab Emirates,Zimbabwe,25613,425639,Amjad Javed,Mohammad Naveed,Tendai Chatara,y,49.2,0.0,0.0,0.0,128.0,207.0,6.0,-0.16,5.07,0.24,0.51,81.981,278.0,False,,,1,,"full on off stump, slapped straight to cover"
308,1,United Arab Emirates,Zimbabwe,25613,425639,Amjad Javed,Mohammad Naveed,Tendai Chatara,y,49.3,4.0,4.0,0.0,283.0,25.0,1.0,-0.52,10.08,0.45,1.23,68.220,282.0,False,,,0,,"sees the batsman make room, follows him with a short ball. He goes for the pull, and gets a helpful top-edge over short fine leg"
309,1,United Arab Emirates,Zimbabwe,25613,425639,Amjad Javed,Mohammad Naveed,Tendai Chatara,y,49.4,0.0,0.0,0.0,0.0,0.0,0.0,0.15,4.01,0.57,0.39,84.206,282.0,False,,,0,,"full, aiming at the batsman's retreating feet. Another swing and miss"
310,1,United Arab Emirates,Zimbabwe,25613,425639,Amjad Javed,Mohammad Naveed,Tendai Chatara,y,49.5,1.0,1.0,0.0,284.0,69.0,2.0,0.35,1.58,0.52,0.23,81.751,283.0,False,,,1,,"good yorker, and he manages to squeeze it away towards deep square leg"
311,1,United Arab Emirates,Zimbabwe,533862,425639,Mohammad Naveed,Amjad Javed,Tendai Chatara,y,49.6,2.0,2.0,0.0,295.0,279.0,3.0,0.31,2.40,0.64,0.26,80.898,285.0,False,,,1,,"another yorker, clipped away to the right of long-on and he ends the innings with a couple"
312,2,Zimbabwe,United Arab Emirates,299572,533862,Sikandar Raza,Regis Chakabva,Mohammad Naveed,y,0.1,0.0,1.0,1.0,0.0,0.0,0.0,-0.87,6.08,-1.17,0.60,83.894,1.0,False,,,1,Wd,"full, wide outswinger, very wide outside off, left alone"
313,2,Zimbabwe,United Arab Emirates,299572,533862,Sikandar Raza,Regis Chakabva,Mohammad Naveed,y,0.1,0.0,0.0,0.0,181.0,178.0,4.0,-0.33,5.53,-0.26,0.64,84.841,1.0,False,,,1,,"length ball on a fourth-stump line, blocked back to the bowler"
314,2,Zimbabwe,United Arab Emirates,299572,533862,Sikandar Raza,Regis Chakabva,Mohammad Naveed,y,0.2,0.0,0.0,0.0,0.0,0.0,0.0,-0.69,6.61,-0.76,0.79,84.438,1.0,False,,,1,,"fifth-stump line this time, Raza ignores it"
315,2,Zimbabwe,United Arab Emirates,299572,533862,Sikandar Raza,Regis Chakabva,Mohammad Naveed,y,0.3,0.0,0.0,0.0,0.0,0.0,0.0,-0.44,6.49,-0.48,0.75,86.938,1.0,False,,,1,,"goes wider of the crease, angles it closer to off stump, straightens it away. Still not close enough to make Raza play"
316,2,Zimbabwe,United Arab Emirates,299572,533862,Sikandar Raza,Regis Chakabva,Mohammad Naveed,y,0.4,0.0,0.0,0.0,0.0,0.0,0.0,-0.57,7.13,-0.59,0.82,85.273,1.0,False,,,1,,"excellent line, continues to probe that channel, and Raza continues to leave. For now"
317,2,Zimbabwe,United Arab Emirates,299572,533862,Sikandar Raza,Regis Chakabva,Mohammad Naveed,y,0.5,0.0,0.0,0.0,0.0,0.0,0.0,-0.45,7.15,-0.37,0.85,85.565,1.0,False,,,1,,"beauty. Angles it in, a touch closer to off than the previous two deliveries, gets it to straighten. Another good leave from Raza"
318,2,Zimbabwe,United Arab Emirates,299572,533862,Sikandar Raza,Regis Chakabva,Mohammad Naveed,y,0.6,0.0,0.0,0.0,0.0,0.0,0.0,-0.53,6.22,-0.61,0.82,82.448,1.0,False,,,1,,"a bit fuller, and Raza gets a big front stride in before leaving another ball alone. Excellent first over from Naveed."
319,2,Zimbabwe,United Arab Emirates,293831,25613,Regis Chakabva,Sikandar Raza,Amjad Javed,y,1.1,0.0,0.0,0.0,119.0,156.0,7.0,-0.28,7.27,-0.36,0.78,77.480,1.0,False,,,1,,"back of a length outside off, angling in. Chakabva goes back and across to defend"
320,2,Zimbabwe,United Arab Emirates,293831,25613,Regis Chakabva,Sikandar Raza,Amjad Javed,y,1.2,1.0,1.0,0.0,292.0,67.0,2.0,-0.16,7.87,-0.01,0.86,78.595,2.0,False,,,1,,"straighter now, a touch too straight, and he shuffles across before tucking it off his pads to fine leg"
321,2,Zimbabwe,United Arab Emirates,299572,25613,Sikandar Raza,Regis Chakabva,Amjad Javed,y,1.3,0.0,0.0,0.0,0.0,0.0,0.0,-0.43,5.54,-0.55,0.59,78.355,2.0,False,,,1,,outswinger on a good length outside off. Raza leaves again
322,2,Zimbabwe,United Arab Emirates,299572,25613,Sikandar Raza,Regis Chakabva,Amjad Javed,y,1.4,0.0,1.0,1.0,222.0,140.0,2.0,-0.04,6.85,0.21,0.75,79.728,3.0,False,,,0,Lb,this one starts on middle and leg and comes in off the pitch. Raza can't connect with the flick. Off his pad into the leg side
323,2,Zimbabwe,United Arab Emirates,293831,25613,Regis Chakabva,Sikandar Raza,Amjad Javed,y,1.5,0.0,0.0,0.0,163.0,188.0,5.0,-0.39,10.65,-0.36,1.05,70.807,3.0,False,,,1,,"back of a length on off stump, blocked into the covers"
324,2,Zimbabwe,United Arab Emirates,293831,25613,Regis Chakabva,Sikandar Raza,Amjad Javed,y,1.6,0.0,0.0,0.0,245.0,174.0,3.0,-0.11,5.75,-0.11,0.57,78.092,3.0,False,,,1,,"fullish on off stump, flicked to short midwicket"
325,2,Zimbabwe,United Arab Emirates,299572,533862,Sikandar Raza,Regis Chakabva,Mohammad Naveed,y,2.1,0.0,0.0,0.0,119.0,193.0,6.0,-0.53,5.85,-0.49,0.58,86.493,3.0,False,,,1,,"full outside off and he drives firmly into the covers, nearly bounces over short cover but the fielder jumped in the air and managed to cut it off"
326,2,Zimbabwe,United Arab Emirates,299572,533862,Sikandar Raza,Regis Chakabva,Mohammad Naveed,y,2.2,1.0,1.0,0.0,259.0,42.0,1.0,-0.43,7.67,-0.21,0.85,86.300,4.0,False,,,0,,"back of a length now and Raza is a little late on his defensive push off the back foot. Inside-edges it, and it sneaks between his legs, runs towards fine leg"
327,2,Zimbabwe,United Arab Emirates,293831,533862,Regis Chakabva,Sikandar Raza,Mohammad Naveed,y,2.3,0.0,0.0,0.0,241.0,182.0,3.0,-0.25,6.31,-0.12,0.65,85.094,4.0,False,,,1,,"fuller now, on off stump, defended with the angle into the on side"
328,2,Zimbabwe,United Arab Emirates,293831,533862,Regis Chakabva,Sikandar Raza,Mohammad Naveed,y,2.4,0.0,0.0,0.0,139.0,231.0,5.0,-0.42,4.54,-0.35,0.55,85.673,4.0,False,,,1,,"full outside off, comes forward and punches firmly to mid-off"
329,2,Zimbabwe,United Arab Emirates,293831,533862,Regis Chakabva,Sikandar Raza,Mohammad Naveed,y,2.5,0.0,0.0,0.0,0.0,0.0,0.0,-0.58,8.05,-0.58,1.04,83.516,4.0,False,,,1,,length ball on that fifth-stump line and Chakabva ignores it
330,2,Zimbabwe,United Arab Emirates,293831,533862,Regis Chakabva,Sikandar Raza,Mohammad Naveed,y,2.6,0.0,0.0,0.0,194.0,191.0,4.0,-0.48,9.69,-0.08,1.11,83.233,4.0,False,,,1,,"back of a length on off stump, defended watchfully into the on side"
331,2,Zimbabwe,United Arab Emirates,299572,25613,Sikandar Raza,Regis Chakabva,Amjad Javed,y,3.1,0.0,0.0,0.0,193.0,188.0,4.0,-0.25,11.35,-0.27,2.01,77.504,4.0,False,,,0,,"Javed is celebrating what he thinks is a caught and bowled but that is straight off the helmet. Short ball and he went for the hook, came on quicker than expected and hit him flush on the badge and popped straight up. The fielders check on Raza to see if he's fine. He is."
332,2,Zimbabwe,United Arab Emirates,299572,25613,Sikandar Raza,Regis Chakabva,Amjad Javed,y,3.2,0.0,0.0,0.0,172.0,188.0,5.0,-0.28,8.98,-0.23,1.11,80.978,4.0,False,,,1,,back of a length on off stump and he jumps across to defend from a very open position
333,2,Zimbabwe,United Arab Emirates,299572,25613,Sikandar Raza,Regis Chakabva,Amjad Javed,y,3.3,0.0,0.0,0.0,125.0,191.0,6.0,-0.31,6.41,-0.41,0.83,79.838,4.0,False,,,1,,"fullish outside off, a hint of swing away, gets forward and defends into the covers"
334,2,Zimbabwe,United Arab Emirates,299572,25613,Sikandar Raza,Regis Chakabva,Amjad Javed,y,3.4,4.0,4.0,0.0,6.0,196.0,6.0,-0.62,4.68,-0.77,0.51,80.993,8.0,False,,,1,,full and wide and he throws his bat at it and slices it high over backward point and it rushes away for four
335,2,Zimbabwe,United Arab Emirates,299572,25613,Sikandar Raza,Regis Chakabva,Amjad Javed,y,3.5,1.0,1.0,0.0,223.0,199.0,3.0,-0.15,7.40,-0.02,0.90,79.180,9.0,False,,,1,,length ball on middle and off and he lets it come on before tucking it just wide enough of short midwicket to pick up a single
336,2,Zimbabwe,United Arab Emirates,293831,25613,Regis Chakabva,Sikandar Raza,Amjad Javed,y,3.6,0.0,0.0,0.0,213.0,196.0,3.0,-0.28,5.97,-0.18,0.62,83.579,9.0,False,,,1,,"full, angling in towards off stump, Chakabva gets a solid stride out to defend towards mid-on"
337,2,Zimbabwe,United Arab Emirates,299572,533862,Sikandar Raza,Regis Chakabva,Mohammad Naveed,y,4.1,0.0,0.0,0.0,140.0,177.0,6.0,-0.36,8.69,-0.22,1.09,87.498,9.0,False,,,1,,"back of a length on off stump, blocked towards short cover"
338,2,Zimbabwe,United Arab Emirates,299572,533862,Sikandar Raza,Regis Chakabva,Mohammad Naveed,y,4.2,0.0,0.0,0.0,118.0,146.0,7.0,-0.49,7.10,-0.36,0.81,86.444,9.0,False,,,1,,"back of a length outside off, stands tall and carves that to backward point"
339,2,Zimbabwe,United Arab Emirates,299572,533862,Sikandar Raza,Regis Chakabva,Mohammad Naveed,y,4.3,3.0,3.0,0.0,332.0,151.0,2.0,-0.50,10.26,-0.35,1.50,82.833,12.0,False,,,1,,short outside off and he doesn't exactly middle the pull but picks out the vacant deep square leg area to place it into
340,2,Zimbabwe,United Arab Emirates,293831,533862,Regis Chakabva,Sikandar Raza,Mohammad Naveed,y,4.4,1.0,1.0,0.0,90.0,94.0,7.0,-0.44,9.96,-0.31,1.24,82.100,13.0,False,,,1,,back of a length outside off and he opens his bat face to steer than down to third man
341,2,Zimbabwe,United Arab Emirates,299572,533862,Sikandar Raza,Regis Chakabva,Mohammad Naveed,y,4.5,1.0,1.0,0.0,80.0,75.0,7.0,-0.60,7.88,-0.52,0.78,85.388,14.0,False,,,1,,"back of a length outside off, slapped away to third man"
342,2,Zimbabwe,United Arab Emirates,293831,533862,Regis Chakabva,Sikandar Raza,Mohammad Naveed,y,4.6,0.0,0.0,0.0,0.0,0.0,0.0,-0.40,7.43,-0.49,0.87,84.989,14.0,False,,,0,,"back of a length, straightens from a fourth-stump line, and beats Raza's uncertain poke"
343,2,Zimbabwe,United Arab Emirates,299572,25613,Sikandar Raza,Regis Chakabva,Amjad Javed,y,5.1,2.0,2.0,0.0,166.0,309.0,5.0,-0.23,7.40,-0.04,0.90,79.880,16.0,False,,,0,,"down the track comes Raza and once again he doesn't quite middle an aggressive shot. Goes hard and slices diagonally through the line, manages to clear the mid-off fielder"
344,2,Zimbabwe,United Arab Emirates,299572,25613,Sikandar Raza,Regis Chakabva,Amjad Javed,y,5.2,1.0,1.0,0.0,242.0,144.0,2.0,-0.22,8.26,0.05,0.97,79.965,17.0,False,,,0,,"shortish, doesn't get up as much as Raza expects, and he ends up pulling from thigh height towards square leg"
345,2,Zimbabwe,United Arab Emirates,293831,25613,Regis Chakabva,Sikandar Raza,Amjad Javed,y,5.3,0.0,0.0,0.0,217.0,162.0,2.0,-0.03,6.83,0.20,0.88,79.979,17.0,False,,,0,,"angled in towards leg stump, and Chakabva is a little late on his flick. Rolls towards square leg"
346,2,Zimbabwe,United Arab Emirates,293831,25613,Regis Chakabva,Sikandar Raza,Amjad Javed,y,5.4,0.0,0.0,0.0,111.0,144.0,7.0,-0.32,7.25,-0.34,0.89,75.829,17.0,False,,,1,,"length ball outside off and he comes forward to dab it to the left of backward point, who makes a diving save and stops the batsmen from taking the single"
347,2,Zimbabwe,United Arab Emirates,293831,25613,Regis Chakabva,Sikandar Raza,Amjad Javed,y,5.5,1.0,1.0,0.0,122.0,196.0,6.0,-0.46,7.89,-0.42,0.90,79.792,18.0,False,,,1,,"back of a length outside off, punched into the covers"
348,2,Zimbabwe,United Arab Emirates,299572,25613,Sikandar Raza,Regis Chakabva,Amjad Javed,y,5.6,0.0,0.0,0.0,184.0,187.0,4.0,-0.24,8.06,-0.13,0.91,81.497,18.0,False,,,1,,"back of a length, nips in a touch towards off stump and Raza defends awkwardly off the back foot"
349,2,Zimbabwe,United Arab Emirates,293831,533862,Regis Chakabva,Sikandar Raza,Mohammad Naveed,y,6.1,0.0,0.0,0.0,121.0,149.0,7.0,-0.47,8.29,-0.14,1.03,85.568,18.0,False,,,1,,"back of a length on off stump, punched to short extra cover"
350,2,Zimbabwe,United Arab Emirates,293831,533862,Regis Chakabva,Sikandar Raza,Mohammad Naveed,y,6.2,4.0,4.0,0.0,85.0,19.0,8.0,-0.55,9.89,-0.27,1.16,85.622,22.0,False,,,1,,"shot. That was angled in, cramping Chakabva for room, but he simply leaned away and opened his bat face to guide it wide of second slip"
351,2,Zimbabwe,United Arab Emirates,293831,533862,Regis Chakabva,Sikandar Raza,Mohammad Naveed,y,6.3,0.0,0.0,0.0,205.0,191.0,4.0,-0.29,7.92,0.00,1.05,83.626,22.0,False,,,1,,"length ball on off stump, nurdled towards short midwicket"
352,2,Zimbabwe,United Arab Emirates,293831,533862,Regis Chakabva,Sikandar Raza,Mohammad Naveed,y,6.4,1.0,1.0,0.0,237.0,198.0,3.0,-0.32,7.62,-0.05,0.87,85.436,23.0,False,,,1,,"back of a length on off stump, pushed to mid-on with soft hands"
353,2,Zimbabwe,United Arab Emirates,299572,533862,Sikandar Raza,Regis Chakabva,Mohammad Naveed,y,6.5,1.0,1.0,0.0,297.0,78.0,2.0,-0.53,10.23,-0.08,1.45,85.492,24.0,False,,,1,,"shortish on off stump and he jumps across to half-flick, half-pull that towards square leg"
354,2,Zimbabwe,United Arab Emirates,293831,533862,Regis Chakabva,Sikandar Raza,Mohammad Naveed,y,6.6,0.0,0.0,0.0,136.0,192.0,6.0,-0.46,9.62,-0.18,1.19,81.593,24.0,False,,,1,,"back of a length, angling in towards off stump, and all Chakabva can do is hop and defend into the off side"
355,2,Zimbabwe,United Arab Emirates,299572,25613,Sikandar Raza,Regis Chakabva,Amjad Javed,y,7.1,0.0,0.0,0.0,108.0,133.0,7.0,-0.38,7.92,-0.52,0.86,77.371,24.0,False,,,1,,"outswing from back of a length outside off, and backward point is quick to move to his right and cut off the forcing push off the back foot"
356,2,Zimbabwe,United Arab Emirates,299572,25613,Sikandar Raza,Regis Chakabva,Amjad Javed,y,7.2,4.0,4.0,0.0,335.0,76.0,2.0,-0.29,10.41,-0.10,1.39,76.560,28.0,False,,,1,,"short ball, sits up, and he pulls it away to the deep backward square leg boundary, past the square leg fielder diving to his right"
357,2,Zimbabwe,United Arab Emirates,299572,25613,Sikandar Raza,Regis Chakabva,Amjad Javed,y,7.3,0.0,1.0,1.0,0.0,0.0,0.0,0.02,7.87,0.45,0.81,81.342,29.0,False,,,0,Wd,now he looks to go fuller and straighter and ends up sliding down leg
358,2,Zimbabwe,United Arab Emirates,299572,25613,Sikandar Raza,Regis Chakabva,Amjad Javed,y,7.3,0.0,1.0,1.0,0.0,0.0,0.0,0.15,5.96,0.48,0.72,78.150,30.0,False,,,0,Wd,and again. This one slips even further down. That seemed to swing late towards the leg side as well
359,2,Zimbabwe,United Arab Emirates,299572,25613,Sikandar Raza,Regis Chakabva,Amjad Javed,y,7.3,4.0,4.0,0.0,23.0,285.0,6.0,-0.24,5.32,-0.11,0.63,76.460,34.0,False,,,1,,"down the track now, and he skips inside the line to hit that inside-out over cover"
360,2,Zimbabwe,United Arab Emirates,299572,25613,Sikandar Raza,Regis Chakabva,Amjad Javed,y,7.4,0.0,1.0,1.0,0.0,0.0,0.0,-0.70,6.94,-1.09,0.95,76.739,35.0,False,,,0,Wd,now it's short and wide. Very wide. Raza has to reach out a long way to cut and he can't connect
361,2,Zimbabwe,United Arab Emirates,299572,25613,Sikandar Raza,Regis Chakabva,Amjad Javed,y,7.4,4.0,4.0,0.0,3.0,195.0,6.0,-0.47,8.08,-0.67,0.96,77.479,39.0,False,,,1,,"short again, this time there's just enough width for Raza to get comfortably on top of the ball and cut it away in front of square"
362,2,Zimbabwe,United Arab Emirates,299572,25613,Sikandar Raza,Regis Chakabva,Amjad Javed,y,7.5,0.0,0.0,0.0,89.0,218.0,6.0,-0.31,7.60,-0.42,0.88,77.038,39.0,False,,,1,,"back of a length, curls away from off stump, punched into the covers"
363,2,Zimbabwe,United Arab Emirates,299572,25613,Sikandar Raza,Regis Chakabva,Amjad Javed,y,7.6,0.0,0.0,0.0,106.0,146.0,7.0,-0.32,6.78,-0.46,0.81,74.301,39.0,False,,,1,,back of a length again and he opens his bat face to steer it to point
364,2,Zimbabwe,United Arab Emirates,293831,533862,Regis Chakabva,Sikandar Raza,Mohammad Naveed,y,8.1,0.0,0.0,0.0,112.0,130.0,7.0,-0.54,8.53,-0.30,1.09,84.212,39.0,False,,,1,,"back of a length outside off, Chakabva stands tall and punches it to backward point"
365,2,Zimbabwe,United Arab Emirates,293831,533862,Regis Chakabva,Sikandar Raza,Mohammad Naveed,y,8.2,0.0,0.0,0.0,0.0,0.0,0.0,-0.51,11.06,-0.37,1.70,86.956,39.0,False,,,0,,"excellent bounce there. He banged it in and angled it in towards the batsman, who leaned his upper body out of the way to let it pass"
366,2,Zimbabwe,United Arab Emirates,293831,533862,Regis Chakabva,Sikandar Raza,Mohammad Naveed,y,8.3,1.0,1.0,0.0,123.0,20.0,8.0,-0.57,6.46,-0.56,0.61,85.324,40.0,False,,,0,,fuller now and Chakabva moves forward to drive but his head isn't over the ball and he ends up slicing the drive towards third man
367,2,Zimbabwe,United Arab Emirates,299572,533862,Sikandar Raza,Regis Chakabva,Mohammad Naveed,y,8.4,0.0,0.0,0.0,226.0,195.0,3.0,-0.39,8.14,-0.13,0.85,81.576,40.0,False,,,1,,"back of a length, angling in, and he goes back and across to defend into the on side"
368,2,Zimbabwe,United Arab Emirates,299572,533862,Sikandar Raza,Regis Chakabva,Mohammad Naveed,y,8.5,6.0,6.0,0.0,340.0,75.0,2.0,-0.55,11.31,-0.10,1.81,85.271,46.0,False,,,1,,"short, rising over off stump. Raza has to fetch that pull from well over shoulder height, and he does it very well, sending it soaring over the square leg boundary"
369,2,Zimbabwe,United Arab Emirates,299572,533862,Sikandar Raza,Regis Chakabva,Mohammad Naveed,y,8.6,0.0,0.0,0.0,219.0,194.0,3.0,-0.37,8.11,-0.20,1.01,82.109,46.0,False,,,1,,back of a length on off stump and Raza jumps across into that open position to defend towards mid-on
370,2,Zimbabwe,United Arab Emirates,293831,447290,Regis Chakabva,Sikandar Raza,Nasir Aziz,y,9.1,1.0,1.0,0.0,316.0,211.0,3.0,-0.31,6.51,-0.06,0.62,47.789,47.0,False,,,1,,"length ball on off stump, no real turn, and he works it with the angle through midwicket"
371,2,Zimbabwe,United Arab Emirates,299572,447290,Sikandar Raza,Regis Chakabva,Nasir Aziz,y,9.2,0.0,0.0,0.0,221.0,187.0,3.0,-0.40,6.75,-0.04,0.68,52.988,47.0,False,,,1,,"a bit of turn this time, towards leg stump to cramp Raza who was looking to make room. Ends up squeezing it off the back foot to mid-on"
372,2,Zimbabwe,United Arab Emirates,299572,447290,Sikandar Raza,Regis Chakabva,Nasir Aziz,y,9.3,4.0,4.0,0.0,6.0,213.0,6.0,-0.55,5.79,-0.48,0.61,56.072,51.0,False,,,1,,short and wide and he leans back to slap that to the cover point boundary
373,2,Zimbabwe,United Arab Emirates,299572,447290,Sikandar Raza,Regis Chakabva,Nasir Aziz,y,9.4,4.0,4.0,0.0,350.0,120.0,2.0,-0.29,4.93,0.01,0.81,50.841,55.0,False,,,1,,"and now he sees a bit of air outside off and plants his front foot across to sweep it, bottom hand coming off the handle, up and over backward square. Excellent placement"
374,2,Zimbabwe,United Arab Emirates,299572,447290,Sikandar Raza,Regis Chakabva,Nasir Aziz,y,9.5,0.0,0.0,0.0,181.0,194.0,4.0,-0.38,5.13,-0.09,0.76,50.411,55.0,False,,,1,,a bit of loop and it lands on a good length outside off. Raza presses forward to block
375,2,Zimbabwe,United Arab Emirates,299572,447290,Sikandar Raza,Regis Chakabva,Nasir Aziz,y,9.6,0.0,0.0,0.0,211.0,231.0,4.0,-0.09,2.73,0.07,0.44,52.377,55.0,False,,,1,,"full on middle stump and Raza looks to drive to long-on, but short midwicket sprints off the blocks quickly and dives to his left to stop the single"
376,2,Zimbabwe,United Arab Emirates,293831,533862,Regis Chakabva,Sikandar Raza,Mohammad Naveed,y,10.1,0.0,0.0,0.0,213.0,195.0,3.0,-0.37,6.40,-0.08,0.79,82.969,55.0,False,,,1,,"fullish, angling in towards off stump, defended towards mid-on"
377,2,Zimbabwe,United Arab Emirates,293831,533862,Regis Chakabva,Sikandar Raza,Mohammad Naveed,y,10.2,0.0,0.0,0.0,0.0,0.0,0.0,-0.44,10.15,-0.10,1.18,84.607,55.0,False,,,0,,"good ball, slippery bouncer angled into the body. Chakabva leans back to ramp it but it's past him before he can get his hands into position"
378,2,Zimbabwe,United Arab Emirates,293831,533862,Regis Chakabva,Sikandar Raza,Mohammad Naveed,y,10.3,0.0,0.0,0.0,164.0,154.0,7.0,-0.38,8.26,-0.14,0.87,83.675,55.0,False,,,0,,"back of a length, angling in towards off stump. Chakabva defends with soft hands, and the ball drops down into his pads"
379,2,Zimbabwe,United Arab Emirates,293831,533862,Regis Chakabva,Sikandar Raza,Mohammad Naveed,y,10.4,0.0,0.0,0.0,118.0,146.0,7.0,-0.56,9.93,-0.23,1.36,81.786,55.0,False,,,1,,"good line again, back of a length and no width outside off. Chakabva defends towards backward point"
