,inning,batting_team,bowling_team,batsman,bowler,batsman_name,non_striker,bowler_name,bat_right_handed,ovr,runs_batter,runs_w_extras,extras,x,y,z,landing_x,landing_y,ended_x,ended_y,ball_speed,cumul_runs,wicket,wicket_method,who_out,control,extras_type,comm
393,2,Bangladesh,Scotland,56194,297488,Tamim Iqbal,Mohammad Mahmudullah,Matt Machan,n,13.6,1.0,1.0,0.0,234.0,178.0,3.0,0.53,5.77,0.42,0.55,55.992,88.0,False,,,1,,steered away towards extra-cover to end Machan's opening over
394,2,Bangladesh,Scotland,56194,25451,Tamim Iqbal,Mohammad Mahmudullah,Majid Haq,n,14.1,0.0,0.0,0.0,149.0,181.0,6.0,-0.04,4.32,-0.27,0.59,47.226,88.0,False,,,1,,"given plenty of flight as Mahmudullah almost causes a colossal mishap as he backs up far too much after Tamim turns this away to the leg side. Tamim immediately sends him back, but not before Mahmudullah had made it over three-quarters of the way. Is able to just get back as the throw fired in ends up hitting his leg as he went for the dive to make his ground"
395,2,Bangladesh,Scotland,56194,25451,Tamim Iqbal,Mohammad Mahmudullah,Majid Haq,n,14.2,0.0,0.0,0.0,203.0,189.0,4.0,0.17,4.34,0.12,0.73,48.355,88.0,False,,,1,,defended comfortably by the batsman
396,2,Bangladesh,Scotland,56194,25451,Tamim Iqbal,Mohammad Mahmudullah,Majid Haq,n,14.3,1.0,1.0,0.0,265.0,292.0,4.0,0.38,4.74,0.38,0.68,45.097,89.0,False,,,1,,"comes down the track to this floater on and around off, working this one away in the end to long off"
397,2,Bangladesh,Scotland,56025,25451,Mahmudullah,Tamim Iqbal,Majid Haq,y,14.4,0.0,0.0,0.0,236.0,189.0,3.0,-0.14,5.03,0.03,0.70,47.105,89.0,False,,,1,,looks to nurdle the bowler on the leg side as he played with soft hands
398,2,Bangladesh,Scotland,56025,25451,Mahmudullah,Tamim Iqbal,Majid Haq,y,14.5,1.0,1.0,0.0,312.0,193.0,3.0,-0.15,4.40,0.06,0.67,48.024,90.0,False,,,1,,steers this one now through midwicket to get to the other end
399,2,Bangladesh,Scotland,56194,25451,Tamim Iqbal,Mohammad Mahmudullah,Majid Haq,n,14.6,1.0,1.0,0.0,211.0,199.0,4.0,0.32,5.88,0.40,0.78,47.231,91.0,False,,,1,,advances down before adjusting his stroke to push at this one softly to the off side before running down to the other end
400,2,Bangladesh,Scotland,56194,297488,Tamim Iqbal,Mohammad Mahmudullah,Matt Machan,n,15.1,0.0,0.0,0.0,112.0,220.0,6.0,-0.02,4.07,-0.17,0.73,50.824,91.0,False,,,1,,"looks to nudge away a single through midwicket, but no can do"
401,2,Bangladesh,Scotland,56194,297488,Tamim Iqbal,Mohammad Mahmudullah,Matt Machan,n,15.2,2.0,2.0,0.0,192.0,31.0,1.0,0.31,6.55,0.06,0.81,56.047,93.0,False,,,0,,drags the length a touch as Tamim gets away with an outside edge through third man
402,2,Bangladesh,Scotland,56194,297488,Tamim Iqbal,Mohammad Mahmudullah,Matt Machan,n,15.3,1.0,1.0,0.0,240.0,315.0,4.0,0.31,4.34,0.22,0.72,52.387,94.0,False,,,1,,guides this next one down to long on for a straightforward single
403,2,Bangladesh,Scotland,56025,297488,Mahmudullah,Tamim Iqbal,Matt Machan,y,15.4,2.0,2.0,0.0,247.0,33.0,1.0,-0.24,4.57,-0.09,0.69,57.998,96.0,False,,,1,,gets this fine with a paddle down the leg side as they are able to return for the second
404,2,Bangladesh,Scotland,56025,297488,Mahmudullah,Tamim Iqbal,Matt Machan,y,15.5,0.0,0.0,0.0,237.0,213.0,3.0,-0.34,6.38,-0.36,0.86,59.315,96.0,False,,,1,,"tries to force away the ball on the off side, but ends up hitting it more towards midwicket"
405,2,Bangladesh,Scotland,56025,297488,Mahmudullah,Tamim Iqbal,Matt Machan,y,15.6,1.0,1.0,0.0,283.0,81.0,2.0,-0.12,7.87,0.21,0.77,57.936,97.0,False,,,1,,short enough for him to get back and glance this away just behind square
406,2,Bangladesh,Scotland,56025,25451,Mahmudullah,Tamim Iqbal,Majid Haq,y,16.1,1.0,1.0,0.0,311.0,175.0,3.0,-0.15,5.02,0.04,0.52,51.407,98.0,False,,,1,,waltzes down before checking his stroke to get this away just behind square with a flick
407,2,Bangladesh,Scotland,56194,25451,Tamim Iqbal,Mohammad Mahmudullah,Majid Haq,n,16.2,0.0,0.0,0.0,274.0,145.0,2.0,0.41,5.85,0.42,0.79,46.587,98.0,False,,,1,,"delays as he floats this one outside off, with this worked away to the off side by Tamim"
408,2,Bangladesh,Scotland,56194,25451,Tamim Iqbal,Mohammad Mahmudullah,Majid Haq,n,16.3,0.0,1.0,1.0,0.0,0.0,0.0,0.01,7.20,-0.56,0.54,48.240,99.0,False,,,0,Wd,slipping down the leg side as the attempted clip fails to make a connection
409,2,Bangladesh,Scotland,56194,25451,Tamim Iqbal,Mohammad Mahmudullah,Majid Haq,n,16.3,0.0,0.0,0.0,235.0,178.0,3.0,0.21,4.64,0.24,0.73,46.115,99.0,False,,,1,,"spinning away outside off stump, defended into the off side"
410,2,Bangladesh,Scotland,56194,25451,Tamim Iqbal,Mohammad Mahmudullah,Majid Haq,n,16.4,0.0,0.0,0.0,186.0,204.0,4.0,0.27,4.25,0.20,0.75,48.376,99.0,False,,,1,,"driven straight back to the bowler, who puts in a fine, diving stop to his right"
411,2,Bangladesh,Scotland,56194,25451,Tamim Iqbal,Mohammad Mahmudullah,Majid Haq,n,16.5,1.0,1.0,0.0,62.0,194.0,6.0,0.18,5.83,-0.18,0.72,51.112,100.0,False,,,1,,shuffles away a run on the leg side as he reaches <b>fifty</b>. Bangladesh will need him to stick around and deliver as they look to complete this 300+ chase
412,2,Bangladesh,Scotland,56025,25451,Mahmudullah,Tamim Iqbal,Majid Haq,y,16.6,0.0,0.0,0.0,234.0,233.0,4.0,0.03,4.20,0.29,0.79,44.541,100.0,False,,,1,,takes a couple of steps down before defending the delivery from the spinner
413,2,Bangladesh,Scotland,56194,297488,Tamim Iqbal,Mohammad Mahmudullah,Matt Machan,n,17.1,1.0,1.0,0.0,266.0,298.0,4.0,0.28,3.85,0.21,0.67,51.089,101.0,False,,,1,,steered away through long off to get Mahmudullah on strike
414,2,Bangladesh,Scotland,56025,297488,Mahmudullah,Tamim Iqbal,Matt Machan,y,17.2,1.0,1.0,0.0,304.0,181.0,3.0,-0.29,4.31,-0.17,0.67,53.104,102.0,False,,,1,,crouches forward before angling away this delivery square off the wicket on the leg side
415,2,Bangladesh,Scotland,56194,297488,Tamim Iqbal,Mohammad Mahmudullah,Matt Machan,n,17.3,1.0,1.0,0.0,43.0,193.0,6.0,0.22,7.15,-0.24,0.87,58.433,103.0,False,,,1,,eased away off the back foot to find deep square-leg
416,2,Bangladesh,Scotland,56025,297488,Mahmudullah,Tamim Iqbal,Matt Machan,y,17.4,1.0,1.0,0.0,289.0,70.0,2.0,-0.24,5.64,-0.03,0.75,56.505,104.0,False,,,1,,gets in a stride before glancing away this leg-side slanting delivery to backward square
417,2,Bangladesh,Scotland,56194,297488,Tamim Iqbal,Mohammad Mahmudullah,Matt Machan,n,17.5,2.0,2.0,0.0,133.0,28.0,8.0,0.12,4.54,-0.03,0.65,53.604,106.0,False,,,1,,works with the angle to paddle this one round the corner to deep fine leg
418,2,Bangladesh,Scotland,56194,297488,Tamim Iqbal,Mohammad Mahmudullah,Matt Machan,n,17.6,1.0,1.0,0.0,263.0,301.0,4.0,0.31,4.42,0.16,0.63,52.477,107.0,False,,,1,,finishes off the over with a drive down to long off as <b>drinks</b> are called onto the field
419,2,Bangladesh,Scotland,56194,25451,Tamim Iqbal,Mohammad Mahmudullah,Majid Haq,n,18.1,0.0,0.0,0.0,235.0,225.0,4.0,0.36,5.34,0.26,0.68,48.409,107.0,False,,,1,,steps out and defends this flighted delivery to short cover as he doesn't get to the pitch of the ball
420,2,Bangladesh,Scotland,56194,25451,Tamim Iqbal,Mohammad Mahmudullah,Majid Haq,n,18.2,1.0,1.0,0.0,58.0,209.0,6.0,0.16,5.75,0.02,0.76,50.868,108.0,False,,,1,,on the off stump as this is flicked away by Tamim to midwicket
421,2,Bangladesh,Scotland,56025,25451,Mahmudullah,Tamim Iqbal,Majid Haq,y,18.3,1.0,1.0,0.0,315.0,212.0,3.0,-0.32,4.42,-0.05,0.83,49.215,109.0,False,,,1,,"tossed up just outside off stump, Mahmudullah turns it to deep square leg"
422,2,Bangladesh,Scotland,56194,25451,Tamim Iqbal,Mohammad Mahmudullah,Majid Haq,n,18.4,1.0,1.0,0.0,71.0,232.0,6.0,0.16,3.88,0.21,0.58,45.565,110.0,False,,,1,,"full and outside off stump, Tamim works it to midwicket"
423,2,Bangladesh,Scotland,56025,25451,Mahmudullah,Tamim Iqbal,Majid Haq,y,18.5,1.0,1.0,0.0,330.0,185.0,3.0,-0.29,4.94,-0.07,0.68,51.159,111.0,False,,,1,,turning back in as Mahmudullah works it to square-leg
424,2,Bangladesh,Scotland,56194,25451,Tamim Iqbal,Mohammad Mahmudullah,Majid Haq,n,18.6,1.0,1.0,0.0,312.0,210.0,3.0,0.65,6.19,0.74,0.74,45.367,112.0,False,,,1,,picks up a single down at deep cover as they continue to rotate the strike
425,2,Bangladesh,Scotland,56194,25490,Tamim Iqbal,Mohammad Mahmudullah,Richie Berrington,n,19.1,0.0,0.0,0.0,126.0,297.0,5.0,0.25,4.91,0.04,0.56,73.803,112.0,False,,,1,,full on middle and leg as this is eased down to long on
426,2,Bangladesh,Scotland,56194,25490,Tamim Iqbal,Mohammad Mahmudullah,Richie Berrington,n,19.2,0.0,0.0,0.0,174.0,201.0,5.0,0.22,8.52,-0.23,0.96,73.498,112.0,False,,,1,,comes down the track as the bowler follows him with a leg-side slanting delivery that cramps him for room as he ends up hitting this in the general direction of the bowler
427,2,Bangladesh,Scotland,56194,25490,Tamim Iqbal,Mohammad Mahmudullah,Richie Berrington,n,19.3,4.0,4.0,0.0,340.0,267.0,3.0,0.56,6.44,0.57,0.72,73.475,116.0,False,,,1,,length delivery outside off which he gives the beans to as this is sent racing away through extra-cover for a boundary
428,2,Bangladesh,Scotland,56194,25490,Tamim Iqbal,Mohammad Mahmudullah,Richie Berrington,n,19.4,1.0,1.0,0.0,259.0,313.0,4.0,0.24,3.78,0.10,0.48,74.166,117.0,False,,,1,,full and angling in with the round-the-wicket angle as this is drilled just past the bowler to long off
429,2,Bangladesh,Scotland,56025,25490,Mahmudullah,Tamim Iqbal,Richie Berrington,y,19.5,2.0,2.0,0.0,66.0,242.0,6.0,-0.58,8.65,-0.54,0.75,75.465,119.0,False,,,1,,short of a length outside off which is clattered away to deep extra-cover
430,2,Bangladesh,Scotland,56025,25490,Mahmudullah,Tamim Iqbal,Richie Berrington,y,19.6,4.0,4.0,0.0,122.0,17.0,8.0,-0.33,3.72,-0.42,0.49,74.041,123.0,False,,,0,,"slower ball outside off which is edged away through third man, with Majid Haq, who puts in a diving stop just before the boundary as he may have just made contact with the boundary rope as he fielded the ball. Unlucky for Majid as he did his best there. Mahmudullah gets his <b>half-century</b> in the process as well"
431,2,Bangladesh,Scotland,56194,25451,Tamim Iqbal,Mohammad Mahmudullah,Majid Haq,n,20.1,0.0,0.0,0.0,188.0,200.0,4.0,0.17,3.49,0.00,0.44,49.900,123.0,False,,,1,,flights one in on middle as this is defended carefully by Tamim
432,2,Bangladesh,Scotland,56194,25451,Tamim Iqbal,Mohammad Mahmudullah,Majid Haq,n,20.2,1.0,1.0,0.0,54.0,236.0,6.0,-0.02,2.52,-0.11,0.40,50.331,124.0,False,,,1,,digs out this fuller one darted in as the ball ends up at long on
433,2,Bangladesh,Scotland,56025,25451,Mahmudullah,Tamim Iqbal,Majid Haq,y,20.3,0.0,0.0,0.0,146.0,198.0,6.0,-0.33,3.69,-0.38,0.56,51.944,124.0,False,,,1,,"defends this one on the front foot, and with soft hands"
434,2,Bangladesh,Scotland,56025,25451,Mahmudullah,Tamim Iqbal,Majid Haq,y,20.4,1.0,1.0,0.0,243.0,322.0,4.0,-0.26,5.56,-0.20,0.69,48.867,125.0,False,,,1,,steers this past a diving Majid to pick out the man at long on
435,2,Bangladesh,Scotland,56194,25451,Tamim Iqbal,Mohammad Mahmudullah,Majid Haq,n,20.5,1.0,1.0,0.0,250.0,195.0,3.0,0.26,4.94,0.28,0.83,45.628,126.0,False,,,1,,"goes for the tap-and-run outside his off stump, which they execute to perfection"
436,2,Bangladesh,Scotland,56025,25451,Mahmudullah,Tamim Iqbal,Majid Haq,y,20.6,0.0,0.0,0.0,118.0,135.0,7.0,-0.60,4.70,-0.59,0.70,50.684,126.0,False,,,1,,"tries to force this past backward point with a late cut, but ends up finding the fielder all the same"
437,2,Bangladesh,Scotland,56194,25490,Tamim Iqbal,Mohammad Mahmudullah,Richie Berrington,n,21.1,4.0,4.0,0.0,350.0,266.0,3.0,0.45,5.17,0.35,0.62,75.465,130.0,False,,,1,,majestic drive on the up through extra-cover as Tamim looks very comfortable out there. Classic stroke that just raced away to the rope
438,2,Bangladesh,Scotland,56194,25490,Tamim Iqbal,Mohammad Mahmudullah,Richie Berrington,n,21.2,1.0,1.0,0.0,52.0,150.0,7.0,0.31,8.95,-0.29,1.01,-2.237,131.0,False,,,1,,content to work one away on the leg side now to get off strike
439,2,Bangladesh,Scotland,56025,25490,Mahmudullah,Tamim Iqbal,Richie Berrington,y,21.3,0.0,0.0,0.0,220.0,246.0,4.0,-0.18,4.87,-0.14,0.61,74.899,131.0,False,,,1,,"looking to steer one down to long on, which he does, but a bit too well then he would have liked as they are unable to take the run"
440,2,Bangladesh,Scotland,56025,25490,Mahmudullah,Tamim Iqbal,Richie Berrington,y,21.4,0.0,0.0,0.0,135.0,198.0,6.0,-0.38,6.83,-0.26,0.75,75.317,131.0,False,,,1,,"length delivery outside off which nips in a bit, as Mahmudullah fends away to the off side"
441,2,Bangladesh,Scotland,56025,25490,Mahmudullah,Tamim Iqbal,Richie Berrington,y,21.5,1.0,1.0,0.0,277.0,77.0,2.0,-0.31,9.47,-0.06,1.01,75.093,132.0,False,,,1,,short of a length and whipped away off the pads to backward square
442,2,Bangladesh,Scotland,56194,25490,Tamim Iqbal,Mohammad Mahmudullah,Richie Berrington,n,21.6,1.0,1.0,0.0,300.0,86.0,2.0,0.43,5.57,0.34,0.62,70.360,133.0,False,,,1,,just about gets away the glide past backward point to keep the strike
443,2,Bangladesh,Scotland,56194,25451,Tamim Iqbal,Mohammad Mahmudullah,Majid Haq,n,22.1,1.0,1.0,0.0,136.0,306.0,5.0,0.10,3.74,0.08,0.52,51.803,134.0,False,,,1,,eases away Haq through long on to get to the other end
444,2,Bangladesh,Scotland,56025,25451,Mahmudullah,Tamim Iqbal,Majid Haq,y,22.2,1.0,2.0,1.0,320.0,189.0,3.0,0.05,3.98,0.30,0.59,50.468,136.0,False,,,1,Nb,"straddling on the leg stump as Majid ends up pulling a <b>Finn</b> after disturbing the bails at the non-striker's end in his delivery stride. Won't be a free hit though, as Tamim and Mahmudullah inquire earnestly"
445,2,Bangladesh,Scotland,56194,25451,Tamim Iqbal,Mohammad Mahmudullah,Majid Haq,n,22.2,1.0,1.0,0.0,306.0,207.0,3.0,0.38,4.90,0.46,0.89,44.321,137.0,False,,,1,,picks up a single with a good ole tap-and-run outside off
446,2,Bangladesh,Scotland,56025,25451,Mahmudullah,Tamim Iqbal,Majid Haq,y,22.3,1.0,1.0,0.0,311.0,231.0,3.0,-0.23,4.66,0.18,0.82,43.074,138.0,False,,,1,,picks out a single on the off side
447,2,Bangladesh,Scotland,56194,25451,Tamim Iqbal,Mohammad Mahmudullah,Majid Haq,n,22.4,0.0,0.0,0.0,243.0,173.0,3.0,0.30,5.69,0.20,0.76,47.406,138.0,False,,,1,,defended with soft hands on the off side as the close-in fielders hunt the ball down to try and dissuade another tight single
448,2,Bangladesh,Scotland,56194,25451,Tamim Iqbal,Mohammad Mahmudullah,Majid Haq,n,22.5,1.0,1.0,0.0,69.0,240.0,6.0,0.14,6.32,-0.02,0.86,48.970,139.0,False,,,1,,this time gets it away just behind square on the leg side
449,2,Bangladesh,Scotland,56025,25451,Mahmudullah,Tamim Iqbal,Majid Haq,y,22.6,1.0,1.0,0.0,279.0,219.0,3.0,-0.37,4.88,-0.11,0.82,49.063,140.0,False,,,1,,"tucks away this leg-side slanting delivery, with the batsmen setting off for a quick single. Tamim, who was running to the danger end, is able to ground his bat before the direct throw from the fielder. Repays confirm that he was in by yards."
450,2,Bangladesh,Scotland,56025,509107,Mahmudullah,Tamim Iqbal,Iain Wardlaw,y,23.1,4.0,4.0,0.0,38.0,71.0,7.0,-0.55,6.47,-0.49,0.71,77.441,144.0,False,,,1,,although he won't be too pleased with this first effort as Mahmudullah is able to run this length delivery past the boundary rider at third man to get four
451,2,Bangladesh,Scotland,56025,509107,Mahmudullah,Tamim Iqbal,Iain Wardlaw,y,23.2,0.0,0.0,0.0,240.0,217.0,3.0,-0.27,5.29,-0.17,0.77,82.435,144.0,False,,,1,,slips in a fuller one on middle and leg which is dug out by the batsman
452,2,Bangladesh,Scotland,56025,509107,Mahmudullah,Tamim Iqbal,Iain Wardlaw,y,23.3,0.0,0.0,0.0,0.0,0.0,0.0,0.64,1.63,0.76,0.26,80.779,144.0,True,bowled,56025,0,,"you simply can't get unluckier than this. Mahmudullah has to limp off from the Saxton after getting struck full on the toe as he backed away to try and create room on the off side. The bowler saw it early enough to follow him with the delivery, with this going off the toe and then going on strike the base of the stumps right after. The angle would have suggested this was going further down leg, but such was the freak nature of this ricochet. Really, really unlucky for Mahmudullah as he nurses what could be a broken left toe. A real sandshoe crusher"
453,2,Bangladesh,Scotland,56029,509107,Mushfiqur Rahim,Tamim Iqbal,Iain Wardlaw,y,23.4,4.0,4.0,0.0,354.0,130.0,2.0,0.26,-3.16,0.14,0.57,83.949,148.0,False,,,1,,gives Mushfiqur the best possible start as he offers a full toss on the pads which is clipped away quickly to the square-leg boundary
454,2,Bangladesh,Scotland,56029,509107,Mushfiqur Rahim,Tamim Iqbal,Iain Wardlaw,y,23.5,0.0,0.0,0.0,208.0,160.0,2.0,-0.28,11.42,0.10,1.42,-2.237,148.0,False,,,0,,provides a helmet check to Mushfiqur as he just about manages to avoid any more harm
455,2,Bangladesh,Scotland,56029,509107,Mushfiqur Rahim,Tamim Iqbal,Iain Wardlaw,y,23.6,2.0,2.0,0.0,59.0,77.0,7.0,-0.54,8.89,-0.49,1.06,81.290,150.0,False,,,1,,cut away now at the top of the bounce to pickup a brace square off the wicket
456,2,Bangladesh,Scotland,56194,25451,Tamim Iqbal,Mushfiqur Rahim,Majid Haq,n,24.1,0.0,0.0,0.0,258.0,204.0,3.0,0.26,4.37,0.22,0.67,45.946,150.0,False,,,0,,defended away on the off side by Tamim
457,2,Bangladesh,Scotland,56194,25451,Tamim Iqbal,Mushfiqur Rahim,Majid Haq,n,24.2,4.0,4.0,0.0,253.0,16.0,1.0,0.46,5.38,0.38,0.72,53.009,154.0,False,,,1,,shows his finesse outside off stump as he waits and waits before just opening the face to get this away to the boundary
458,2,Bangladesh,Scotland,56194,25451,Tamim Iqbal,Mushfiqur Rahim,Majid Haq,n,24.3,0.0,0.0,0.0,212.0,198.0,4.0,0.19,4.87,0.15,1.02,41.098,154.0,False,,,1,,gets in a good stride to smother for any possible turn
459,2,Bangladesh,Scotland,56194,25451,Tamim Iqbal,Mushfiqur Rahim,Majid Haq,n,24.4,0.0,0.0,0.0,253.0,213.0,3.0,0.33,3.55,0.31,0.72,44.786,154.0,False,,,1,,given plenty of rip as this is defended back to the man at short mid-off
460,2,Bangladesh,Scotland,56194,25451,Tamim Iqbal,Mushfiqur Rahim,Majid Haq,n,24.5,1.0,1.0,0.0,246.0,192.0,3.0,0.39,4.91,0.38,0.71,50.080,155.0,False,,,1,,picks out the vacant space near point as they are able to exchange ends
461,2,Bangladesh,Scotland,56029,25451,Mushfiqur Rahim,Tamim Iqbal,Majid Haq,y,24.6,0.0,0.0,0.0,265.0,192.0,3.0,-0.14,4.96,0.25,0.81,43.847,155.0,False,,,1,,"turns this one away just behind of square, but is unable to do more than that"
462,2,Bangladesh,Scotland,56194,509107,Tamim Iqbal,Mushfiqur Rahim,Iain Wardlaw,n,25.1,0.0,0.0,0.0,241.0,200.0,3.0,-0.06,7.63,0.24,0.85,77.111,155.0,False,,,1,,"another hesitant call from these two, as Mushfiqur, seeing Tamim come down after placing this somewhere near point, sends his partner back when he sees the close-in fielders racing to the ball"
463,2,Bangladesh,Scotland,56194,509107,Tamim Iqbal,Mushfiqur Rahim,Iain Wardlaw,n,25.2,1.0,1.0,0.0,120.0,26.0,8.0,,,,,,156.0,False,,,0,,hooks away this shorter delivery to the man at deep fine leg
464,2,Bangladesh,Scotland,56029,509107,Mushfiqur Rahim,Tamim Iqbal,Iain Wardlaw,y,25.3,4.0,4.0,0.0,27.0,78.0,7.0,-0.69,11.59,-0.86,1.70,75.701,160.0,False,,,1,,chases after this short delivery outside off as he ramps over backward point to find the boundary
465,2,Bangladesh,Scotland,56029,509107,Mushfiqur Rahim,Tamim Iqbal,Iain Wardlaw,y,25.4,1.0,1.0,0.0,287.0,123.0,2.0,-0.29,8.24,-0.03,0.82,79.118,161.0,False,,,1,,helped away on the leg side now as the pair complete a run
466,2,Bangladesh,Scotland,56194,509107,Tamim Iqbal,Mushfiqur Rahim,Iain Wardlaw,n,25.5,2.0,2.0,0.0,41.0,86.0,7.0,-0.30,6.64,-0.20,0.71,77.293,163.0,False,,,1,,clips away this fuller delivery going down the leg side as they are able to complete two before the throw from the deep
467,2,Bangladesh,Scotland,56194,509107,Tamim Iqbal,Mushfiqur Rahim,Iain Wardlaw,n,25.6,1.0,1.0,0.0,63.0,208.0,6.0,-0.22,8.44,0.08,1.01,79.594,164.0,False,,,1,,eases away a comfortable single through midwicket to end the over
468,2,Bangladesh,Scotland,56194,399259,Tamim Iqbal,Mushfiqur Rahim,Alasdair Evans,n,26.1,0.0,0.0,0.0,0.0,0.0,0.0,0.38,6.65,0.88,0.77,82.111,164.0,False,,,0,,has a go at this fuller delivery which shapes away upon pitching as it went across
469,2,Bangladesh,Scotland,56194,399259,Tamim Iqbal,Mushfiqur Rahim,Alasdair Evans,n,26.2,0.0,0.0,0.0,244.0,171.0,3.0,0.05,6.99,0.43,0.77,82.437,164.0,False,,,1,,"tries to caress away a run through backward point, but is held by the fielder"
470,2,Bangladesh,Scotland,56194,399259,Tamim Iqbal,Mushfiqur Rahim,Alasdair Evans,n,26.3,1.0,1.0,0.0,257.0,39.0,1.0,0.04,8.47,0.61,1.06,85.655,165.0,False,,,1,,"gets away a thick outside edge to this attempted flash over the covers, with the man at third man running full tilt to intercept this on the bounce, which he does mighty well in the end"
471,2,Bangladesh,Scotland,56029,399259,Mushfiqur Rahim,Tamim Iqbal,Alasdair Evans,y,26.4,1.0,1.0,0.0,296.0,221.0,3.0,-0.29,9.42,0.10,0.99,79.811,166.0,False,,,1,,length on the pads which is tucked away by Mushfiqur to the leg side
472,2,Bangladesh,Scotland,56194,399259,Tamim Iqbal,Mushfiqur Rahim,Alasdair Evans,n,26.5,1.0,1.0,0.0,265.0,55.0,1.0,-0.07,7.98,0.41,0.98,72.995,167.0,False,,,1,,waits on this before running it down to third man for a single
473,2,Bangladesh,Scotland,56029,399259,Mushfiqur Rahim,Tamim Iqbal,Alasdair Evans,y,26.6,1.0,1.0,0.0,275.0,77.0,2.0,-0.35,10.57,0.06,1.27,81.483,168.0,False,,,1,,short of a length which is helped down to deep backward square
474,2,Bangladesh,Scotland,56029,297488,Mushfiqur Rahim,Tamim Iqbal,Matt Machan,y,27.1,4.0,4.0,0.0,21.0,239.0,6.0,-0.66,3.05,-0.62,0.61,50.618,172.0,False,,,1,,scythes away the bowler through the covers as this has just enough on it to beat a despairing dive from sweeper cover to the boundary
475,2,Bangladesh,Scotland,56029,297488,Mushfiqur Rahim,Tamim Iqbal,Matt Machan,y,27.2,1.0,1.0,0.0,237.0,306.0,4.0,0.08,1.50,0.11,0.38,55.533,173.0,False,,,1,,eases away a single now through long on to get off the strike
476,2,Bangladesh,Scotland,56194,297488,Tamim Iqbal,Mushfiqur Rahim,Matt Machan,n,27.3,0.0,0.0,0.0,141.0,124.0,8.0,0.19,4.96,-0.15,0.64,57.321,173.0,False,,,0,,"flicks away this fuller one darted in on the pads, but straight to square-leg"
477,2,Bangladesh,Scotland,56194,297488,Tamim Iqbal,Mushfiqur Rahim,Matt Machan,n,27.4,2.0,2.0,0.0,342.0,239.0,3.0,0.53,4.19,0.51,0.73,53.621,175.0,False,,,1,,"in the slot for Tamim to drive through extra-cover, which he does competently enough, but can't get it past the boundary rider stationed near there in the deep"
478,2,Bangladesh,Scotland,56194,297488,Tamim Iqbal,Mushfiqur Rahim,Matt Machan,n,27.5,0.0,0.0,0.0,131.0,202.0,6.0,0.08,5.00,-0.13,0.63,49.488,175.0,False,,,1,,carefully defends this one outside off with soft hands
479,2,Bangladesh,Scotland,56194,297488,Tamim Iqbal,Mushfiqur Rahim,Matt Machan,n,27.6,1.0,1.0,0.0,309.0,265.0,3.0,0.37,3.19,0.33,0.53,50.638,176.0,False,,,1,,"Tamim becomes <b>the highest individual scorer for Bangladesh in a World Cup match</b> with a cover drive that puts him up at 88, beating Mohammed Ashraful's mark of 87 against South Africa in that famous victory for Bangladesh in the 2007 edition"
480,2,Bangladesh,Scotland,56194,399259,Tamim Iqbal,Mushfiqur Rahim,Alasdair Evans,n,28.1,1.0,1.0,0.0,209.0,261.0,4.0,0.24,4.46,0.51,0.51,81.621,177.0,False,,,1,,driven firmly down to long off as they pickup yet another single
481,2,Bangladesh,Scotland,56029,399259,Mushfiqur Rahim,Tamim Iqbal,Alasdair Evans,y,28.2,0.0,0.0,0.0,139.0,192.0,6.0,-0.34,6.47,-0.15,0.71,82.502,177.0,False,,,1,,safely negotiates this fuller delivery outside of off as Evans picks up the ball
482,2,Bangladesh,Scotland,56029,399259,Mushfiqur Rahim,Tamim Iqbal,Alasdair Evans,y,28.3,2.0,2.0,0.0,237.0,14.0,1.0,-0.10,7.01,0.29,0.76,83.268,179.0,False,,,1,,"length delivery slipping down the pads as this is tickled away through fine leg, with the boundary rider doing well to cut this off"
483,2,Bangladesh,Scotland,56029,399259,Mushfiqur Rahim,Tamim Iqbal,Alasdair Evans,y,28.4,0.0,0.0,0.0,214.0,192.0,3.0,-0.33,9.26,0.02,1.12,84.296,179.0,False,,,1,,"short of a length and defended at the top of the bounce by Mushfiqur, who really had to get high on his tippy-toes"
484,2,Bangladesh,Scotland,56029,399259,Mushfiqur Rahim,Tamim Iqbal,Alasdair Evans,y,28.5,0.0,0.0,0.0,101.0,217.0,6.0,-0.38,6.44,-0.23,0.81,82.271,179.0,False,,,1,,length just outside off which is driven towards the fielder at short mid-off
485,2,Bangladesh,Scotland,56029,399259,Mushfiqur Rahim,Tamim Iqbal,Alasdair Evans,y,28.6,2.0,2.0,0.0,333.0,252.0,3.0,-0.47,10.69,-0.33,1.33,77.500,181.0,False,,,1,,"short enough for Mushfiqur to get under, which is probably not saying much, as he ends up getting away a pull through cow corner"
486,2,Bangladesh,Scotland,56194,297488,Tamim Iqbal,Mushfiqur Rahim,Matt Machan,n,29.1,0.0,0.0,0.0,196.0,196.0,4.0,0.33,4.63,0.16,0.69,59.261,181.0,False,,,0,,"tries to steer this one past Machan, who puts in a fine, diving stop in the end"
487,2,Bangladesh,Scotland,56194,297488,Tamim Iqbal,Mushfiqur Rahim,Matt Machan,n,29.2,0.0,0.0,0.0,184.0,198.0,4.0,0.18,5.77,-0.09,0.67,55.435,181.0,False,,,1,,defended back to the bowler from the relative safety of his batting crease
488,2,Bangladesh,Scotland,56194,297488,Tamim Iqbal,Mushfiqur Rahim,Matt Machan,n,29.3,1.0,1.0,0.0,45.0,124.0,7.0,0.08,6.60,-0.34,0.78,57.289,182.0,False,,,1,,glanced away square off the wicket to move into the 90s
489,2,Bangladesh,Scotland,56029,297488,Mushfiqur Rahim,Tamim Iqbal,Matt Machan,y,29.4,6.0,6.0,0.0,355.0,245.0,3.0,0.08,4.28,-0.15,0.56,56.409,188.0,False,,,1,,"gets on one knee to send this orbiting over Nelson, before descending back into the stands at midwicket"
490,2,Bangladesh,Scotland,56029,297488,Mushfiqur Rahim,Tamim Iqbal,Matt Machan,y,29.5,2.0,2.0,0.0,33.0,222.0,6.0,-0.27,2.64,-0.36,0.51,50.981,190.0,False,,,1,,looking to complete two as he gets away a push through the covers
491,2,Bangladesh,Scotland,56029,297488,Mushfiqur Rahim,Tamim Iqbal,Matt Machan,y,29.6,1.0,1.0,0.0,233.0,317.0,4.0,-0.13,4.34,0.00,0.59,58.690,191.0,False,,,1,,steered comfortably past a sprawling mid-on to locate long on
