,inning,batting_team,bowling_team,batsman,bowler,batsman_name,non_striker,bowler_name,bat_right_handed,ovr,runs_batter,runs_w_extras,extras,x,y,z,landing_x,landing_y,ended_x,ended_y,ball_speed,cumul_runs,wicket,wicket_method,who_out,control,extras_type,comm
388,2,South Africa,Pakistan,44936,43590,AB de Villiers,JP Duminy,Wahab Riaz,y,16.5,0.0,0.0,0.0,195.0,237.0,4.0,-0.00,6.10,-0.21,0.62,85.104,91.0,False,,,1,,full delivery which is fended away towards the man at mid-on
389,2,South Africa,Pakistan,44936,43590,AB de Villiers,JP Duminy,Wahab Riaz,y,16.6,1.0,1.0,0.0,228.0,39.0,1.0,0.26,12.16,0.02,1.74,86.756,92.0,False,,,1,,short delivery which AB hooks away instinctively to deep fine leg to retain the striek
390,2,South Africa,Pakistan,44936,323244,AB de Villiers,JP Duminy,Rahat Ali,y,17.1,1.0,1.0,0.0,281.0,194.0,3.0,0.14,9.11,-0.03,1.02,83.770,93.0,False,,,1,,tucks away Rahat just in front of square on the leg side
391,2,South Africa,Pakistan,44932,323244,Jean-Paul Duminy,AB de Villiers,Rahat Ali,n,17.2,0.0,0.0,0.0,187.0,193.0,4.0,0.37,8.34,0.27,0.92,85.546,93.0,False,,,1,,short of a length outside of off which is defended back towards the bowler
392,2,South Africa,Pakistan,44932,323244,Jean-Paul Duminy,AB de Villiers,Rahat Ali,n,17.3,0.0,0.0,0.0,170.0,187.0,5.0,0.53,11.13,0.55,1.47,83.114,93.0,False,,,0,,"short outside of off as he looked to defend this away to the leg side. AB wanted the run as he backed up quite a bit, but JP ends up hitting this to the silly mid-on fielder, who is aware of AB being out of his ground as he fires in a throw at the non-striker's, but crucially, misses the stumps. Extra life afforded to SA there"
393,2,South Africa,Pakistan,44932,323244,Jean-Paul Duminy,AB de Villiers,Rahat Ali,n,17.4,1.0,1.0,0.0,142.0,189.0,6.0,0.14,8.09,-0.10,0.78,87.223,94.0,False,,,1,,short of a length which is tucked away through mid-on for a single
394,2,South Africa,Pakistan,44936,323244,AB de Villiers,JP Duminy,Rahat Ali,y,17.5,0.0,0.0,0.0,189.0,229.0,4.0,-0.11,7.20,-0.45,0.85,84.551,94.0,False,,,1,,"tries to get away a back-foot punch through long off, but Misbah, at mid-off, is able to do well to intercept this in time"
395,2,South Africa,Pakistan,44936,323244,AB de Villiers,JP Duminy,Rahat Ali,y,17.6,0.0,0.0,0.0,0.0,0.0,0.0,0.18,12.33,-0.17,2.12,87.098,94.0,False,,,1,,short delivery which has AB weaving well out of the way as it flew through to Sarfraz
396,2,South Africa,Pakistan,44932,43590,Jean-Paul Duminy,AB de Villiers,Wahab Riaz,n,18.1,0.0,0.0,0.0,233.0,202.0,3.0,0.45,6.09,0.39,0.69,83.598,94.0,False,,,1,,"looks to steer away this fuller delivery outside of off through the covers, but is stopped by the man at short cover"
397,2,South Africa,Pakistan,44932,43590,Jean-Paul Duminy,AB de Villiers,Wahab Riaz,n,18.2,0.0,0.0,0.0,0.0,0.0,0.0,0.43,12.46,0.36,1.96,84.098,94.0,False,,,1,,"initially looked to go after this shorter one with a pull, but in the end aborts the stroke"
398,2,South Africa,Pakistan,44932,43590,Jean-Paul Duminy,AB de Villiers,Wahab Riaz,n,18.3,1.0,1.0,0.0,133.0,233.0,5.0,0.12,7.29,-0.08,0.78,85.586,95.0,False,,,1,,"straddling on the pads as this is turned away to Irfan at mid-on, who is able to stop this after putting in the dive"
399,2,South Africa,Pakistan,44936,43590,AB de Villiers,JP Duminy,Wahab Riaz,y,18.4,1.0,1.0,0.0,135.0,54.0,8.0,0.14,11.23,-0.08,1.35,85.916,96.0,False,,,0,,short ball which cramps him for room as it shapes into him. Just about manages to eke away a run as he got bat on ball to get this one away through gully
400,2,South Africa,Pakistan,44932,43590,Jean-Paul Duminy,AB de Villiers,Wahab Riaz,n,18.5,0.0,1.0,1.0,0.0,0.0,0.0,0.19,12.63,-0.03,2.02,81.698,97.0,False,,,1,Wd,another short delivery which this time is penalised by the umpire
401,2,South Africa,Pakistan,44932,43590,Jean-Paul Duminy,AB de Villiers,Wahab Riaz,n,18.5,1.0,1.0,0.0,141.0,232.0,5.0,0.23,7.26,0.04,0.80,82.498,98.0,False,,,1,,gets away a single on the leg side with a clip. Had to really run hard to avoid any trouble from the mid-on fielder
402,2,South Africa,Pakistan,44936,43590,AB de Villiers,JP Duminy,Wahab Riaz,y,18.6,0.0,0.0,0.0,189.0,199.0,4.0,0.17,8.94,-0.14,0.94,87.810,98.0,False,,,1,,"jabs away this short of a length to Riaz in his follow through, who gets low to stop the ball from passing him"
403,2,South Africa,Pakistan,44932,429981,Jean-Paul Duminy,AB de Villiers,Mohammad Irfan,n,19.1,4.0,4.0,0.0,114.0,18.0,8.0,0.05,6.71,-0.34,0.86,83.530,102.0,False,,,1,,starts with a length delivery on the pads which is tickled fine behind of square for a boundary. Brings up the South African <b>100</b> as well
404,2,South Africa,Pakistan,44932,429981,Jean-Paul Duminy,AB de Villiers,Mohammad Irfan,n,19.2,0.0,0.0,0.0,194.0,193.0,4.0,0.46,9.21,0.11,1.44,84.398,102.0,False,,,1,,short of a length which raps the gloves of JP as he looked to fend it away
405,2,South Africa,Pakistan,44932,429981,Jean-Paul Duminy,AB de Villiers,Mohammad Irfan,n,19.3,0.0,0.0,0.0,184.0,196.0,4.0,0.47,8.81,0.01,1.20,83.314,102.0,False,,,1,,fuller one which is negotiated safely by the batsman
406,2,South Africa,Pakistan,44932,429981,Jean-Paul Duminy,AB de Villiers,Mohammad Irfan,n,19.4,0.0,0.0,0.0,116.0,41.0,8.0,0.66,10.09,0.38,1.41,84.998,102.0,True,caught,44932,0,,"Riaz just can't be kept out of the action as JP, looking to hook this one away over backward square, ends up top-edging this short of a length over to Wahab, stationed at deep fine leg, who is over the moon as he falls away to the right to claim this"
407,2,South Africa,Pakistan,44936,429981,AB de Villiers,Dale Steyn,Mohammad Irfan,y,19.5,1.0,1.0,0.0,219.0,202.0,3.0,0.13,8.16,-0.40,0.98,85.572,103.0,False,,,1,,length delivery which AB is able to nudge away to the leg side for one
408,2,South Africa,Pakistan,47492,429981,Dale Steyn,AB de Villiers,Mohammad Irfan,y,19.6,0.0,0.0,0.0,0.0,0.0,0.0,0.55,11.84,-0.06,1.91,86.198,103.0,False,,,1,,ducks under this shortish length on middle and leg to end a good over for Pakistan
409,2,South Africa,Pakistan,44936,43590,AB de Villiers,Dale Steyn,Wahab Riaz,y,20.1,4.0,4.0,0.0,356.0,228.0,3.0,0.19,8.65,-0.06,0.96,81.074,107.0,False,,,1,,length delivery going across which he somehow is able to manipulate with a shuffle through midwicket for a boundary. Wonderful timing as this went away off the bat
410,2,South Africa,Pakistan,44936,43590,AB de Villiers,Dale Steyn,Wahab Riaz,y,20.2,0.0,0.0,0.0,132.0,195.0,6.0,0.23,10.86,-0.22,1.29,86.487,107.0,False,,,1,,shortish length which AB is able to ride on top of as the ball catches a leading edge towards the off side
411,2,South Africa,Pakistan,44936,43590,AB de Villiers,Dale Steyn,Wahab Riaz,y,20.3,0.0,1.0,1.0,0.0,0.0,0.0,0.22,12.80,-0.11,2.20,89.597,108.0,False,,,1,Wd,fires a steep bouncer which has Sarfraz jumping with every ounce of his being to try and complete the take
412,2,South Africa,Pakistan,44936,43590,AB de Villiers,Dale Steyn,Wahab Riaz,y,20.3,6.0,6.0,0.0,346.0,51.0,2.0,0.21,9.31,-0.01,1.18,84.098,114.0,False,,,1,,this is what AB is capable off. Out of nowhere he picks up this length delivery off the hips to find the long leg boundary with ease as this just sailed over the ropes. Outrageous strike from the ABinator!
413,2,South Africa,Pakistan,44936,43590,AB de Villiers,Dale Steyn,Wahab Riaz,y,20.4,0.0,0.0,0.0,165.0,153.0,7.0,-0.77,9.02,-0.31,1.25,90.413,114.0,False,,,1,,"goes round the wicket now as this one angles in from outside of off, with AB covering the line quite beautifully"
414,2,South Africa,Pakistan,44936,43590,AB de Villiers,Dale Steyn,Wahab Riaz,y,20.5,6.0,6.0,0.0,358.0,97.0,2.0,-0.67,9.15,-0.23,1.17,78.698,120.0,False,,,1,,"steps over a touch to the off before picking him up again through long leg to just get this over the rope for a flat six. Unbelievable how that one carried all the way, but the short boundaries here at Eden Park certainly didn't do him any disservice"
415,2,South Africa,Pakistan,44936,43590,AB de Villiers,Dale Steyn,Wahab Riaz,y,20.6,0.0,0.0,0.0,162.0,193.0,5.0,-0.38,4.51,-0.15,0.50,91.608,120.0,False,,,1,,pitches it up on a channel outside of off as AB sees out the threat
416,2,South Africa,Pakistan,47492,429981,Dale Steyn,AB de Villiers,Mohammad Irfan,y,21.1,4.0,4.0,0.0,30.0,85.0,7.0,0.08,8.53,-0.48,1.15,80.127,124.0,False,,,1,,"manages an uppish slice to this back of a length going across as he is able to get over the second slip towards third man, with the fielder making a complete hash of this to let it through for four"
417,2,South Africa,Pakistan,47492,429981,Dale Steyn,AB de Villiers,Mohammad Irfan,y,21.2,0.0,0.0,0.0,107.0,151.0,7.0,0.26,8.53,-0.30,1.25,77.682,124.0,False,,,1,,"tries to force away a shot through backward point now, but is held by the fielder"
418,2,South Africa,Pakistan,47492,429981,Dale Steyn,AB de Villiers,Mohammad Irfan,y,21.3,0.0,0.0,0.0,181.0,203.0,4.0,0.43,9.32,-0.09,1.21,86.144,124.0,False,,,1,,defended from the depth of his crease to this back of a length on middle and leg
419,2,South Africa,Pakistan,47492,429981,Dale Steyn,AB de Villiers,Mohammad Irfan,y,21.4,3.0,3.0,0.0,110.0,322.0,5.0,-0.00,5.81,-0.32,0.83,87.575,127.0,False,,,1,,eases away a drive through long off which just slows up for the fielder to pick this up just mere centimetres from the boundary rope
420,2,South Africa,Pakistan,44936,429981,AB de Villiers,Dale Steyn,Mohammad Irfan,y,21.5,1.0,1.0,0.0,113.0,37.0,8.0,0.07,6.80,-0.41,0.84,78.515,128.0,False,,,1,,"AB reaches <b>1000 World Cup runs</b> with a glide behind square to third man. Equals Sachin at reaching the mark in just 20 innings, which is the fastest so far."
421,2,South Africa,Pakistan,47492,429981,Dale Steyn,AB de Villiers,Mohammad Irfan,y,21.6,0.0,0.0,0.0,113.0,152.0,7.0,0.49,10.09,-0.13,1.59,80.003,128.0,False,,,1,,"steep bounce on this short of length delivery offering from Irfan, which troubles Steyn, who looked to defend the ball before it ended up hitting the splice"
422,2,South Africa,Pakistan,44936,42639,AB de Villiers,Dale Steyn,Shahid Afridi,y,22.1,1.0,1.0,0.0,77.0,189.0,6.0,-0.37,5.43,-0.45,0.69,58.269,129.0,False,,,1,,waits on this one drifted in from Lala before cutting away through the covers
423,2,South Africa,Pakistan,47492,42639,Dale Steyn,AB de Villiers,Shahid Afridi,y,22.2,0.0,0.0,0.0,230.0,213.0,3.0,0.06,4.36,0.13,0.71,58.898,129.0,False,,,1,,"looks to turn this one which is darted in through the leg side, but pinpoints the close-in fielder"
424,2,South Africa,Pakistan,47492,42639,Dale Steyn,AB de Villiers,Shahid Afridi,y,22.3,0.0,0.0,0.0,181.0,199.0,4.0,-0.15,5.43,-0.11,0.70,59.203,129.0,False,,,1,,defended away softly to the leg side by Steyn
425,2,South Africa,Pakistan,47492,42639,Dale Steyn,AB de Villiers,Shahid Afridi,y,22.4,0.0,0.0,0.0,211.0,182.0,3.0,0.02,6.38,0.17,0.95,63.871,129.0,False,,,1,,"Styen trying to work one away round the corner as AB was adamant that he come through for the single, but Steyn is not interested"
426,2,South Africa,Pakistan,47492,42639,Dale Steyn,AB de Villiers,Shahid Afridi,y,22.5,0.0,0.0,0.0,0.0,0.0,0.0,-0.14,5.56,0.28,0.71,59.628,129.0,False,,,0,,"delivers the wrong 'un which Steyn did not pick as he shuffles a bit to the leg side, before the ball ended up going onto the pads"
427,2,South Africa,Pakistan,47492,42639,Dale Steyn,AB de Villiers,Shahid Afridi,y,22.6,1.0,1.0,0.0,278.0,203.0,3.0,-0.42,7.19,-0.16,0.56,58.246,130.0,False,,,1,,manages a single to this last delivery of the over to retain the strike
428,2,South Africa,Pakistan,47492,429981,Dale Steyn,AB de Villiers,Mohammad Irfan,y,23.1,4.0,4.0,0.0,130.0,11.0,8.0,0.21,9.43,-0.43,1.34,84.367,134.0,False,,,1,,"goes after this shorter one to get away a ramp over the slip cordon which finds the third man boundary, much to the relief of the South African fans at the ground"
429,2,South Africa,Pakistan,47492,429981,Dale Steyn,AB de Villiers,Mohammad Irfan,y,23.2,0.0,0.0,0.0,187.0,197.0,4.0,0.42,9.15,0.01,1.14,87.991,134.0,False,,,1,,keeps out this length delivery along a similar channel as Irfan picks up the ball in his follow through
430,2,South Africa,Pakistan,47492,429981,Dale Steyn,AB de Villiers,Mohammad Irfan,y,23.3,4.0,4.0,0.0,205.0,358.0,4.0,0.29,9.86,-0.30,1.36,80.098,138.0,False,,,1,,slaps away this back of a length straight back past the bowler through long on to pickup another valuable boundary
431,2,South Africa,Pakistan,47492,429981,Dale Steyn,AB de Villiers,Mohammad Irfan,y,23.4,0.0,0.0,0.0,144.0,235.0,5.0,-0.12,0.68,-0.09,0.15,81.798,138.0,False,,,1,,goes round the wicket now to Steyn as this length delivery is struck away towards Misbah at mid-off
432,2,South Africa,Pakistan,47492,429981,Dale Steyn,AB de Villiers,Mohammad Irfan,y,23.5,0.0,0.0,0.0,0.0,0.0,0.0,-0.54,8.31,-0.31,1.15,83.328,138.0,False,,,0,,"has a wild slog to this short of a length as he looked to clobber Irfan down the ground, but is well late on the delivery"
433,2,South Africa,Pakistan,47492,429981,Dale Steyn,AB de Villiers,Mohammad Irfan,y,23.6,0.0,0.0,0.0,175.0,157.0,8.0,-0.52,7.44,-0.26,1.11,87.565,138.0,True,caught,47492,0,,Irfan picks up his third as Sarfraz has proven to be a top choice by the Pakistan selection committee today. The keeper is able to reach high for this thick outside edge as Steyn looked to hammer Irfan over midwicket.
434,2,South Africa,Pakistan,44936,42639,AB de Villiers,Kyle Abbott,Shahid Afridi,y,24.1,1.0,1.0,0.0,49.0,198.0,6.0,-0.26,3.69,-0.24,0.63,59.893,139.0,False,,,1,,drives away Afridi to deep cover for one. Exposes Abbott in the process
435,2,South Africa,Pakistan,297583,42639,Kyle Abbott,AB de Villiers,Shahid Afridi,y,24.2,0.0,0.0,0.0,172.0,183.0,5.0,-0.12,4.81,0.14,0.65,62.377,139.0,False,,,1,,darted in on leg as Abbott fends this one away to the bowler
436,2,South Africa,Pakistan,297583,42639,Kyle Abbott,AB de Villiers,Shahid Afridi,y,24.3,0.0,0.0,0.0,116.0,165.0,6.0,-0.38,2.37,-0.36,0.42,60.343,139.0,False,,,1,,"tries to force one away on the off side, but picks out the close-in fielder within the ring"
437,2,South Africa,Pakistan,297583,42639,Kyle Abbott,AB de Villiers,Shahid Afridi,y,24.4,0.0,0.0,0.0,0.0,0.0,0.0,-0.48,4.35,-0.20,0.83,57.644,139.0,False,,,1,,looks to defend off the front foot but gets beaten
438,2,South Africa,Pakistan,297583,42639,Kyle Abbott,AB de Villiers,Shahid Afridi,y,24.5,0.0,0.0,0.0,119.0,169.0,6.0,-0.44,8.94,-0.21,0.88,65.076,139.0,False,,,1,,drags the length as Abbott fails to punish him away through the off side
439,2,South Africa,Pakistan,297583,42639,Kyle Abbott,AB de Villiers,Shahid Afridi,y,24.6,0.0,0.0,0.0,156.0,181.0,6.0,-0.34,3.91,-0.38,0.46,57.439,139.0,False,,,1,,keeps out this final delivery to get AB back on the hot seat
440,2,South Africa,Pakistan,44936,429981,AB de Villiers,Kyle Abbott,Mohammad Irfan,y,25.1,1.0,1.0,0.0,282.0,224.0,3.0,0.27,9.64,-0.31,1.39,86.955,140.0,False,,,0,,"AB livin' la vida loca as he looks to go over cow corner, but ends up getting a top-edge which falls just out of reach of the midwicket fielder"
441,2,South Africa,Pakistan,297583,429981,Kyle Abbott,AB de Villiers,Mohammad Irfan,y,25.2,1.0,1.0,0.0,253.0,203.0,3.0,-0.28,-0.43,-0.26,0.12,85.825,141.0,False,,,1,,manages to get to the other end with a clip through the same region
442,2,South Africa,Pakistan,44936,429981,AB de Villiers,Kyle Abbott,Mohammad Irfan,y,25.3,0.0,0.0,0.0,134.0,179.0,6.0,0.27,6.78,-0.03,0.84,74.985,141.0,False,,,1,,"backs away in an attempt to try and crash him through the covers, but soon after Irfan pulls up as he signals that he is having some trouble with the back of his right leg"
443,2,South Africa,Pakistan,44936,429981,AB de Villiers,Kyle Abbott,Mohammad Irfan,y,25.4,0.0,0.0,0.0,179.0,186.0,5.0,0.14,8.84,-0.52,1.21,83.126,141.0,False,,,1,,"Irfan looked a touch ungainly as he delivered that ball, but is not punished as it ends up near his feet in the end"
444,2,South Africa,Pakistan,44936,429981,AB de Villiers,Kyle Abbott,Mohammad Irfan,y,25.5,1.0,1.0,0.0,325.0,233.0,3.0,0.38,10.73,-0.08,1.50,80.144,142.0,False,,,1,,short and pulled fiercely by AB as midwicket fails to pick this up before the sweeper at deep midwicket came round to field the ball
445,2,South Africa,Pakistan,297583,429981,Kyle Abbott,AB de Villiers,Mohammad Irfan,y,25.6,0.0,0.0,0.0,0.0,0.0,0.0,0.21,11.24,-0.90,1.65,83.491,142.0,False,,,1,,shortish length going across which is allowed to scream through to the keeper
446,2,South Africa,Pakistan,44936,42639,AB de Villiers,Kyle Abbott,Shahid Afridi,y,26.1,0.0,0.0,0.0,132.0,194.0,6.0,-0.19,4.40,-0.13,0.51,59.266,142.0,False,,,1,,slides one in on middle and off which is defended away to extra-cover
447,2,South Africa,Pakistan,44936,42639,AB de Villiers,Kyle Abbott,Shahid Afridi,y,26.2,0.0,1.0,1.0,0.0,0.0,0.0,-0.25,3.62,-0.22,0.42,59.663,143.0,False,,,0,Lb,"strikes AB on the full outside off, with Afridi going straight up for it. The keeper and captain have come to discuss the prospect of taking a <b>review</b>, which they end up doing. Replays confirm that this did indeed land outside off before turning away. He was also quite a long way down, so it would have been harsh to have given it anyways. Wasted review for Pakistan there"
448,2,South Africa,Pakistan,297583,42639,Kyle Abbott,AB de Villiers,Shahid Afridi,y,26.3,0.0,0.0,0.0,154.0,188.0,6.0,-0.30,6.67,-0.10,0.81,-2.237,143.0,False,,,1,,flighted just outside off as this is struck back to the bowler
449,2,South Africa,Pakistan,297583,42639,Kyle Abbott,AB de Villiers,Shahid Afridi,y,26.4,4.0,4.0,0.0,230.0,12.0,1.0,,,,,,147.0,False,,,1,,strays down the leg side as Abbott gets a tiny inside-edge before rushing past Sarfraz and the short backward square fielder to the boundary at fine leg
450,2,South Africa,Pakistan,297583,42639,Kyle Abbott,AB de Villiers,Shahid Afridi,y,26.5,0.0,0.0,0.0,138.0,184.0,6.0,-0.30,6.65,-0.10,0.77,63.781,147.0,False,,,1,,gets his body solidly behind the line of this Afridi special
451,2,South Africa,Pakistan,297583,42639,Kyle Abbott,AB de Villiers,Shahid Afridi,y,26.6,1.0,1.0,0.0,150.0,293.0,5.0,-0.39,3.13,-0.15,0.47,55.025,148.0,False,,,1,,picks up a single off the last ball with a drive down to long off
452,2,South Africa,Pakistan,297583,323244,Kyle Abbott,AB de Villiers,Rahat Ali,y,27.1,1.0,1.0,0.0,174.0,166.0,6.0,-0.06,8.06,-0.41,0.88,82.554,149.0,False,,,1,,"length delivery outside of off which they are able to steal a run to as this one is dead-batted close to the body, with no one bothered to come forward to put pressure"
453,2,South Africa,Pakistan,44936,323244,AB de Villiers,Kyle Abbott,Rahat Ali,y,27.2,4.0,4.0,0.0,21.0,110.0,7.0,-0.42,6.13,-0.91,0.71,87.023,153.0,False,,,1,,slashes hard at this full delivery outside off as he just gets it up and over backward point to pickup four
454,2,South Africa,Pakistan,44936,323244,AB de Villiers,Kyle Abbott,Rahat Ali,y,27.3,1.0,1.0,0.0,169.0,294.0,5.0,-0.03,8.47,-0.41,0.94,83.550,154.0,False,,,1,,short of a length which is punched away through long off for one
455,2,South Africa,Pakistan,297583,323244,Kyle Abbott,AB de Villiers,Rahat Ali,y,27.4,0.0,0.0,0.0,0.0,0.0,0.0,0.08,12.19,-0.56,2.00,81.930,154.0,False,,,1,,"short, outside of off, as Abbott weaves well out of its line"
456,2,South Africa,Pakistan,297583,323244,Kyle Abbott,AB de Villiers,Rahat Ali,y,27.5,0.0,0.0,0.0,123.0,175.0,6.0,0.09,9.21,-0.39,1.19,83.632,154.0,False,,,1,,short ball which is defended away close to the body on the off side
457,2,South Africa,Pakistan,297583,323244,Kyle Abbott,AB de Villiers,Rahat Ali,y,27.6,0.0,0.0,0.0,215.0,175.0,3.0,,,,,,154.0,False,,,1,,keeps out this short of a length which shapes in on him
458,2,South Africa,Pakistan,44936,42639,AB de Villiers,Kyle Abbott,Shahid Afridi,y,28.1,1.0,1.0,0.0,245.0,287.0,4.0,-0.12,4.59,0.04,0.62,60.103,155.0,False,,,1,,picks up a single through long on
459,2,South Africa,Pakistan,297583,42639,Kyle Abbott,AB de Villiers,Shahid Afridi,y,28.2,0.0,0.0,0.0,140.0,190.0,6.0,-0.05,4.77,0.02,0.74,57.270,155.0,False,,,1,,crouches nice and low to keep out this one on middle and off
460,2,South Africa,Pakistan,297583,42639,Kyle Abbott,AB de Villiers,Shahid Afridi,y,28.3,1.0,1.0,0.0,202.0,245.0,4.0,0.00,3.76,0.20,0.53,59.746,156.0,False,,,1,,steers down Afridi to long on to get AB on strike
461,2,South Africa,Pakistan,44936,42639,AB de Villiers,Kyle Abbott,Shahid Afridi,y,28.4,6.0,6.0,0.0,67.0,344.0,5.0,-0.50,5.40,-0.48,0.70,59.679,162.0,False,,,1,,"calculated risk from AB which comes off beautifully as he sacheys down to tonk this over long off to bring up his <b>fifty</b>. Has been a wonderful knock so far, but he still has plenty to do"
462,2,South Africa,Pakistan,44936,42639,AB de Villiers,Kyle Abbott,Shahid Afridi,y,28.5,6.0,6.0,0.0,359.0,194.0,3.0,-0.05,5.81,-0.09,0.70,58.294,168.0,False,,,1,,this time targets backward square with a powerful lofted sweep to this one slid in by Afridi. Had enough elevation on it to go over the rope comfortably
463,2,South Africa,Pakistan,44936,42639,AB de Villiers,Kyle Abbott,Shahid Afridi,y,28.6,0.0,0.0,0.0,145.0,191.0,6.0,-0.13,4.93,-0.17,0.67,59.882,168.0,False,,,1,,drives one on the up to the silly mid-off fielder to end a productive over for South Africa
464,2,South Africa,Pakistan,297583,323244,Kyle Abbott,AB de Villiers,Rahat Ali,y,29.1,4.0,4.0,0.0,150.0,348.0,5.0,-0.13,6.25,-0.40,0.71,84.419,172.0,False,,,1,,easy as you like as he punches away this Rahat delivery through long off for a boundary
465,2,South Africa,Pakistan,297583,323244,Kyle Abbott,AB de Villiers,Rahat Ali,y,29.2,0.0,0.0,0.0,163.0,136.0,8.0,0.11,9.15,-0.32,1.05,84.047,172.0,True,caught,297583,0,,"and Rahat plucks a big wicket as Abbott feathers an outside edge to this back of a length, with Younis taking a wonderful catch at second slip as he got low to his left. That could be huge as South Africa are still adrift by 60 runs"
466,2,South Africa,Pakistan,46538,323244,Morne Morkel,AB de Villiers,Rahat Ali,n,29.3,0.0,0.0,0.0,0.0,0.0,0.0,0.52,8.23,0.43,0.83,84.529,172.0,False,,,1,,elects to leave this length delivery outside off stump
467,2,South Africa,Pakistan,46538,323244,Morne Morkel,AB de Villiers,Rahat Ali,n,29.4,0.0,0.0,0.0,155.0,183.0,6.0,0.38,9.38,0.11,1.13,85.792,172.0,False,,,1,,"length delivery which is fended away softly on the leg side, as he is mindful of the close-in fielder in the vicinity"
468,2,South Africa,Pakistan,46538,323244,Morne Morkel,AB de Villiers,Rahat Ali,n,29.5,0.0,1.0,1.0,0.0,0.0,0.0,0.51,13.60,0.42,2.67,85.098,173.0,False,,,1,Wd,doesn't bother to tamper with this shortish length flying through outside off stump
469,2,South Africa,Pakistan,46538,323244,Morne Morkel,AB de Villiers,Rahat Ali,n,29.5,4.0,4.0,0.0,359.0,185.0,3.0,0.51,9.18,0.67,1.02,81.525,177.0,False,,,1,,"slaps away Rahat square off the wicket on the off side, much to the jubilation of the South African ranks both in the dressing room and at the ground"
470,2,South Africa,Pakistan,46538,323244,Morne Morkel,AB de Villiers,Rahat Ali,n,29.6,0.0,0.0,0.0,283.0,185.0,3.0,0.28,7.05,0.17,0.92,80.971,177.0,False,,,1,,gets away with an uppish strike through the off side as AB tells Morne to hang tight at his end
471,2,South Africa,Pakistan,44936,317252,AB de Villiers,Morne Morkel,Sohail Khan,y,30.1,0.0,0.0,0.0,0.0,0.0,0.0,-0.44,5.48,-0.42,0.55,85.146,177.0,False,,,1,,allows this length delivery to go through to the keeper
472,2,South Africa,Pakistan,44936,317252,AB de Villiers,Morne Morkel,Sohail Khan,y,30.2,4.0,4.0,0.0,277.0,329.0,4.0,-0.04,5.38,0.17,0.54,81.561,181.0,False,,,1,,"goes down the pitch before blitzing this length delivery through long on, with the mid-on fielder, who was up in the circle, running hard to his right and back to try and cut this off, before putting in a fruitless dive as this continued on to the boundary. Didn't really middle it, but if AB wants a boundary, AB gets a boundary"
473,2,South Africa,Pakistan,44936,317252,AB de Villiers,Morne Morkel,Sohail Khan,y,30.3,1.0,1.0,0.0,212.0,312.0,4.0,-0.10,5.31,0.04,0.50,84.850,182.0,False,,,1,,AB elects to take the single with a blow down the ground to long on
474,2,South Africa,Pakistan,46538,317252,Morne Morkel,AB de Villiers,Sohail Khan,n,30.4,1.0,1.0,0.0,197.0,244.0,4.0,-0.14,9.21,0.23,1.07,83.203,183.0,False,,,1,,Morne pushes at this length delivery towards mid-off as he just makes his ground at the other end before the throw from the fielder. Gets AB back on strike
475,2,South Africa,Pakistan,44936,317252,AB de Villiers,Morne Morkel,Sohail Khan,y,30.5,1.0,1.0,0.0,280.0,56.0,1.0,0.63,-1.35,0.55,0.25,84.668,184.0,False,,,1,,"searching for the yorker as he instead offers a low, full toss down the leg side which is helped away by AB through square-leg"
476,2,South Africa,Pakistan,46538,317252,Morne Morkel,AB de Villiers,Sohail Khan,n,30.6,0.0,1.0,1.0,0.0,0.0,0.0,-0.26,12.97,-0.07,2.12,81.798,185.0,False,,,1,Wd,"bangs in a short delivery which is given a wide by the leg umpire. It's kind of funny because Wasim was asked just before what he would have done, and he specifically said not to bowl that kind of delivery, which Sohail naturally ended up doing anyways"
477,2,South Africa,Pakistan,46538,317252,Morne Morkel,AB de Villiers,Sohail Khan,n,30.6,0.0,0.0,0.0,0.0,0.0,0.0,-0.26,11.40,-0.25,1.32,82.498,185.0,False,,,0,,fires in a good length which raps the top of the pads of Morne as he looked to defend
478,2,South Africa,Pakistan,44936,43590,AB de Villiers,Morne Morkel,Wahab Riaz,y,31.1,0.0,0.0,0.0,112.0,55.0,8.0,-0.17,5.22,0.21,0.59,87.814,185.0,False,,,1,,goes round the wicket to AB as he gets away a shot through third man. Doesn't bother to run though
479,2,South Africa,Pakistan,44936,43590,AB de Villiers,Morne Morkel,Wahab Riaz,y,31.2,6.0,6.0,0.0,360.0,203.0,3.0,0.44,-1.32,0.32,0.26,88.947,191.0,False,,,1,,"AB is just too good. Riaz offers a low, full toss and you just can't bowl like this to him, as he smokes this high over midwicket to pick up a valuable six"
480,2,South Africa,Pakistan,44936,43590,AB de Villiers,Morne Morkel,Wahab Riaz,y,31.3,0.0,0.0,0.0,184.0,199.0,4.0,-0.50,10.18,0.21,1.36,86.428,191.0,False,,,1,,keeps out this back of a length from round the wicket
